v17_837_0,0,1,John D. Haynes House,http://dbpedia.org/resource/John_D._Haynes_House
v17_837_0,0,2,John Church Company Building,http://dbpedia.org/resource/John_Church_Company_Building
v17_837_0,0,3,John Christian and Bertha Landrock Reichert House,http://dbpedia.org/resource/John_Christian_and_Bertha_Landrock_Reichert_House
v17_837_0,0,4,John Calvin Stevens House,http://dbpedia.org/resource/John_Calvin_Stevens_House
v17_837_0,0,5,John C. Proctor Recreation Center,http://dbpedia.org/resource/John_C._Proctor_Recreation_Center
v17_837_0,0,6,John B. Cary School,http://dbpedia.org/resource/John_B._Cary_School
v17_837_0,0,7,John A. Green Estate,http://dbpedia.org/resource/John_A._Green_Estate
v17_837_0,0,8,Joel W. Solomon Federal Building and United States Courthouse,http://dbpedia.org/resource/Joel_W._Solomon_Federal_Building_and_United_States_Courthouse
v17_837_0,0,9,Joel McCrea Ranch,http://dbpedia.org/resource/Joel_McCrea_Ranch
v17_837_0,0,10,Jessie Eyman–Wilma Judson House,http://dbpedia.org/resource/Jessie_Eyman–Wilma_Judson_House
v17_837_0,0,11,Jefferson County Jail,"http://dbpedia.org/resource/Jefferson_County_Jail_(Madison,_Indiana)"
v17_837_0,0,12,Jefferson County Courthouse,http://dbpedia.org/resource/Louisville_Metro_Hall
v17_837_0,0,13,Jeff Davis County Courthouse,http://dbpedia.org/resource/Jeff_Davis_County_Courthouse_(Texas)
v17_837_0,0,14,Jeanne Manor Apartment Building,http://dbpedia.org/resource/Jeanne_Manor_Apartment_Building
v17_837_0,0,15,Jayne Estate Building,http://dbpedia.org/resource/Jayne_Estate_Building
v17_837_0,0,16,Jasper County Courthouse,http://dbpedia.org/resource/Jasper_County_Courthouse_(South_Carolina)
v17_837_0,0,17,James and Mary Forsyth House,http://dbpedia.org/resource/James_and_Mary_Forsyth_House
v17_837_0,0,18,James L. Fleming House,http://dbpedia.org/resource/James_L._Fleming_House
v17_837_0,0,19,James L. Coke House,http://dbpedia.org/resource/James_L._Coke_House
v17_837_0,0,20,James A. Redden Federal Courthouse,http://dbpedia.org/resource/James_A._Redden_Federal_Courthouse
v17_837_0,0,21,James A. Farley Post Office Building,http://dbpedia.org/resource/James_A._Farley_Building
v17_837_0,0,22,Jackson Uptown Commercial Historic District,http://dbpedia.org/resource/Jackson_Uptown_Commercial_Historic_District
v17_837_0,0,23,Jackson County Courthouse,"http://dbpedia.org/resource/Jackson_County_Courthouse_(Independence,_Missouri)"
v17_837_0,0,24,Jack Lamberson House,http://dbpedia.org/resource/Jack_Lamberson_House
v17_837_0,0,25,J. R. Allen House,http://dbpedia.org/resource/J._R._Allen_House
v17_837_0,0,26,J. Nelson Kelly House,http://dbpedia.org/resource/J._Nelson_Kelly_House
v17_837_0,0,27,J. Marvin Jones Federal Building and United States Courthouse,http://dbpedia.org/resource/J._Marvin_Jones_Federal_Building_and_Mary_Lou_Robinson_United_States_Courthouse
v17_837_0,0,28,J. G. Edwards House,http://dbpedia.org/resource/J._G._Edwards_House
v17_837_0,0,29,J. Clarence Kind House,http://dbpedia.org/resource/J._Clarence_Kind_House
v17_837_0,0,30,Islesford Historical Museum and Blue Duck Ships Store,http://dbpedia.org/resource/Islesford_Historical_Museum_and_Blue_Duck_Ships_Store
v17_837_0,0,31,Isaac Farrar Mansion,http://dbpedia.org/resource/Isaac_Farrar_Mansion
v17_837_0,0,32,Isaac Bell House,http://dbpedia.org/resource/Isaac_Bell_House
