1180_2,2,1,Illinois Fighting Illini men's basketball,http://dbpedia.org/resource/Illinois_Fighting_Illini_men's_basketball
1180_2,2,2,Wyoming Cowboys basketball,http://dbpedia.org/resource/Wyoming_Cowboys_basketball
1180_2,2,3,Oklahoma State Cowboys basketball,http://dbpedia.org/resource/Oklahoma_State_Cowboys_basketball
1180_2,2,4,Stanford Cardinal men's basketball,http://dbpedia.org/resource/Stanford_Cardinal_men's_basketball
1180_2,2,5,Stanford Cardinal men's basketball,http://dbpedia.org/resource/Stanford_Cardinal_men's_basketball
1180_2,2,6,North Carolina Tar Heels men's basketball,http://dbpedia.org/resource/North_Carolina_Tar_Heels_men's_basketball
1180_2,2,7,Stanford Cardinal men's basketball,http://dbpedia.org/resource/Stanford_Cardinal_men's_basketball
