1254_0,0,1,Summit Lake Provincial Park,http://dbpedia.org/resource/Chain_Lakes_Provincial_Park
1254_0,0,2,Sulphur Passage Provincial Park,http://dbpedia.org/resource/Sulphur_Passage_Provincial_Park
1254_0,0,3,Sukunka Falls Provincial Park,http://dbpedia.org/resource/Sukunka_Falls_Provincial_Park
1254_0,0,4,Sugaw Creek Park,http://dbpedia.org/resource/Fish_Creek_Provincial_Park
1254_0,0,5,Sugarbowl-Grizzly Den Provincial Park and Protected Area,http://dbpedia.org/resource/Sugarbowl-Grizzly_Den_Provincial_Park_and_Protected_Area
1254_0,0,6,Sue Channel Provincial Park,http://dbpedia.org/resource/Sue_Channel_Provincial_Park
1254_0,0,7,Sudeten Provincial Park,http://dbpedia.org/resource/Sudeten_Provincial_Park
1254_0,0,8,Stuart River Provincial Park,http://dbpedia.org/resource/Stuart_River_Provincial_Park
1254_0,0,9,Stuart Lake Marine Provincial Park,http://dbpedia.org/resource/Stuart_Lake_Marine_Provincial_Park
1254_0,0,10,Stone Mountain Provincial Park,http://dbpedia.org/resource/Pink_Mountain_Provincial_Park
1254_0,0,11,Stikine River Provincial Park,http://dbpedia.org/resource/Stikine_River_Provincial_Park
1254_0,0,12,Stemwinder Provincial Park,http://dbpedia.org/resource/Stemwinder_Provincial_Park
1254_0,0,13,Steelhead Provincial Park,http://dbpedia.org/resource/Steelhead_Provincial_Park
1254_0,0,14,Stawamus Chief Provincial Park,http://dbpedia.org/resource/Stawamus_Chief_Provincial_Park
1254_0,0,15,Stamp River Provincial Park,http://dbpedia.org/resource/Stamp_River_Provincial_Park
1254_0,0,16,Stagleap Provincial Park,http://dbpedia.org/resource/Stagleap_Provincial_Park
1254_0,0,17,St. Mary's Alpine Provincial Park,http://dbpedia.org/resource/St._Mary's_Alpine_Provincial_Park
1254_0,0,18,Squitty Bay Provincial Park,http://dbpedia.org/resource/Squitty_Bay_Provincial_Park
1254_0,0,19,Sproat Lake Provincial Park,http://dbpedia.org/resource/Sproat_Lake_Provincial_Park
1254_0,0,20,Spipiyus Provincial Park,http://dbpedia.org/resource/Spipiyus_Provincial_Park
1254_0,0,21,Spider Lake Provincial Park,http://dbpedia.org/resource/Chain_Lakes_Provincial_Park
1254_0,0,22,Spectacle Lake Provincial Park,http://dbpedia.org/resource/Chain_Lakes_Provincial_Park
1254_0,0,23,Spatsizi Plateau Wilderness Provincial Park,http://dbpedia.org/resource/Spatsizi_Plateau_Wilderness_Provincial_Park
1254_0,0,24,Spatsizi Headwaters Provincial Park,http://dbpedia.org/resource/Spatsizi_Headwaters_Provincial_Park
1254_0,0,25,Sowchea Bay Provincial Park,http://dbpedia.org/resource/Sowchea_Bay_Provincial_Park
1254_0,0,26,South Texada Island Provincial Park,http://dbpedia.org/resource/South_Texada_Island_Provincial_Park
1254_0,0,27,South Chilcotin Mountains Provincial Park,http://dbpedia.org/resource/South_Chilcotin_Mountains_Provincial_Park
1254_0,0,28,Sooke Potholes Provincial Park,http://dbpedia.org/resource/Sooke_Potholes_Provincial_Park
1254_0,0,29,Sooke Mountain Provincial Park,http://dbpedia.org/resource/Duck_Mountain_Provincial_Park_(Manitoba)
1254_0,0,30,Smith River Falls – Fort Halkett Provincial Park,http://dbpedia.org/resource/Smith_River_Falls_–_Fort_Halkett_Provincial_Park
1254_0,0,31,Smelt Bay Provincial Park,http://dbpedia.org/resource/Pilot_Bay_Provincial_Park
1254_0,0,32,Small River Caves Provincial Park,http://dbpedia.org/resource/Small_River_Caves_Provincial_Park
1254_0,0,33,Small Inlet Marine Provincial Park,http://dbpedia.org/resource/Small_Inlet_Marine_Provincial_Park
1254_0,0,34,Slim Creek Provincial Park,http://dbpedia.org/resource/Fish_Creek_Provincial_Park
1254_0,0,35,Sleeping Beauty Mountain Provincial Park,http://dbpedia.org/resource/Sleeping_Beauty_Mountain_Provincial_Park
1254_0,0,36,Skookumchuck Rapids Provincial Park,http://dbpedia.org/resource/Skookumchuck_Narrows_Provincial_Park
1254_0,0,37,Skookumchuck Narrows Provincial Park,http://dbpedia.org/resource/Skookumchuck_Narrows_Provincial_Park
1254_0,0,38,Skaha Bluffs Provincial Park,http://dbpedia.org/resource/Skaha_Bluffs_Provincial_Park
1254_0,0,39,Skagit Valley Provincial Park,http://dbpedia.org/resource/Skagit_Valley_Provincial_Park
1254_0,0,40,Sir Alexander Mackenzie Provincial Park,http://dbpedia.org/resource/Sir_Alexander_Mackenzie_Provincial_Park
1254_0,0,41,Simson Marine Provincial Park,http://dbpedia.org/resource/Simson_Marine_Provincial_Park
1254_0,0,42,Silver Star Provincial Park,http://dbpedia.org/resource/Silver_Lake_Provincial_Park_(Ontario)
1254_0,0,43,Silver Lake Provincial Park,http://dbpedia.org/resource/Silver_Lake_Provincial_Park_(Ontario)
1254_0,0,44,Silver Beach Provincial Park,http://dbpedia.org/resource/Silver_Lake_Provincial_Park_(Ontario)
1254_0,0,45,Sikanni Old Growth Provincial Park,http://dbpedia.org/resource/Sikanni_Old_Growth_Provincial_Park
1254_0,0,46,Shuswap River Islands Provincial Park,http://dbpedia.org/resource/Shuswap_River_Islands_Provincial_Park
1254_0,0,47,Shuswap Lake Provincial Park,http://dbpedia.org/resource/Chain_Lakes_Provincial_Park
1254_0,0,48,Shuswap Lake Marine Provincial Park,http://dbpedia.org/resource/Shuswap_Lake_Marine_Provincial_Park
1254_0,0,49,Seven Sisters Provincial Park and Protected Area,http://dbpedia.org/resource/Seven_Sisters_Provincial_Park_and_Protected_Area
1254_0,0,50,Seeley Lake Provincial Park,http://dbpedia.org/resource/Chain_Lakes_Provincial_Park
1254_0,0,51,Sechelt Inlets Marine Provincial Park,http://dbpedia.org/resource/Sechelt_Inlets_Marine_Provincial_Park
1254_0,0,52,Schoolhouse Lake Provincial Park,http://dbpedia.org/resource/Chain_Lakes_Provincial_Park
1254_0,0,53,Schoen Lake Provincial Park,http://dbpedia.org/resource/Chain_Lakes_Provincial_Park
1254_0,0,54,Scatter River Old Growth Provincial Park,http://dbpedia.org/resource/Scatter_River_Old_Growth_Provincial_Park
1254_0,0,55,Sasquatch Provincial Park,http://dbpedia.org/resource/Sasquatch_Provincial_Park
1254_0,0,56,Sargeant Bay Provincial Park,http://dbpedia.org/resource/Sargeant_Bay_Provincial_Park
1254_0,0,57,Santa Gertrudis-Boca del Infierno Provincial Park,http://dbpedia.org/resource/Santa_Gertrudis-Boca_del_Infierno_Provincial_Park
1254_0,0,58,Sandy Island Marine Provincial Park,http://dbpedia.org/resource/Flores_Island_Marine_Provincial_Park
1254_0,0,59,Sandwell Provincial Park,http://dbpedia.org/resource/Sandwell_Provincial_Park
1254_0,0,60,Saltery Bay Provincial Park,http://dbpedia.org/resource/Saltery_Bay_Provincial_Park
1254_0,0,61,Sabine Channel Marine Provincial Park,http://dbpedia.org/resource/Sabine_Channel_Marine_Provincial_Park
1254_0,0,62,Ryan Provincial Park,http://dbpedia.org/resource/Ryan_Provincial_Park
1254_0,0,63,Ruth Lake Provincial Park,http://dbpedia.org/resource/Chain_Lakes_Provincial_Park
1254_0,0,64,Rugged Point Marine Provincial Park,http://dbpedia.org/resource/Rugged_Point_Marine_Provincial_Park
1254_0,0,65,Ruckle Provincial Park,http://dbpedia.org/resource/Ruckle_Provincial_Park
1254_0,0,66,Rubyrock Lake Provincial Park,http://dbpedia.org/resource/Chain_Lakes_Provincial_Park
1254_0,0,67,Ross Lake Provincial Park,http://dbpedia.org/resource/Chain_Lakes_Provincial_Park
1254_0,0,68,Rosewall Creek Provincial Park,http://dbpedia.org/resource/Roberts_Creek_Provincial_Park
1254_0,0,69,Rosebery Provincial Park,http://dbpedia.org/resource/Rosebery_Provincial_Park
1254_0,0,70,Roscoe Bay Provincial Park,http://dbpedia.org/resource/Gordon_Bay_Provincial_Park
1254_0,0,71,Rolley Lake Provincial Park,http://dbpedia.org/resource/Chain_Lakes_Provincial_Park
1254_0,0,72,Roderick Haig-Brown Provincial Park,http://dbpedia.org/resource/Tsútswecw_Provincial_Park
1254_0,0,73,Rocky Point Park,http://dbpedia.org/resource/Rocky_Point_Park
1254_0,0,74,Rock Bay Marine Provincial Park,http://dbpedia.org/resource/Echo_Bay_Marine_Provincial_Park
1254_0,0,75,Roberts Creek Provincial Park,http://dbpedia.org/resource/Roberts_Creek_Provincial_Park
1254_0,0,76,Rendezvous Island South Provincial Park,http://dbpedia.org/resource/Rendezvous_Island_South_Provincial_Park
1254_0,0,77,Renaissance Park,"http://dbpedia.org/resource/Renaissance_Park_(Charlotte,_North_Carolina)"
1254_0,0,78,Redfern-Keily Provincial Park,http://dbpedia.org/resource/Redfern-Keily_Provincial_Park
1254_0,0,79,Red Bluff Provincial Park,http://dbpedia.org/resource/Red_Bluff_Provincial_Park
1254_0,0,80,Rebecca Spit Marine Provincial Park,http://dbpedia.org/resource/Rebecca_Spit_Marine_Provincial_Park
1254_0,0,81,Rearguard Falls,http://dbpedia.org/resource/Rearguard_Falls_Provincial_Park
1254_0,0,82,Read Island Provincial Park,http://dbpedia.org/resource/Memory_Island_Provincial_Park
1254_0,0,83,Rainbow Alley Provincial Park,http://dbpedia.org/resource/Rainbow_Falls_Provincial_Park
1254_0,0,84,"Queen Elizabeth Park, British Columbia","http://dbpedia.org/resource/Queen_Elizabeth_Park,_British_Columbia"
1254_0,0,85,Quatsino Provincial Park,http://dbpedia.org/resource/Quatsino_Provincial_Park
1254_0,0,86,Pyramid Creek Falls Provincial Park,http://dbpedia.org/resource/Pyramid_Creek_Falls_Provincial_Park
1254_0,0,87,Pure Lake Provincial Park,http://dbpedia.org/resource/Chain_Lakes_Provincial_Park
1254_0,0,88,Purden Lake Provincial Park,http://dbpedia.org/resource/Purden_Lake_Provincial_Park
1254_0,0,89,Puntchesakut Lake Provincial Park,http://dbpedia.org/resource/Chain_Lakes_Provincial_Park
1254_0,0,90,Pukeashun Provincial Park,http://dbpedia.org/resource/Pukeashun_Provincial_Park
1254_0,0,91,Ptarmigan Creek Provincial Park and Protected Area,http://dbpedia.org/resource/Ptarmigan_Creek_Provincial_Park_and_Protected_Area
1254_0,0,92,Prudhomme Lake Provincial Park,http://dbpedia.org/resource/Chain_Lakes_Provincial_Park
1254_0,0,93,Prophet River Wayside Provincial Park,http://dbpedia.org/resource/Prophet_River_Wayside_Provincial_Park
1254_0,0,94,Prophet River Hotsprings Provincial Park,http://dbpedia.org/resource/Prophet_River_Hotsprings_Provincial_Park
1254_0,0,95,Princess Louisa Marine Provincial Park,http://dbpedia.org/resource/Princess_Louisa_Marine_Provincial_Park
1254_0,0,96,Premier Lake Provincial Park,http://dbpedia.org/resource/Chain_Lakes_Provincial_Park
1254_0,0,97,Porpoise Bay Provincial Park,http://dbpedia.org/resource/Porpoise_Bay_Provincial_Park
1254_0,0,98,Porcupine Meadows Provincial Park,http://dbpedia.org/resource/Porcupine_Meadows_Provincial_Park
1254_0,0,99,Pirates Cove Marine Provincial Park,http://dbpedia.org/resource/Pirates_Cove_Marine_Provincial_Park
1254_0,0,100,Pinnacles Provincial Park,http://dbpedia.org/resource/Pinnacles_Provincial_Park
1254_0,0,101,Pine River Breaks Provincial Park,http://dbpedia.org/resource/Pine_River_Breaks_Provincial_Park
1254_0,0,102,Pine Le Moray Provincial Park,http://dbpedia.org/resource/Pine_Le_Moray_Provincial_Park
1254_0,0,103,Pilot Bay Provincial Park,http://dbpedia.org/resource/Pilot_Bay_Provincial_Park
1254_0,0,104,Pillar Provincial Park,http://dbpedia.org/resource/Pillar_Provincial_Park
1254_0,0,105,Penrose Island Marine Provincial Park,http://dbpedia.org/resource/Flores_Island_Marine_Provincial_Park
1254_0,0,106,Pennask Lake Provincial Park,http://dbpedia.org/resource/Chain_Lakes_Provincial_Park
1254_0,0,107,Pennask Creek Provincial Park,http://dbpedia.org/resource/Fish_Creek_Provincial_Park
1254_0,0,108,Peace River Corridor Provincial Park,http://dbpedia.org/resource/Peace_River_Corridor_Provincial_Park
1254_0,0,109,Paul Lake Provincial Park,http://dbpedia.org/resource/Chain_Lakes_Provincial_Park
1254_0,0,110,Painted Bluffs Provincial Park,http://dbpedia.org/resource/Painted_Bluffs_Provincial_Park
1254_0,0,111,Paarens Beach Provincial Park,http://dbpedia.org/resource/French_Beach_Provincial_Park
1254_0,0,112,Owyacumish River Provincial Park,http://dbpedia.org/resource/Owyacumish_River_Provincial_Park
1254_0,0,113,Otter Lake Provincial Park,http://dbpedia.org/resource/Chain_Lakes_Provincial_Park
1254_0,0,114,Oregon Jack Provincial Park,http://dbpedia.org/resource/Oregon_Jack_Provincial_Park
1254_0,0,115,Oregana Creek Provincial Park,http://dbpedia.org/resource/Kleanza_Creek_Provincial_Park
1254_0,0,116,Oliver Cove Marine Provincial Park,http://dbpedia.org/resource/Oliver_Cove_Marine_Provincial_Park
1254_0,0,117,Okeover Arm Provincial Park,http://dbpedia.org/resource/Okeover_Arm_Provincial_Park
1254_0,0,118,Okanagan Falls Provincial Park,http://dbpedia.org/resource/Okanagan_Falls_Provincial_Park
1254_0,0,119,Octopus Islands Marine Provincial Park,http://dbpedia.org/resource/Flores_Island_Marine_Provincial_Park
1254_0,0,120,Nuntsi Provincial Park,http://dbpedia.org/resource/Nuntsi_Provincial_Park
1254_0,0,121,Nuchatlitz Provincial Park,http://dbpedia.org/resource/Nuchatlitz_Provincial_Park
1254_0,0,122,North Thormanby Island,http://dbpedia.org/resource/North_Thormanby_Island
1254_0,0,123,North Thompson River Provincial Park,http://dbpedia.org/resource/North_Thompson_River_Provincial_Park
1254_0,0,124,North Thompson Oxbows Manteau Provincial Park,http://dbpedia.org/resource/North_Thompson_Oxbows_Manteau_Provincial_Park
1254_0,0,125,North Thompson Oxbows Jensen Island Provincial Park,http://dbpedia.org/resource/North_Thompson_Oxbows_Jensen_Island_Provincial_Park
1254_0,0,126,North Thompson Oxbows East Provincial Park,http://dbpedia.org/resource/North_Thompson_Oxbows_East_Provincial_Park
1254_0,0,127,North Thompson Islands Provincial Park,http://dbpedia.org/resource/North_Thompson_Islands_Provincial_Park
1254_0,0,128,Nitinat River Provincial Park,http://dbpedia.org/resource/Nitinat_River_Provincial_Park
1254_0,0,129,Niskonlith Lake Provincial Park,http://dbpedia.org/resource/Chain_Lakes_Provincial_Park
1254_0,0,130,Ningunsaw Provincial Park,http://dbpedia.org/resource/Ningunsaw_Provincial_Park
1254_0,0,131,Nimpkish Lake Provincial Park,http://dbpedia.org/resource/Nimpkish_Lake_Provincial_Park
1254_0,0,132,Nilkitkwa Lake Provincial Park,http://dbpedia.org/resource/Chain_Lakes_Provincial_Park
1254_0,0,133,Nickel Plate Provincial Park,http://dbpedia.org/resource/Nickel_Plate_Provincial_Park
1254_0,0,134,Netalzul Meadows Provincial Park,http://dbpedia.org/resource/Netalzul_Meadows_Provincial_Park
