1255_0,0,1,Nechako Canyon Protected Area,http://dbpedia.org/resource/Nechako_Canyon_Protected_Area
1255_0,0,2,Nazko Lake Provincial Park,http://dbpedia.org/resource/Chain_Lakes_Provincial_Park
1255_0,0,3,Nation Lakes Provincial Park,http://dbpedia.org/resource/Chain_Lakes_Provincial_Park
1255_0,0,4,Nancy Greene Provincial Park,http://dbpedia.org/resource/Nancy_Greene_Provincial_Park
1255_0,0,5,Nalbeelah Creek Wetlands Provincial Park,http://dbpedia.org/resource/Nalbeelah_Creek_Wetlands_Provincial_Park
1255_0,0,6,Nahatlatch Provincial Park and Protected Area,http://dbpedia.org/resource/Nahatlatch_Provincial_Park_and_Protected_Area
1255_0,0,7,Musket Island Marine Provincial Park,http://dbpedia.org/resource/Flores_Island_Marine_Provincial_Park
1255_0,0,8,Muscovite Lakes Provincial Park,http://dbpedia.org/resource/Chain_Lakes_Provincial_Park
1255_0,0,9,Mudzenchoot Provincial Park,http://dbpedia.org/resource/Mudzenchoot_Provincial_Park
1255_0,0,10,Mud Lake Delta Provincial Park,http://dbpedia.org/resource/Mud_Lake_Delta_Provincial_Park
1255_0,0,11,Moyie Lake Provincial Park,http://dbpedia.org/resource/Chain_Lakes_Provincial_Park
1255_0,0,12,Mountain View Park,http://dbpedia.org/resource/Mountain_View_Park_(North_Vancouver)
1255_0,0,13,Mount Terry Fox Provincial Park,http://dbpedia.org/resource/Mount_Terry_Fox_Provincial_Park
1255_0,0,14,Mount Savona Provincial Park,http://dbpedia.org/resource/Mount_Savona_Provincial_Park
1255_0,0,15,Mount Richardson Provincial Park,http://dbpedia.org/resource/Mount_Richardson_Provincial_Park
1255_0,0,16,Mount Pope Provincial Park,http://dbpedia.org/resource/Mount_Pope_Provincial_Park
1255_0,0,17,Mount Maxwell Provincial Park,http://dbpedia.org/resource/Mount_Pope_Provincial_Park
1255_0,0,18,Mount Griffin Provincial Park,http://dbpedia.org/resource/Mount_Terry_Fox_Provincial_Park
1255_0,0,19,Mount Fernie Provincial Park,http://dbpedia.org/resource/Mount_Fernie_Provincial_Park
1255_0,0,20,Mount Elphinstone Provincial Park,http://dbpedia.org/resource/Mount_Elphinstone_Provincial_Park
1255_0,0,21,Mount Edziza Provincial Park and Recreation Area,http://dbpedia.org/resource/Mount_Edziza_Provincial_Park_and_Recreation_Area
1255_0,0,22,Mount Blanchet Provincial Park,http://dbpedia.org/resource/Mount_Blanchet_Provincial_Park
1255_0,0,23,Morton Lake Provincial Park,http://dbpedia.org/resource/Chain_Lakes_Provincial_Park
1255_0,0,24,Morrissey Provincial Park,http://dbpedia.org/resource/The_Massasauga_Provincial_Park
1255_0,0,25,Morden Colliery Historic Provincial Park,http://dbpedia.org/resource/Morden_Colliery_Historic_Provincial_Park
1255_0,0,26,Moose Valley Provincial Park,http://dbpedia.org/resource/Bow_Valley_Provincial_Park
1255_0,0,27,Monte Lake Provincial Park,http://dbpedia.org/resource/Chain_Lakes_Provincial_Park
1255_0,0,28,Monte Creek Provincial Park,http://dbpedia.org/resource/Bronte_Creek_Provincial_Park
1255_0,0,29,Montague Harbour Marine Provincial Park,http://dbpedia.org/resource/Montague_Harbour_Marine_Provincial_Park
1255_0,0,30,Monck Provincial Park,http://dbpedia.org/resource/Monck_Provincial_Park
1255_0,0,31,Monashee Provincial Park,http://dbpedia.org/resource/The_Massasauga_Provincial_Park
1255_0,0,32,Momich Lakes Provincial Park,http://dbpedia.org/resource/Chain_Lakes_Provincial_Park
1255_0,0,33,Moberly Lake Provincial Park,http://dbpedia.org/resource/Chain_Lakes_Provincial_Park
1255_0,0,34,Miracle Beach Provincial Park,http://dbpedia.org/resource/Miracle_Beach_Provincial_Park
1255_0,0,35,Milligan Hills Provincial Park,http://dbpedia.org/resource/Milligan_Hills_Provincial_Park
1255_0,0,36,Meziadin Lake Provincial Park,http://dbpedia.org/resource/Chain_Lakes_Provincial_Park
1255_0,0,37,Memory Island Provincial Park,http://dbpedia.org/resource/Memory_Island_Provincial_Park
1255_0,0,38,Mehatl Creek Provincial Park,http://dbpedia.org/resource/Bronte_Creek_Provincial_Park
1255_0,0,39,McDonald Creek Provincial Park,http://dbpedia.org/resource/McDonald_Creek_Provincial_Park
1255_0,0,40,McConnell Lake Provincial Park,http://dbpedia.org/resource/McConnell_Lake_Provincial_Park
1255_0,0,41,Marble River Provincial Park,http://dbpedia.org/resource/Marten_River_Provincial_Park
1255_0,0,42,Marble Range Provincial Park,http://dbpedia.org/resource/Marble_Canyon_Provincial_Park
1255_0,0,43,Marble Canyon Provincial Park,http://dbpedia.org/resource/Marble_Canyon_Provincial_Park
1255_0,0,44,Maquinna Marine Provincial Park,http://dbpedia.org/resource/Maquinna_Marine_Provincial_Park
1255_0,0,45,Malaspina Provincial Park,http://dbpedia.org/resource/Malaspina_Provincial_Park
1255_0,0,46,Main Lake Provincial Park,http://dbpedia.org/resource/Chain_Lakes_Provincial_Park
1255_0,0,47,Mabel Lake Provincial Park,http://dbpedia.org/resource/Chain_Lakes_Provincial_Park
1255_0,0,48,Lower Nimpkish Provincial Park,http://dbpedia.org/resource/Lower_Nimpkish_Provincial_Park
1255_0,0,49,Lowe Inlet Marine Provincial Park,http://dbpedia.org/resource/Klewnuggit_Inlet_Marine_Provincial_Park
1255_0,0,50,Loveland Bay Provincial Park,http://dbpedia.org/resource/Loveland_Bay_Provincial_Park
1255_0,0,51,Lockhart Creek Provincial Park,http://dbpedia.org/resource/Lockhart_Creek_Provincial_Park
1255_0,0,52,Little River Nature Park,http://dbpedia.org/resource/Little_River_Nature_Park
1255_0,0,53,Little Andrews Bay Marine Provincial Park,http://dbpedia.org/resource/Little_Andrews_Bay_Marine_Provincial_Park
1255_0,0,54,Liard River Corridor Provincial Park and Protected Area,http://dbpedia.org/resource/Liard_River_Corridor_Provincial_Park_and_Protected_Area
1255_0,0,55,Lazo Wildlife Park,http://dbpedia.org/resource/Lazo_Wildlife_Park
1255_0,0,56,Lawn Point Provincial Park,http://dbpedia.org/resource/Finlayson_Point_Provincial_Park
1255_0,0,57,Lava Forks Provincial Park,http://dbpedia.org/resource/Lava_Forks_Provincial_Park
1255_0,0,58,Lanz and Cox Islands Provincial Park,http://dbpedia.org/resource/Lanz_and_Cox_Islands_Provincial_Park
1255_0,0,59,Lakelse Lake Wetlands Provincial Park,http://dbpedia.org/resource/Lakelse_Lake_Wetlands_Provincial_Park
1255_0,0,60,Lac La Hache Provincial Park,http://dbpedia.org/resource/Lac_La_Hache_Provincial_Park
1255_0,0,61,Kwadacha Wilderness Provincial Park,http://dbpedia.org/resource/Kwadacha_Wilderness_Provincial_Park
1255_0,0,62,Kotcho Lake Village Provincial Park,http://dbpedia.org/resource/Kotcho_Lake_Village_Provincial_Park
1255_0,0,63,Kootenay Lake Provincial Park,http://dbpedia.org/resource/Kootenay_Lake_Provincial_Park
1255_0,0,64,Koksilah River Provincial Park,http://dbpedia.org/resource/Koksilah_River_Provincial_Park
1255_0,0,65,Kluskoil Lake Provincial Park,http://dbpedia.org/resource/Kluskoil_Lake_Provincial_Park
1255_0,0,66,Kleanza Creek Provincial Park,http://dbpedia.org/resource/Kleanza_Creek_Provincial_Park
1255_0,0,67,Kitwanga Mountain Provincial Park,http://dbpedia.org/resource/Tuya_Mountains_Provincial_Park
1255_0,0,68,Kitsumkalum Provincial Park,http://dbpedia.org/resource/Kitsumkalum_Provincial_Park
1255_0,0,69,Kitson Island Marine Provincial Park,http://dbpedia.org/resource/Flores_Island_Marine_Provincial_Park
1255_0,0,70,Kitimat River Provincial Park,http://dbpedia.org/resource/Koksilah_River_Provincial_Park
1255_0,0,71,Kiskatinaw Provincial Park,http://dbpedia.org/resource/Kiskatinaw_Provincial_Park
1255_0,0,72,Kingfisher Creek Provincial Park,http://dbpedia.org/resource/Fish_Creek_Provincial_Park
1255_0,0,73,King George VI Provincial Park,http://dbpedia.org/resource/King_George_VI_Provincial_Park
1255_0,0,74,Kinaskan Lake Provincial Park,http://dbpedia.org/resource/Chain_Lakes_Provincial_Park
1255_0,0,75,Kin Beach Provincial Park,http://dbpedia.org/resource/Kin_Beach_Provincial_Park
1255_0,0,76,Kickininee Provincial Park,http://dbpedia.org/resource/Kickininee_Provincial_Park
1255_0,0,77,Kianuko Provincial Park,http://dbpedia.org/resource/Kianuko_Provincial_Park
1255_0,0,78,Keremeos Columns Provincial Park,http://dbpedia.org/resource/Keremeos_Columns_Provincial_Park
1255_0,0,79,Kennedy River Bog Provincial Park,http://dbpedia.org/resource/Kennedy_River_Bog_Provincial_Park
1255_0,0,80,Kennedy Lake Provincial Park,http://dbpedia.org/resource/Chain_Lakes_Provincial_Park
1255_0,0,81,Kenna Cartwright Park,http://dbpedia.org/resource/Kenna_Cartwright_Park
1255_0,0,82,Kekuli Bay Provincial Park,http://dbpedia.org/resource/Kekuli_Bay_Provincial_Park
1255_0,0,83,Kanaka Creek Regional Park,http://dbpedia.org/resource/Kanaka_Creek_Regional_Park
1255_0,0,84,Kalamalka Lake Provincial Park and Protected Area,http://dbpedia.org/resource/Kalamalka_Lake_Provincial_Park_and_Protected_Area
1255_0,0,85,Kakwa Provincial Park and Protected Area,http://dbpedia.org/resource/Kakwa_Provincial_Park_and_Protected_Area
1255_0,0,86,Juniper Beach Provincial Park,http://dbpedia.org/resource/Juniper_Beach_Provincial_Park
1255_0,0,87,Johnstone Creek Provincial Park,http://dbpedia.org/resource/Bronte_Creek_Provincial_Park
1255_0,0,88,Jimsmith Lake Provincial Park,http://dbpedia.org/resource/Jimsmith_Lake_Provincial_Park
1255_0,0,89,Jewel Lake Provincial Park,http://dbpedia.org/resource/Chain_Lakes_Provincial_Park
1255_0,0,90,James Chabot Provincial Park,http://dbpedia.org/resource/James_Chabot_Provincial_Park
1255_0,0,91,Jackson Narrows Marine Provincial Park,http://dbpedia.org/resource/Jackson_Narrows_Marine_Provincial_Park
1255_0,0,92,Jackpine Remnant Provincial Park,http://dbpedia.org/resource/Jackpine_Remnant_Provincial_Park
1255_0,0,93,Jackman Flats Provincial Park,http://dbpedia.org/resource/Jackman_Flats_Provincial_Park
1255_0,0,94,Inland Lake Provincial Park,http://dbpedia.org/resource/Chain_Lakes_Provincial_Park
1255_0,0,95,Inkaneep Provincial Park,http://dbpedia.org/resource/Inkaneep_Provincial_Park
1255_0,0,96,Idlewild Road Park,"http://dbpedia.org/resource/Idlewild_Road_Park_(Charlotte,_North_Carolina)"
1255_0,0,97,Háthayim Marine Provincial Park,http://dbpedia.org/resource/Thurston_Bay_Marine_Provincial_Park
1255_0,0,98,Hyland River Provincial Park,http://dbpedia.org/resource/Opeongo_River_Provincial_Park
1255_0,0,99,Horsefly Lake Provincial Park,http://dbpedia.org/resource/Chain_Lakes_Provincial_Park
1255_0,0,100,Hornets Nest Park,"http://dbpedia.org/resource/Hornets_Nest_Park_(Charlotte,_North_Carolina)"
1255_0,0,101,Horneline Creek Provincial Park,http://dbpedia.org/resource/Bronte_Creek_Provincial_Park
1255_0,0,102,Horne Lake Caves Provincial Park,http://dbpedia.org/resource/Horne_Lake_Caves_Provincial_Park
1255_0,0,103,Homathko Estuary Provincial Park,http://dbpedia.org/resource/Homathko_Estuary_Provincial_Park
1255_0,0,104,Hole-in-the-Wall Provincial Park,http://dbpedia.org/resource/Hole-in-the-Wall_Provincial_Park
1255_0,0,105,Hitchie Creek Provincial Park,http://dbpedia.org/resource/Fish_Creek_Provincial_Park
1255_0,0,106,High Lakes Basin Provincial Park,http://dbpedia.org/resource/High_Lakes_Basin_Provincial_Park
1255_0,0,107,Hesquiat Lake Provincial Park,http://dbpedia.org/resource/Chain_Lakes_Provincial_Park
1255_0,0,108,Herald Provincial Park,http://dbpedia.org/resource/Herald_Provincial_Park
1255_0,0,109,Hemer Provincial Park,http://dbpedia.org/resource/Herald_Provincial_Park
1255_0,0,110,Heather-Dina Lakes Provincial Park,http://dbpedia.org/resource/Heather-Dina_Lakes_Provincial_Park
1255_0,0,111,Harry Lake Aspen Provincial Park,http://dbpedia.org/resource/Harry_Lake_Aspen_Provincial_Park
1255_0,0,112,Harmony Islands Marine Provincial Park,http://dbpedia.org/resource/Discovery_Island_Marine_Provincial_Park
1255_0,0,113,Hardy Island Marine Provincial Park,http://dbpedia.org/resource/Flores_Island_Marine_Provincial_Park
1255_0,0,114,Harbour Dudgeon Lakes Provincial Park,http://dbpedia.org/resource/Harbour_Dudgeon_Lakes_Provincial_Park
1255_0,0,115,Halkett Bay Provincial Park,http://dbpedia.org/resource/Saltery_Bay_Provincial_Park
1255_0,0,116,Hai Lake–Mount Herman Provincial Park,http://dbpedia.org/resource/Hai_Lake–Mount_Herman_Provincial_Park
1255_0,0,117,Háthayim Marine Provincial Park,http://dbpedia.org/resource/Thurston_Bay_Marine_Provincial_Park
1255_0,0,118,Gwyneth Lake Provincial Park,http://dbpedia.org/resource/Chain_Lakes_Provincial_Park
1255_0,0,119,Gwillim Lake Provincial Park,http://dbpedia.org/resource/Chain_Lakes_Provincial_Park
1255_0,0,120,Grohman Narrows Provincial Park,http://dbpedia.org/resource/Grohman_Narrows_Provincial_Park
1255_0,0,121,Greenstone Mountain Provincial Park,http://dbpedia.org/resource/Lake_on_the_Mountain_Provincial_Park
1255_0,0,122,Green Lake Provincial Park,http://dbpedia.org/resource/Chain_Lakes_Provincial_Park
1255_0,0,123,Green Inlet Marine Provincial Park,http://dbpedia.org/resource/Klewnuggit_Inlet_Marine_Provincial_Park
1255_0,0,124,Great Glacier Provincial Park,http://dbpedia.org/resource/Bear_Glacier_Provincial_Park
1255_0,0,125,Graystokes Protected Area,http://dbpedia.org/resource/Graystokes_Protected_Area
1255_0,0,126,Granby Provincial Park,http://dbpedia.org/resource/Granby_Provincial_Park
1255_0,0,127,Graham-Laurier Provincial Park,http://dbpedia.org/resource/Graham-Laurier_Provincial_Park
1255_0,0,128,Gowlland Tod Provincial Park,http://dbpedia.org/resource/Gowlland_Tod_Provincial_Park
1255_0,0,129,Gordon Bay Provincial Park,http://dbpedia.org/resource/Gordon_Bay_Provincial_Park
1255_0,0,130,Goldstream Provincial Park,http://dbpedia.org/resource/Goldstream_Provincial_Park
1255_0,0,131,Goldpan Provincial Park,http://dbpedia.org/resource/Goldpan_Provincial_Park
1255_0,0,132,Gold Muchalat Provincial Park,http://dbpedia.org/resource/Gold_Muchalat_Provincial_Park
1255_0,0,133,God's Pocket Marine Provincial Park,http://dbpedia.org/resource/God's_Pocket_Marine_Provincial_Park
1255_0,0,134,Goat Range Provincial Park,http://dbpedia.org/resource/Goat_Range_Provincial_Park
