1323_2,2,1,General Union of Workers,http://dbpedia.org/resource/Spanish_Socialist_Workers'_Party
1323_2,2,2,Former Liberation Movements of Southern Africa,http://dbpedia.org/resource/Former_Liberation_Movements_of_Southern_Africa
1323_2,2,3,Union of Communist Parties – Communist Party of the Soviet Union,http://dbpedia.org/resource/Union_of_Communist_Parties_–_Communist_Party_of_the_Soviet_Union
1323_2,2,4,Council of Asian Liberals and Democrats,http://dbpedia.org/resource/Council_of_Asian_Liberals_and_Democrats
1323_2,2,5,Christian Democrat Organization of America,http://dbpedia.org/resource/Christian_Democrat_Organization_of_America
1323_2,2,6,Pro-Beijing camp,http://dbpedia.org/resource/Pro-Beijing_camp_(Hong_Kong)
1323_2,2,7,Christian Democrat Organization of America,http://dbpedia.org/resource/Christian_Democrat_Organization_of_America
1323_2,2,8,Former Liberation Movements of Southern Africa,http://dbpedia.org/resource/Former_Liberation_Movements_of_Southern_Africa
