1477_0,0,1,"Princess Alice, Duchess of Gloucester","http://dbpedia.org/resource/Princess_Alice,_Duchess_of_Gloucester"
1477_0,0,2,"Princess Alice, Countess of Athlone","http://dbpedia.org/resource/Princess_Alice,_Countess_of_Athlone"
1477_0,0,3,Princess Alexandrine of Prussia,http://dbpedia.org/resource/Princess_Alexandrine_of_Prussia_(1803–1892)
1477_0,0,4,Princess Alexandrine of Prussia,http://dbpedia.org/resource/Princess_Alexandrine_of_Prussia_(1803–1892)
1477_0,0,5,Princess Alexandrine of Baden,http://dbpedia.org/resource/Princess_Alexandrine_of_Baden
1477_0,0,6,Princess Alexandrine-Louise of Denmark,http://dbpedia.org/resource/Princess_Alexandrine-Louise_of_Denmark
1477_0,0,7,Princess Alexandra of Saxe-Coburg and Gotha,http://dbpedia.org/resource/Edward_VII
1477_0,0,8,Princess Alexandra of Saxe-Altenburg,http://dbpedia.org/resource/Princess_Alexandra_of_Saxe-Altenburg
1477_0,0,9,Princess Alexandra of Hanover,http://dbpedia.org/resource/Princess_Alexandra_of_Hanover_(1882–1963)
1477_0,0,10,Princess Alexandra of Anhalt,http://dbpedia.org/resource/Princess_Alexandra_of_Anhalt
1477_0,0,11,Princess Alexandra Victoria of Schleswig-Holstein-Sonderburg-Glücksburg,http://dbpedia.org/resource/Princess_Alexandra_Victoria_of_Schleswig-Holstein-Sonderburg-Glücksburg
1477_0,0,12,"Princess Alexandra, 2nd Duchess of Fife","http://dbpedia.org/resource/Princess_Alexandra,_2nd_Duchess_of_Fife"
1477_0,0,13,Princess Agnes of Hohenlohe-Langenburg,http://dbpedia.org/resource/Princess_Agnes_of_Hohenlohe-Langenburg
1477_0,0,14,Princess Agnes of Anhalt-Dessau,http://dbpedia.org/resource/Princess_Agnes_of_Anhalt-Dessau
1477_0,0,15,Princess Adelheid of Schaumburg-Lippe,http://dbpedia.org/resource/Princess_Adelaide_of_Schaumburg-Lippe
1477_0,0,16,Princess Adelheid of Hohenlohe-Langenburg,http://dbpedia.org/resource/Princess_Adelheid_of_Hohenlohe-Langenburg
1477_0,0,17,Princess Adelheid of Anhalt-Bernburg-Schaumburg-Hoym,http://dbpedia.org/resource/Princess_Adelheid_of_Anhalt-Bernburg-Schaumburg-Hoym
1477_0,0,18,Princess Adelheid-Marie of Anhalt-Dessau,http://dbpedia.org/resource/Princess_Adelheid-Marie_of_Anhalt-Dessau
1477_0,0,19,Princess Adelgunde of Bavaria,http://dbpedia.org/resource/Princess_Adelgunde_of_Bavaria
1477_0,0,20,Princess Adelgunde of Bavaria,http://dbpedia.org/resource/Princess_Adelgunde_of_Bavaria
1477_0,0,21,Princess Adelaide of Schaumburg-Lippe,http://dbpedia.org/resource/Princess_Adelaide_of_Schaumburg-Lippe
1477_0,0,22,Princess Adelaide of Saxe-Meiningen,http://dbpedia.org/resource/Adelaide_of_Saxe-Meiningen
1477_0,0,23,Prince Xavier of Bourbon-Parma,http://dbpedia.org/resource/Prince_Xavier_of_Bourbon-Parma
1477_0,0,24,Prince Wolfgang of Hesse,http://dbpedia.org/resource/Prince_Wolfgang_of_Hesse
1477_0,0,25,Prince William of Schaumburg-Lippe,http://dbpedia.org/resource/Prince_William_of_Schaumburg-Lippe
1477_0,0,26,Prince William of Hesse-Kassel,"http://dbpedia.org/resource/William_II,_Elector_of_Hesse"
1477_0,0,27,Prince William of Baden,http://dbpedia.org/resource/Prince_William_of_Baden_(1829–1897)
1477_0,0,28,"Prince William Henry, Duke of Gloucester and Edinburgh","http://dbpedia.org/resource/Prince_William_Henry,_Duke_of_Gloucester_and_Edinburgh"
1477_0,0,29,"Prince William Frederick, Duke of Gloucester and Edinburgh","http://dbpedia.org/resource/Prince_William_Frederick,_Duke_of_Gloucester_and_Edinburgh"
1477_0,0,30,Prince Wilhelm of Prussia,"http://dbpedia.org/resource/Frederick_III,_German_Emperor"
1477_0,0,31,Prince Wilhelm of Prussia,"http://dbpedia.org/resource/Frederick_III,_German_Emperor"
1477_0,0,32,Prince Wilhelm of Hesse-Philippsthal-Barchfeld,http://dbpedia.org/resource/Prince_Wilhelm_of_Hesse-Philippsthal-Barchfeld
1477_0,0,33,"Prince Wilhelm, Duke of Södermanland","http://dbpedia.org/resource/Prince_Wilhelm,_Duke_of_Södermanland"
1477_0,0,34,Prince Welf Henry of Hanover,http://dbpedia.org/resource/Prince_Welf_Henry_of_Hanover
1477_0,0,35,Prince Welf Ernst of Hanover,http://dbpedia.org/resource/Prince_Welf_Ernst_of_Hanover
1477_0,0,36,Prince Waldemar of Prussia,http://dbpedia.org/resource/Prince_Waldemar_of_Prussia_(1889–1945)
1477_0,0,37,Prince Vsevolod Ivanovich of Russia,http://dbpedia.org/resource/Prince_Vsevolod_Ivanovich_of_Russia
1477_0,0,38,P. Vijaya,http://dbpedia.org/resource/Vijaya_Nirmala
1477_0,0,39,Prince Victor of Hohenlohe-Langenburg,http://dbpedia.org/resource/Prince_Victor_of_Hohenlohe-Langenburg
1477_0,0,40,Prince Valdemar of Denmark,http://dbpedia.org/resource/Prince_Valdemar_of_Denmark
1477_0,0,41,Prince Tomohito of Mikasa,http://dbpedia.org/resource/Prince_Tomohito_of_Mikasa
1477_0,0,42,Prince Tomislav of Yugoslavia,http://dbpedia.org/resource/Prince_Tomislav_of_Yugoslavia
1477_0,0,43,"Prince Thomas, Duke of Genoa","http://dbpedia.org/resource/Prince_Thomas,_Duke_of_Genoa"
1477_0,0,44,P. Takechi,http://dbpedia.org/resource/Prince_Takechi
1477_0,0,45,Prince Sigismund of Prussia,http://dbpedia.org/resource/Prince_Sigismund_of_Prussia_(1896–1978)
1477_0,0,46,P. S. Selassie,http://dbpedia.org/resource/Prince_Sahle_Selassie
1477_0,0,47,"Prince Robert, Duke of Chartres","http://dbpedia.org/resource/Prince_Robert,_Duke_of_Chartres"
1477_0,0,48,Prince René of Bourbon-Parma,http://dbpedia.org/resource/Princess_Margaret_of_Denmark
1477_0,0,49,Prince Rasso of Bavaria,http://dbpedia.org/resource/Prince_Rasso_of_Bavaria
1477_0,0,50,"Prince Ranieri, Duke of Castro","http://dbpedia.org/resource/Prince_Ranieri,_Duke_of_Castro"
1477_0,0,51,"Prince Philippe, Duke of Orléans","http://dbpedia.org/resource/Louis_Philippe_II,_Duke_of_Orléans"
1477_0,0,52,"Prince Philippe, Count of Paris","http://dbpedia.org/resource/Prince_Philippe,_Count_of_Paris"
1477_0,0,53,"Prince Philippe, Count of Flanders","http://dbpedia.org/resource/Prince_Philippe,_Count_of_Flanders"
1477_0,0,54,Prince Philipp of Saxe-Coburg and Gotha,http://dbpedia.org/resource/Prince_Philipp_of_Saxe-Coburg_and_Gotha
1477_0,0,55,Prince Philip of Bourbon-Two Sicilies,http://dbpedia.org/resource/Prince_Philip_of_Bourbon-Two_Sicilies
1477_0,0,56,Prince Peter of Greece and Denmark,http://dbpedia.org/resource/Prince_Peter_of_Greece_and_Denmark
1477_0,0,57,Prince Pedro Henrique of Orléans-Braganza,http://dbpedia.org/resource/Prince_Pedro_Henrique_of_Orléans-Braganza
1477_0,0,58,Prince Pedro Gastão of Orléans-Braganza,http://dbpedia.org/resource/Prince_Pedro_Gastão_of_Orléans-Braganza
1477_0,0,59,Prince Paul of Yugoslavia,http://dbpedia.org/resource/Prince_Paul_of_Yugoslavia
1477_0,0,60,Prince Paul of Württemberg,"http://dbpedia.org/resource/Francis,_Duke_of_Teck"
1477_0,0,61,Prince Oskar of Prussia,http://dbpedia.org/resource/Prince_Oskar_of_Prussia
1477_0,0,62,P. O. Bernadotte,http://dbpedia.org/resource/Charles_XIV_John_of_Sweden
1477_0,0,63,Prince Nicholas of Greece and Denmark,http://dbpedia.org/resource/Prince_Nicholas_of_Greece_and_Denmark
1477_0,0,64,P. N. Higashikuni,http://dbpedia.org/resource/P._N._Furbank
1477_0,0,65,P. N. Bonaparte,http://dbpedia.org/resource/Napoleon
1477_0,0,66,Prince Naif bin Al-Abdullah,http://dbpedia.org/resource/Abdullah_of_Saudi_Arabia
1477_0,0,67,Prince Moritz of Saxe-Altenburg,http://dbpedia.org/resource/Prince_Moritz_of_Saxe-Altenburg
1477_0,0,68,Prince Mirko of Montenegro,http://dbpedia.org/resource/Prince_Mirko_of_Montenegro
1477_0,0,69,"Prince Miguel, Duke of Viseu","http://dbpedia.org/resource/Prince_Miguel,_Duke_of_Viseu"
1477_0,0,70,P. Makonnen,http://dbpedia.org/resource/Mekonnen_Haile_Selassie
1477_0,0,71,Prince Luís of Orléans-Braganza,http://dbpedia.org/resource/Prince_Luís_of_Orléans-Braganza_(1878–1920)
1477_0,0,72,Prince Ludwig of Löwenstein-Wertheim-Freudenberg,http://dbpedia.org/resource/Prince_Ludwig_of_Löwenstein-Wertheim-Freudenberg
1477_0,0,73,Prince Ludwig of Bavaria,http://dbpedia.org/resource/Ludwig_III_of_Bavaria
1477_0,0,74,Prince Ludwig Philipp of Thurn and Taxis,http://dbpedia.org/resource/Prince_Ludwig_Philipp_of_Thurn_and_Taxis
1477_0,0,75,Prince Ludwig Gaston of Saxe-Coburg and Gotha,http://dbpedia.org/resource/Prince_Ludwig_Gaston_of_Saxe-Coburg_and_Gotha
1477_0,0,76,Prince Ludwig Ferdinand of Bavaria,http://dbpedia.org/resource/Prince_Ludwig_Ferdinand_of_Bavaria
1477_0,0,77,Prince Ludwig August of Saxe-Coburg and Gotha,http://dbpedia.org/resource/Prince_Ludwig_August_of_Saxe-Coburg_and_Gotha
1477_0,0,78,Prince Luís of Orléans-Braganza,http://dbpedia.org/resource/Prince_Luís_of_Orléans-Braganza_(1878–1920)
1477_0,0,79,Prince Louis of Liechtenstein,http://dbpedia.org/resource/Prince_Louis_of_Liechtenstein
1477_0,0,80,Prince Louis Ferdinand of Prussia,"http://dbpedia.org/resource/Louis_Ferdinand,_Prince_of_Prussia"
1477_0,0,81,Prince Louis Charles of Prussia,http://dbpedia.org/resource/Prince_Louis_Charles_of_Prussia
1477_0,0,82,"Prince Louis, Duke of Nemours","http://dbpedia.org/resource/Prince_Louis,_Duke_of_Nemours"
1477_0,0,83,"Prince Louis, Count of Trani","http://dbpedia.org/resource/Prince_Louis,_Count_of_Trani"
1477_0,0,84,"Prince Louis, Count of Aquila","http://dbpedia.org/resource/Prince_Louis,_Count_of_Aquila"
1477_0,0,85,Prince Leopold of Bavaria,http://dbpedia.org/resource/Prince_Leopold_of_Bavaria
1477_0,0,86,"Prince Leopold, Duke of Albany","http://dbpedia.org/resource/Charles_Edward,_Duke_of_Saxe-Coburg_and_Gotha"
1477_0,0,87,"Prince Leopold, Count of Syracuse","http://dbpedia.org/resource/Prince_Leopold,_Count_of_Syracuse"
1477_0,0,88,Prince Konrad of Bavaria,http://dbpedia.org/resource/Prince_Konrad_of_Bavaria
1477_0,0,89,Prince Karl of Leiningen,"http://dbpedia.org/resource/Carl,_3rd_Prince_of_Leiningen"
1477_0,0,90,Prince Karl Franz of Prussia,http://dbpedia.org/resource/Prince_Karl_Franz_of_Prussia
1477_0,0,91,Prince Karl Borromäus of Liechtenstein,http://dbpedia.org/resource/Prince_Karl_Borromäus_of_Liechtenstein
1477_0,0,92,Prince Karl Anton of Hohenzollern,http://dbpedia.org/resource/Prince_Karl_Anton_of_Hohenzollern
1477_0,0,93,Prince Karl Anton August of Schleswig-Holstein-Sonderburg-Beck,http://dbpedia.org/resource/Prince_Karl_Anton_August_of_Schleswig-Holstein-Sonderburg-Beck
1477_0,0,94,Prince Karl Aloys of Liechtenstein,http://dbpedia.org/resource/Prince_Karl_Aloys_of_Liechtenstein
1477_0,0,95,Prince Karl Alfred of Liechtenstein,http://dbpedia.org/resource/Prince_Karl_Alfred_of_Liechtenstein
1477_0,0,96,Prince Joseph of Saxe-Hildburghausen,http://dbpedia.org/resource/Prince_Joseph_of_Saxe-Hildburghausen
1477_0,0,97,Prince Joseph of Monaco,http://dbpedia.org/resource/Prince_Joseph_of_Monaco
1477_0,0,98,Prince John Konstantinovich of Russia,http://dbpedia.org/resource/Prince_John_Konstantinovich_of_Russia
1477_0,0,99,Prince Johann Georg of Saxony,"http://dbpedia.org/resource/John_George_III,_Elector_of_Saxony"
1477_0,0,100,Prince Johann Georg of Hohenzollern,http://dbpedia.org/resource/Prince_Johann_Georg_of_Hohenzollern
1477_0,0,101,Prince Joachim of Prussia,http://dbpedia.org/resource/Prince_Joachim_of_Prussia
1477_0,0,102,"Prince Jean, Duke of Guise","http://dbpedia.org/resource/Prince_Jean,_Duke_of_Guise"
1477_0,0,103,Prince Hubertus of Prussia,http://dbpedia.org/resource/Prince_Hubertus_of_Prussia
1477_0,0,104,Prince Himalaya of Nepal,http://dbpedia.org/resource/Prince_Himalaya_of_Nepal
1477_0,0,105,Prince Hermann of Saxe-Weimar-Eisenach,http://dbpedia.org/resource/Prince_Hermann_of_Saxe-Weimar-Eisenach_(1825–1901)
1477_0,0,106,Prince Henry of the Netherlands,http://dbpedia.org/resource/William_I_of_the_Netherlands
1477_0,0,107,Prince Henry of Prussia,http://dbpedia.org/resource/Prince_Henry_of_Prussia_(1862–1929)
1477_0,0,108,Prince Henry of Prussia,http://dbpedia.org/resource/Prince_Henry_of_Prussia_(1862–1929)
1477_0,0,109,Prince Henry of Battenberg,"http://dbpedia.org/resource/George_Mountbatten,_2nd_Marquess_of_Milford_Haven"
1477_0,0,110,"Prince Henry, Duke of Mecklenburg-Schwerin",http://dbpedia.org/resource/Duke_Henry_of_Mecklenburg-Schwerin
1477_0,0,111,"Prince Henry, Duke of Gloucester","http://dbpedia.org/resource/Prince_Henry,_Duke_of_Gloucester"
1477_0,0,112,"Prince Henry, Duke of Cumberland and Strathearn","http://dbpedia.org/resource/Prince_Henry,_Duke_of_Cumberland_and_Strathearn"
1477_0,0,113,"Prince Henry, Count of Bardi","http://dbpedia.org/resource/Prince_Henry,_Count_of_Bardi"
1477_0,0,114,Prince Heinrich XXXII Reuss of Köstritz,http://dbpedia.org/resource/Prince_Heinrich_XXXII_Reuss_of_Köstritz
1477_0,0,115,Prince Heinrich XXXIII Reuss of Köstritz,http://dbpedia.org/resource/Prince_Heinrich_XXXIII_Reuss_of_Köstritz
1477_0,0,116,Prince Harald of Denmark,http://dbpedia.org/resource/Prince_Harald_of_Denmark
1477_0,0,117,"Prince Gustaf Adolf, Duke of Västerbotten","http://dbpedia.org/resource/Prince_Gustaf_Adolf,_Duke_of_Västerbotten"
1477_0,0,118,Prince George of Greece and Denmark,http://dbpedia.org/resource/George_I_of_Greece
1477_0,0,119,Prince George of Denmark,http://dbpedia.org/resource/George_I_of_Greece
1477_0,0,120,Prince George William of Hesse-Darmstadt,http://dbpedia.org/resource/Prince_George_William_of_Hesse-Darmstadt
1477_0,0,121,Prince George William of Hanover,http://dbpedia.org/resource/William_IV_of_the_United_Kingdom
1477_0,0,122,Prince George Valdemar of Denmark,http://dbpedia.org/resource/Prince_George_Valdemar_of_Denmark
1477_0,0,123,"Prince George, Duke of Kent","http://dbpedia.org/resource/Prince_George,_Duke_of_Kent"
1477_0,0,124,"Prince George, Duke of Cambridge","http://dbpedia.org/resource/Prince_Adolphus,_Duke_of_Cambridge"
1477_0,0,125,Prince Georg of Bavaria,http://dbpedia.org/resource/Prince_Georg_of_Bavaria
1477_0,0,126,"Prince Gaetan, Count of Girgenti","http://dbpedia.org/resource/Prince_Gaetan,_Count_of_Girgenti"
1477_0,0,127,Prince Gabriel of Bourbon-Two Sicilies,http://dbpedia.org/resource/Prince_Gabriel_of_Bourbon-Two_Sicilies
1477_0,0,128,Prince Friso of Orange-Nassau,"http://dbpedia.org/resource/William_IV,_Prince_of_Orange"
1477_0,0,129,Prince Friedrich of Saxe-Meiningen,"http://dbpedia.org/resource/Bernhard_III,_Duke_of_Saxe-Meiningen"
1477_0,0,130,Prince Friedrich Wilhelm of Prussia,"http://dbpedia.org/resource/Frederick_III,_German_Emperor"
1477_0,0,131,Prince Friedrich Leopold of Prussia,http://dbpedia.org/resource/Prince_Friedrich_Leopold_of_Prussia
1477_0,0,132,Prince Friedrich Karl of Prussia,"http://dbpedia.org/resource/Frederick_III,_German_Emperor"
1477_0,0,133,Prince Friedrich Ferdinand of Schleswig-Holstein-Sonderburg-Glücksburg,"http://dbpedia.org/resource/Friedrich_Ferdinand,_Duke_of_Schleswig-Holstein"
1477_0,0,134,Prince Frederick of the Netherlands,http://dbpedia.org/resource/William_I_of_the_Netherlands
1477_0,0,135,Prince Frederick of Württemberg,http://dbpedia.org/resource/Frederick_I_of_Württemberg
1477_0,0,136,Prince Frederick of Schleswig-Holstein-Sonderburg-Augustenburg,http://dbpedia.org/resource/Prince_Christian_of_Schleswig-Holstein
1477_0,0,137,Prince Frederick of Schaumburg-Lippe,http://dbpedia.org/resource/Prince_Frederick_of_Schaumburg-Lippe
1477_0,0,138,Prince Frederick of Prussia,"http://dbpedia.org/resource/Frederick_III,_German_Emperor"
1477_0,0,139,Prince Frederick of Prussia,"http://dbpedia.org/resource/Frederick_III,_German_Emperor"
1477_0,0,140,Prince Frederick of Hohenzollern-Sigmaringen,"http://dbpedia.org/resource/Frederick,_Prince_of_Hohenzollern"
1477_0,0,141,Prince Frederick of Hesse-Kassel,http://dbpedia.org/resource/Prince_Frederick_of_Hesse-Kassel
1477_0,0,142,Prince Frederick William of Solms-Braunfels,http://dbpedia.org/resource/Prince_Frederick_William_of_Solms-Braunfels
1477_0,0,143,Prince Frederick William of Hesse-Kassel,http://dbpedia.org/resource/Prince_Frederick_William_of_Hesse-Kassel
1477_0,0,144,Prince Frederick Charles of Hesse,http://dbpedia.org/resource/Prince_Frederick_Charles_of_Hesse
1477_0,0,145,Prince Frederick Augustus of Anhalt-Dessau,http://dbpedia.org/resource/Prince_Frederick_Augustus_of_Anhalt-Dessau
1477_0,0,146,"Prince Frederick, Duke of York and Albany","http://dbpedia.org/resource/Prince_Frederick,_Duke_of_York_and_Albany"
1477_0,0,147,Prince Franz of Bavaria,http://dbpedia.org/resource/Maximilian_I_Joseph_of_Bavaria
1477_0,0,148,Prince Franz de Paula of Liechtenstein,http://dbpedia.org/resource/Prince_Franz_de_Paula_of_Liechtenstein
1477_0,0,149,Prince Francis Xavier of Saxony,http://dbpedia.org/resource/Prince_Francis_Xavier_of_Saxony
1477_0,0,150,Prince Francis Joseph of Battenberg,http://dbpedia.org/resource/Prince_Francis_Joseph_of_Battenberg
1477_0,0,151,"Prince Francis, Count of Trapani","http://dbpedia.org/resource/Prince_Francis,_Count_of_Trapani"
1477_0,0,152,"Prince Ferdinando, Duke of Genoa","http://dbpedia.org/resource/Prince_Ferdinando,_Duke_of_Genoa_(1822–1855)"
1477_0,0,153,Prince Ferdinand of Saxe-Coburg and Gotha,http://dbpedia.org/resource/Ferdinand_I_of_Bulgaria
1477_0,0,154,Prince Ferdinand of Bavaria,http://dbpedia.org/resource/Prince_Ferdinand_of_Bavaria
1477_0,0,155,"Prince Ferdinand Pius, Duke of Calabria","http://dbpedia.org/resource/Prince_Ferdinand_Pius,_Duke_of_Calabria"
1477_0,0,156,"Prince Ferdinand, Duke of Castro","http://dbpedia.org/resource/Prince_Ferdinand,_Duke_of_Castro"
1477_0,0,157,"Prince Ferdinand, Duke of Alençon","http://dbpedia.org/resource/Prince_Ferdinand,_Duke_of_Alençon"
1477_0,0,158,Prince Feodor Alexandrovich of Russia,http://dbpedia.org/resource/Prince_Feodor_Alexandrovich_of_Russia
1477_0,0,159,Prince Felix of Bourbon-Parma,http://dbpedia.org/resource/Prince_Felix_of_Bourbon-Parma
1477_0,0,160,"Prince Eugenio, Duke of Genoa","http://dbpedia.org/resource/Prince_Eugenio,_Duke_of_Genoa"
1477_0,0,161,Prince Ernst Heinrich of Saxony,http://dbpedia.org/resource/Prince_Ernst_Heinrich_of_Saxony
1477_0,0,162,Prince Ernest Augustus of Hanover,http://dbpedia.org/resource/George_V_of_Hanover
1477_0,0,163,"Prince Ernest Augustus, 3rd Duke of Cumberland and Teviotdale","http://dbpedia.org/resource/Ernest_Augustus,_Crown_Prince_of_Hanover"
1477_0,0,164,"Prince Emanuele Filiberto, Duke of Aosta","http://dbpedia.org/resource/Prince_Emanuele_Filiberto,_Duke_of_Aosta"
1477_0,0,165,Prince Eitel Friedrich of Prussia,http://dbpedia.org/resource/Prince_Eitel_Friedrich_of_Prussia
1477_0,0,166,"Prince Edward, Duke of Kent and Strathearn","http://dbpedia.org/resource/Prince_Edward,_Duke_of_Kent_and_Strathearn"
1477_0,0,167,Prince Eduard of Saxe-Altenburg,http://dbpedia.org/resource/Prince_Eduard_of_Saxe-Altenburg
1477_0,0,168,Prince Dmitri Alexandrovich of Russia,http://dbpedia.org/resource/Dmitry_of_Pereslavl
1477_0,0,169,Prince Claus of the Netherlands,http://dbpedia.org/resource/Prince_Claus_of_the_Netherlands
1477_0,0,170,Prince Christopher of Greece and Denmark,http://dbpedia.org/resource/Prince_Christopher_of_Greece_and_Denmark
1477_0,0,171,Prince Christoph of Hesse,http://dbpedia.org/resource/Prince_Christoph_of_Hesse
1477_0,0,172,Prince Christian of Schleswig-Holstein,http://dbpedia.org/resource/Prince_Christian_of_Schleswig-Holstein
1477_0,0,173,Prince Charles of Prussia,"http://dbpedia.org/resource/Frederick_III,_German_Emperor"
1477_0,0,174,Prince Charles of Luxembourg,http://dbpedia.org/resource/Prince_Charles_of_Luxembourg
1477_0,0,175,Prince Charles of Hesse and by Rhine,"http://dbpedia.org/resource/Ernest_Louis,_Grand_Duke_of_Hesse"
1477_0,0,176,Prince Charles of Hesse-Kassel,http://dbpedia.org/resource/Prince_Charles_of_Hesse-Kassel
1477_0,0,177,Prince Charles Alexander of Lorraine,http://dbpedia.org/resource/Prince_Charles_Alexander_of_Lorraine
1477_0,0,178,Prince Carlos of Bourbon-Two Sicilies,http://dbpedia.org/resource/Charles_III_of_Spain
1477_0,0,179,P. C. Bernadotte,http://dbpedia.org/resource/Prince_Carl_Bernadotte
1477_0,0,180,"Prince Carl, Duke of Västergötland","http://dbpedia.org/resource/Prince_Carl,_Duke_of_Västergötland"
1477_0,0,181,"Prince Bertil, Duke of Halland","http://dbpedia.org/resource/Prince_Bertil,_Duke_of_Halland"
1477_0,0,182,Prince Bernhard of Saxe-Weimar-Eisenach,http://dbpedia.org/resource/Prince_Bernhard_of_Saxe-Weimar-Eisenach_(1792–1862)
1477_0,0,183,Prince Bernhard of Lippe,http://dbpedia.org/resource/Prince_Bernhard_of_Lippe-Biesterfeld
1477_0,0,184,Prince Bernhard of Lippe-Biesterfeld,http://dbpedia.org/resource/Prince_Bernhard_of_Lippe-Biesterfeld
1477_0,0,185,"Prince Benedetto, Duke of Chablais","http://dbpedia.org/resource/Prince_Benedetto,_Duke_of_Chablais"
