1484_1,1,1,"Louis Armand II, Prince of Conti","http://dbpedia.org/resource/Louis_Armand_II,_Prince_of_Conti"
1484_1,1,2,"Anne Marie Joseph, Count of Harcourt","http://dbpedia.org/resource/Joseph,_Count_of_Harcourt"
1484_1,1,3,"Françoise-Athénaïs, marquise de Montespan","http://dbpedia.org/resource/Françoise-Athénaïs_de_Rochechouart,_Marquise_de_Montespan"
1484_1,1,4,Anna Elisabeth of Anhalt-Bernburg,http://dbpedia.org/resource/Anna_Elisabeth_of_Anhalt-Bernburg
1484_1,1,5,J. Kettler,http://dbpedia.org/resource/Jacob_Kettler
1484_1,1,6,"Philippe II, Duke of Orléans","http://dbpedia.org/resource/Louis_Philippe_II,_Duke_of_Orléans"
1484_1,1,7,Anne Henriette of Bavaria,http://dbpedia.org/resource/Anne_Henriette_of_Bavaria
1484_1,1,8,Louis XV of France,http://dbpedia.org/resource/Louis_XV_of_France
1484_1,1,9,"Louis, Prince of Condé","http://dbpedia.org/resource/Louis_Mountbatten,_1st_Earl_Mountbatten_of_Burma"
1484_1,1,10,"Philippe II, Duke of Orléans","http://dbpedia.org/resource/Louis_Philippe_II,_Duke_of_Orléans"
1484_1,1,11,A. o. Denmark,http://dbpedia.org/resource/Princess_Louise_Auguste_of_Denmark
1484_1,1,12,Frederick William I of Prussia,"http://dbpedia.org/resource/Frederick_III,_German_Emperor"
1484_1,1,13,Charlemagne,http://dbpedia.org/resource/Charlemagne
1484_1,1,14,"Philippe II, Duke of Orléans","http://dbpedia.org/resource/Louis_Philippe_II,_Duke_of_Orléans"
1484_1,1,15,Joan I of Navarre,http://dbpedia.org/resource/John_II_of_Aragon
1484_1,1,16,"Louis, Dauphin of France",http://dbpedia.org/resource/Louis_XIV_of_France
1484_1,1,17,"Louis, Dauphin of France",http://dbpedia.org/resource/Louis_XIV_of_France
1484_1,1,18,Maria Josepha of Saxony,"http://dbpedia.org/resource/Maria_Josepha_of_Saxony,_Dauphine_of_France"
1484_1,1,19,Charles VII of France,http://dbpedia.org/resource/James_II_of_England
1484_1,1,20,Louis XIII of France,http://dbpedia.org/resource/Louis_XIII_of_France
1484_1,1,21,"Charles, Duke of Orléans",http://dbpedia.org/resource/Charles_IX_of_France
1484_1,1,22,M. d. Medici,http://dbpedia.org/resource/Marie_de'_Medici
1484_1,1,23,Maria Vittoria of Savoy,http://dbpedia.org/resource/Maria_Vittoria_of_Savoy
1484_1,1,24,E. o. Italy,http://dbpedia.org/resource/Emma_of_Italy
1484_1,1,25,B. o. Holland,http://dbpedia.org/resource/Bertha_of_Holland
1484_1,1,26,A. d. Maurienne,"http://dbpedia.org/resource/Amadeus_III,_Count_of_Savoy"
1484_1,1,27,I. o. Hainaut,http://dbpedia.org/resource/Philippa_of_Hainault
1484_1,1,28,"Ernest Louis, Landgrave of Hesse-Darmstadt","http://dbpedia.org/resource/Ernest_Louis,_Landgrave_of_Hesse-Darmstadt"
1484_1,1,29,"George II, Landgrave of Hesse-Darmstadt","http://dbpedia.org/resource/George_II,_Landgrave_of_Hesse-Darmstadt"
1484_1,1,30,M. o. Lippe,"http://dbpedia.org/resource/Leopold_IV,_Prince_of_Lippe"
1484_1,1,31,"Louis Philippe I, Duke of Orléans","http://dbpedia.org/resource/Louis_Philippe_II,_Duke_of_Orléans"
1484_1,1,32,"Louis d'Orléans, Duke of Orléans","http://dbpedia.org/resource/Louis_Philippe_II,_Duke_of_Orléans"
1484_1,1,33,"Louis Philippe II, Duke of Orléans","http://dbpedia.org/resource/Louis_Philippe_II,_Duke_of_Orléans"
1484_1,1,34,"Louis Henri, Duke of Bourbon","http://dbpedia.org/resource/Louis_Henri,_Duke_of_Bourbon"
1484_1,1,35,L. Mancini,http://dbpedia.org/resource/Laura_Mancini
1484_1,1,36,"Louis Alexandre, Count of Toulouse","http://dbpedia.org/resource/Louis_Alexandre,_Count_of_Toulouse"
1484_1,1,37,Philip V of Spain,http://dbpedia.org/resource/Philip_III_of_Spain
1484_1,1,38,"Philip I, Prince of Taranto","http://dbpedia.org/resource/Philip_I,_Prince_of_Taranto"
1484_1,1,39,Charles I of Hungary,http://dbpedia.org/resource/Franz_Joseph_I_of_Austria
1484_1,1,40,Archduchess Maria Amalia of Austria,http://dbpedia.org/resource/Maria_Theresa
1484_1,1,41,Louis VIII of France,"http://dbpedia.org/resource/Louis_Antoine,_Duke_of_Angoulême"
1484_1,1,42,"Louis VIII, Landgrave of Hesse-Darmstadt","http://dbpedia.org/resource/Louis_VIII,_Landgrave_of_Hesse-Darmstadt"
1484_1,1,43,M. o. Habsburg,http://dbpedia.org/resource/Maria_Carolina_of_Austria
1484_1,1,44,Princess Elisabeth of Prussia,http://dbpedia.org/resource/Princess_Elisabeth_of_Prussia
1484_1,1,45,Louis I of Anjou,"http://dbpedia.org/resource/Louis_I,_Duke_of_Anjou"
1484_1,1,46,Vladislaus II of Bohemia and Hungary,http://dbpedia.org/resource/Vladislaus_II_of_Hungary
1484_1,1,47,"Louis II, Grand Duke of Hesse","http://dbpedia.org/resource/Louis_II,_Grand_Duke_of_Hesse"
1484_1,1,48,"Albert I, Prince of Monaco","http://dbpedia.org/resource/Albert_I,_Prince_of_Monaco"
1484_1,1,49,Landgravine Louise of Hesse-Darmstadt,http://dbpedia.org/resource/Princess_Louise_of_Hesse-Darmstadt_(1757–1830)
1484_1,1,50,"Prince Hercule, Marquis of Baux","http://dbpedia.org/resource/Ercole,_Marquis_of_Baux"
1484_1,1,51,"Louis IX, Landgrave of Hesse-Darmstadt","http://dbpedia.org/resource/Louis_IX,_Landgrave_of_Hesse-Darmstadt"
1484_1,1,52,J. o. Bourbon,"http://dbpedia.org/resource/François_Louis,_Prince_of_Conti"
1484_1,1,53,"Robert, Count of Clermont","http://dbpedia.org/resource/Robert,_Count_of_Clermont"
1484_1,1,54,John II of France,http://dbpedia.org/resource/Philip_II_of_France
1484_1,1,55,"Louis Joseph, Prince of Condé","http://dbpedia.org/resource/Louis_Joseph,_Prince_of_Condé"
1484_1,1,56,"Louis III, Prince of Condé","http://dbpedia.org/resource/Louis_Joseph,_Prince_of_Condé"
1484_1,1,57,"Frederick Charles, Prince of Schwarzburg-Rudolstadt","http://dbpedia.org/resource/Frederick_Charles,_Prince_of_Schwarzburg-Rudolstadt"
1484_1,1,58,"Louis François, Prince of Conti","http://dbpedia.org/resource/François_Louis,_Prince_of_Conti"
1484_1,1,59,"Louis Armand II de Bourbon, prince de Conti","http://dbpedia.org/resource/Louis_Armand_II,_Prince_of_Conti"
1484_1,1,60,"Louis François, Prince of Conti","http://dbpedia.org/resource/François_Louis,_Prince_of_Conti"
1484_1,1,61,Louise Élisabeth de Bourbon,http://dbpedia.org/resource/Isabella_II_of_Spain
1484_1,1,62,"Wilhelm, German Crown Prince","http://dbpedia.org/resource/Frederick_III,_German_Emperor"
1484_1,1,63,C. Buonaparte,http://dbpedia.org/resource/Napoleon
1484_1,1,64,"Françoise-Athénaïs, marquise de Montespan","http://dbpedia.org/resource/Françoise-Athénaïs_de_Rochechouart,_Marquise_de_Montespan"
1484_1,1,65,"François Louis, Prince of Conti","http://dbpedia.org/resource/François_Louis,_Prince_of_Conti"
1484_1,1,66,A. M. Martinozzi,http://dbpedia.org/resource/Anne_Marie_Martinozzi
1484_1,1,67,B. d'Orléans,http://dbpedia.org/resource/Bathilde_d'Orléans
1484_1,1,68,Princess Maria Theresa of Savoy,http://dbpedia.org/resource/Maria_Theresa_of_Savoy
1484_1,1,69,"Louis Jean Marie de Bourbon, Duke of Penthièvre","http://dbpedia.org/resource/Louis_Jean_Marie_de_Bourbon,_Duke_of_Penthièvre"
1484_1,1,70,Louis XIV of France,http://dbpedia.org/resource/Louis_XIV_of_France
1484_1,1,71,Anne Henriette of Bavaria,http://dbpedia.org/resource/Anne_Henriette_of_Bavaria
1484_1,1,72,"Charles de Bourbon, Duke of Vendôme","http://dbpedia.org/resource/Charles,_Duke_of_Vendôme"
1484_1,1,73,Anne Henriette of Bavaria,http://dbpedia.org/resource/Anne_Henriette_of_Bavaria
1484_1,1,74,F. d'Alençon,http://dbpedia.org/resource/Anne_d'Alençon
1484_1,1,75,Princess Clémentine of Belgium,http://dbpedia.org/resource/Princess_Clémentine_of_Belgium
1484_1,1,76,Louis XIV of France,http://dbpedia.org/resource/Louis_XIV_of_France
1484_1,1,77,"Henri, Prince of Condé",http://dbpedia.org/resource/Henry_II_of_England
1484_1,1,78,"César, Duke of Vendôme","http://dbpedia.org/resource/César,_Duke_of_Vendôme"
1484_1,1,79,"Amadeus VIII, Duke of Savoy","http://dbpedia.org/resource/Amadeus_VIII,_Duke_of_Savoy"
1484_1,1,80,"Louise de Bourbon, Duchess of Montpensier","http://dbpedia.org/resource/Infanta_Luisa_Fernanda,_Duchess_of_Montpensier"
1484_1,1,81,Charles VI of France,http://dbpedia.org/resource/James_II_of_England
1484_1,1,82,L. G. Dauphin,"http://dbpedia.org/resource/Louis,_Grand_Dauphin"
1484_1,1,83,Louis XV of France,http://dbpedia.org/resource/Louis_XV_of_France
1484_1,1,84,"Marie of Brabant, Queen of France","http://dbpedia.org/resource/Marie_of_Brabant,_Queen_of_France"
1484_1,1,85,G. o. Supplinburg,http://dbpedia.org/resource/Gebhard_of_Supplinburg
1484_1,1,86,L. I,"http://dbpedia.org/resource/Leopold_I,_Holy_Roman_Emperor"
1484_1,1,87,J. Emperor,http://dbpedia.org/resource/Jiajing_Emperor
1484_1,1,88,I. Drwyndwn,http://dbpedia.org/resource/Iorwerth_Drwyndwn
1484_1,1,89,Gruffudd ap Llywelyn Fawr,http://dbpedia.org/resource/Llywelyn_ap_Gruffudd
1484_1,1,90,A. Minor,http://dbpedia.org/resource/Antonia_Minor
1484_1,1,91,"Otto I, Holy Roman Emperor","http://dbpedia.org/resource/Charles_V,_Holy_Roman_Emperor"
1484_1,1,92,L. Bei,http://dbpedia.org/resource/Liu_Bei
1484_1,1,93,Edward III of England,http://dbpedia.org/resource/Edward_II_of_England
1484_1,1,94,Kapaakea,http://dbpedia.org/resource/Kapaakea
1484_1,1,95,H. Baels,http://dbpedia.org/resource/Henri_Baels
1484_1,1,96,Kapaakea,http://dbpedia.org/resource/Kapaakea
1484_1,1,97,E. Zhong,http://dbpedia.org/resource/Empress_Zhong
1484_1,1,98,L. Bian,
1484_1,1,99,L. Siyuan,http://dbpedia.org/resource/Li_Siyuan
1484_1,1,100,X. Wen,http://dbpedia.org/resource/Xiao-Gang_Wen
1484_1,1,101,Casimir II the Just,http://dbpedia.org/resource/Casimir_II_the_Just
1484_1,1,102,Casimir I of Kuyavia,http://dbpedia.org/resource/Casimir_I_of_Kuyavia
1484_1,1,103,Countess Augusta Reuss of Ebersdorf,http://dbpedia.org/resource/Countess_Augusta_Reuss_of_Ebersdorf
1484_1,1,104,K. o. Wartensleben,http://dbpedia.org/resource/Karoline_of_Wartensleben
1484_1,1,105,"Frederick, Hereditary Prince of Anhalt-Dessau","http://dbpedia.org/resource/Frederick,_Hereditary_Prince_of_Anhalt-Dessau"
1484_1,1,106,Leopold I of Belgium,http://dbpedia.org/resource/Leopold_I_of_Belgium
1484_1,1,107,Albert I of Belgium,http://dbpedia.org/resource/Albert_I_of_Belgium
1484_1,1,108,"Leopold II, Prince of Anhalt-Dessau","http://dbpedia.org/resource/Leopold_II,_Prince_of_Anhalt-Dessau"
1484_1,1,109,"Leopold I, Prince of Anhalt-Dessau","http://dbpedia.org/resource/Leopold_I,_Prince_of_Anhalt-Dessau"
1484_1,1,110,"Francis I, Holy Roman Emperor","http://dbpedia.org/resource/Charles_V,_Holy_Roman_Emperor"
1484_1,1,111,"Ferdinand III, Grand Duke of Tuscany","http://dbpedia.org/resource/Ferdinand_III,_Grand_Duke_of_Tuscany"
1484_1,1,112,Henriette Catherine of Nassau,http://dbpedia.org/resource/Countess_Henriette_Catherine_of_Nassau
1484_1,1,113,Maria Anna of Spain,http://dbpedia.org/resource/Maria_Anna_of_Spain
1484_1,1,114,Maria Carolina of Austria,http://dbpedia.org/resource/Maria_Carolina_of_Austria
1484_1,1,115,Princess Josephine of Baden,http://dbpedia.org/resource/Princess_Josephine_of_Baden
1484_1,1,116,"Frederick I, Duke of Anhalt","http://dbpedia.org/resource/Frederick_I,_Duke_of_Anhalt"
1484_1,1,117,"Charles Frederick, Grand Duke of Baden","http://dbpedia.org/resource/Charles_Frederick,_Grand_Duke_of_Baden"
1484_1,1,118,"Charles V, Duke of Lorraine","http://dbpedia.org/resource/Charles_V,_Duke_of_Lorraine"
1484_1,1,119,Martim Afonso Telo de Meneses,http://dbpedia.org/resource/Martim_Afonso_Telo_de_Meneses
1484_1,1,120,George Bagration of Mukhrani,http://dbpedia.org/resource/George_Bagration_of_Mukhrani
1484_1,1,121,M. III,http://dbpedia.org/resource/Murad_III
1484_1,1,122,John constable of Armenia,http://dbpedia.org/resource/John_Constable
1484_1,1,123,O. o. Armenia,http://dbpedia.org/resource/Ashot_I_of_Armenia
1484_1,1,124,Queen Zabel of Armenia,"http://dbpedia.org/resource/Isabella,_Queen_of_Armenia"
1484_1,1,125,S. o. Armenia,http://dbpedia.org/resource/Sibylla_of_Armenia
1484_1,1,126,Grand Duchess Maria Pavlovna of Russia,http://dbpedia.org/resource/Maria_Feodorovna_(Sophie_Dorothea_of_Württemberg)
1484_1,1,127,Kalanimoku,http://dbpedia.org/resource/Kalanimoku
1484_1,1,128,Zog I of Albania,http://dbpedia.org/resource/Zog_I_of_Albania
1484_1,1,129,Pedro I of Brazil,http://dbpedia.org/resource/Pedro_I_of_Brazil
