1492_0,0,1,"Prince William Frederick, Duke of Gloucester and Edinburgh","http://dbpedia.org/resource/Prince_William_Frederick,_Duke_of_Gloucester_and_Edinburgh"
1492_0,0,2,"Prince William, Duke of Gloucester","http://dbpedia.org/resource/Prince_Henry,_Duke_of_Gloucester"
1492_0,0,3,"Prince William, Duke of Cumberland","http://dbpedia.org/resource/Ernest_Augustus,_Crown_Prince_of_Hanover"
1492_0,0,4,Prince Wilhelm of Prussia,"http://dbpedia.org/resource/Frederick_III,_German_Emperor"
1492_0,0,5,Prince Waldemar of Prussia,http://dbpedia.org/resource/Prince_Waldemar_of_Prussia_(1889–1945)
1492_0,0,6,Prince Vittorio Amedeo Theodore of Savoy,http://dbpedia.org/resource/Prince_Vittorio_Amedeo_Teodoro_of_Savoy
1492_0,0,7,Prince Valdemar of Denmark,http://dbpedia.org/resource/Prince_Valdemar_of_Denmark
1492_0,0,8,"Prince Umberto, Count of Salemi","http://dbpedia.org/resource/Prince_Umberto,_Count_of_Salemi"
1492_0,0,9,Prince Tomohito of Mikasa,http://dbpedia.org/resource/Prince_Tomohito_of_Mikasa
1492_0,0,10,Prince Tomislav of Yugoslavia,http://dbpedia.org/resource/Prince_Tomislav_of_Yugoslavia
1492_0,0,11,Prince Sixtus of Bourbon-Parma,http://dbpedia.org/resource/Prince_Sixtus_of_Bourbon-Parma
1492_0,0,12,Prince Sigismund of Prussia,http://dbpedia.org/resource/Prince_Sigismund_of_Prussia_(1896–1978)
1492_0,0,13,Prince Rupert of the Rhine,http://dbpedia.org/resource/Prince_Rupert_of_the_Rhine
1492_0,0,14,"Prince Ranieri, Duke of Castro","http://dbpedia.org/resource/Prince_Ranieri,_Duke_of_Castro"
1492_0,0,15,"Prince Pierre, Duke of Valentinois","http://dbpedia.org/resource/Prince_Pierre,_Duke_of_Valentinois"
1492_0,0,16,"Prince Philippe, Count of Flanders","http://dbpedia.org/resource/Prince_Philippe,_Count_of_Flanders"
1492_0,0,17,Prince Peter of Greece and Denmark,http://dbpedia.org/resource/Prince_Peter_of_Greece_and_Denmark
1492_0,0,18,Prince Pedro Luiz of Orléans-Braganza,http://dbpedia.org/resource/Prince_Pedro_Luiz_of_Orléans-Braganza
1492_0,0,19,Prince Paul of Thurn and Taxis,http://dbpedia.org/resource/Prince_Paul_of_Thurn_and_Taxis
1492_0,0,20,Prince Octavius of Great Britain,http://dbpedia.org/resource/Prince_Octavius_of_Great_Britain
1492_0,0,21,Prince Nikola of Yugoslavia,http://dbpedia.org/resource/Prince_Nikola_of_Yugoslavia_(1928–1954)
1492_0,0,22,Prince Nicholas of Greece and Denmark,http://dbpedia.org/resource/Prince_Nicholas_of_Greece_and_Denmark
1492_0,0,23,Prince Naif bin Al-Abdullah,http://dbpedia.org/resource/Abdullah_of_Saudi_Arabia
1492_0,0,24,Prince Moulay Abdallah of Morocco,http://dbpedia.org/resource/Prince_Moulay_Abdallah_of_Morocco
1492_0,0,25,Prince Max Emanuel of Thurn and Taxis,http://dbpedia.org/resource/Prince_Max_Emanuel_of_Thurn_and_Taxis
1492_0,0,26,"Prince Maurizio, Duke of Montferrat","http://dbpedia.org/resource/Prince_Maurizio,_Duke_of_Montferrat"
1492_0,0,27,Prince Maurice of Battenberg,http://dbpedia.org/resource/Prince_Henry_of_Battenberg
1492_0,0,28,Prince Marco of Hohenlohe-Langenburg,"http://dbpedia.org/resource/Prince_Marco_of_Hohenlohe-Langenburg,_19th_Duke_of_Medinaceli"
1492_0,0,29,P. Makonnen,http://dbpedia.org/resource/Mekonnen_Haile_Selassie
1492_0,0,30,Prince Luís of Orléans-Braganza,http://dbpedia.org/resource/Prince_Luís_of_Orléans-Braganza_(1878–1920)
1492_0,0,31,"Prince Luigi Amedeo, Duke of the Abruzzi","http://dbpedia.org/resource/Prince_Luigi_Amedeo,_Duke_of_the_Abruzzi"
1492_0,0,32,Prince Ludwig of Wettin,http://dbpedia.org/resource/Prince_Ludwig_of_Wettin
1492_0,0,33,Prince Ludwig of Hesse and by Rhine,"http://dbpedia.org/resource/Louis_IV,_Grand_Duke_of_Hesse"
1492_0,0,34,Prince Ludwig of Bavaria,http://dbpedia.org/resource/Ludwig_III_of_Bavaria
1492_0,0,35,Prince Ludwig Philipp of Thurn and Taxis,http://dbpedia.org/resource/Prince_Ludwig_Philipp_of_Thurn_and_Taxis
1492_0,0,36,Prince Ludwig Ferdinand of Bavaria,http://dbpedia.org/resource/Prince_Ludwig_Ferdinand_of_Bavaria
1492_0,0,37,Prince Luís of Orléans-Braganza,http://dbpedia.org/resource/Prince_Luís_of_Orléans-Braganza_(1878–1920)
1492_0,0,38,P. L. Rwagasore,http://dbpedia.org/resource/George_P._L._Walker
1492_0,0,39,Prince Louis Ferdinand of Prussia,"http://dbpedia.org/resource/Louis_Ferdinand,_Prince_of_Prussia"
1492_0,0,40,"Prince Louis, Duke of Nemours","http://dbpedia.org/resource/Prince_Louis,_Duke_of_Nemours"
1492_0,0,41,"Prince Leopold, Duke of Brabant",http://dbpedia.org/resource/Leopold_III_of_Belgium
1492_0,0,42,"Prince Leopold, Duke of Albany","http://dbpedia.org/resource/Charles_Edward,_Duke_of_Saxe-Coburg_and_Gotha"
1492_0,0,43,"Prince Leopold, Count of Syracuse","http://dbpedia.org/resource/Prince_Leopold,_Count_of_Syracuse"
1492_0,0,44,Prince Konstantin of Bavaria,http://dbpedia.org/resource/Prince_Konstantin_of_Bavaria
1492_0,0,45,Prince Konrad of Bavaria,http://dbpedia.org/resource/Prince_Konrad_of_Bavaria
1492_0,0,46,Prince Karl of Bavaria,"http://dbpedia.org/resource/Luitpold,_Prince_Regent_of_Bavaria"
1492_0,0,47,Prince Karl Aloys of Liechtenstein,http://dbpedia.org/resource/Prince_Karl_Aloys_of_Liechtenstein
1492_0,0,48,Prince Kamal el Dine Hussein,http://dbpedia.org/resource/Prince_Kamal_el_Dine_Hussein
1492_0,0,49,Prince Joseph Clemens of Bavaria,http://dbpedia.org/resource/Prince_Joseph_Clemens_of_Bavaria
1492_0,0,50,Prince John of the United Kingdom,"http://dbpedia.org/resource/Princess_Louise,_Duchess_of_Argyll"
1492_0,0,51,Prince Johann Georg of Saxony,"http://dbpedia.org/resource/John_George_III,_Elector_of_Saxony"
1492_0,0,52,Prince Joachim of Prussia,http://dbpedia.org/resource/Prince_Joachim_of_Prussia
1492_0,0,53,"Prince Januarius, Count of Caltagirone","http://dbpedia.org/resource/Prince_Januarius,_Count_of_Caltagirone"
1492_0,0,54,Prince Hubertus of Prussia,http://dbpedia.org/resource/Prince_Hubertus_of_Prussia
1492_0,0,55,Prince Henry of Prussia,http://dbpedia.org/resource/Prince_Henry_of_Prussia_(1862–1929)
1492_0,0,56,Prince Henry of Prussia,http://dbpedia.org/resource/Prince_Henry_of_Prussia_(1862–1929)
1492_0,0,57,Prince Henry of Battenberg,"http://dbpedia.org/resource/George_Mountbatten,_2nd_Marquess_of_Milford_Haven"
1492_0,0,58,"Prince Henry, Duke of Gloucester","http://dbpedia.org/resource/Prince_Henry,_Duke_of_Gloucester"
1492_0,0,59,Prince Heinrich of Bavaria,http://dbpedia.org/resource/Prince_Heinrich_of_Bavaria
1492_0,0,60,Prince Gustav of Denmark,http://dbpedia.org/resource/Prince_Gustav_of_Denmark
1492_0,0,61,Prince Giuseppe of Naples and Sicily,http://dbpedia.org/resource/Francis_I_of_the_Two_Sicilies
1492_0,0,62,"Prince Giuseppe, Count of Asti","http://dbpedia.org/resource/Prince_Giuseppe,_Count_of_Asti"
1492_0,0,63,Prince George of Prussia,http://dbpedia.org/resource/Prince_George_of_Prussia
1492_0,0,64,Prince George of Greece and Denmark,http://dbpedia.org/resource/George_I_of_Greece
1492_0,0,65,Prince George of Denmark,http://dbpedia.org/resource/George_I_of_Greece
1492_0,0,66,Prince George Alexandrovich Yuryevsky,http://dbpedia.org/resource/Prince_George_Alexandrovich_Yuryevsky
1492_0,0,67,"Prince George, Duke of Kent","http://dbpedia.org/resource/Prince_George,_Duke_of_Kent"
1492_0,0,68,"Prince George, Duke of Cambridge","http://dbpedia.org/resource/Prince_Adolphus,_Duke_of_Cambridge"
1492_0,0,69,Prince Georg of Bavaria,http://dbpedia.org/resource/Prince_Georg_of_Bavaria
1492_0,0,70,Prince Gennaro of Naples and Sicily,http://dbpedia.org/resource/Ferdinand_I_of_the_Two_Sicilies
1492_0,0,71,"Prince Gaetan, Count of Girgenti","http://dbpedia.org/resource/Prince_Gaetan,_Count_of_Girgenti"
1492_0,0,72,Prince Gabriel of Thurn and Taxis,http://dbpedia.org/resource/Prince_Gabriel_of_Thurn_and_Taxis
1492_0,0,73,Prince Gabriel Constantinovich of Russia,http://dbpedia.org/resource/Prince_Gabriel_Constantinovich_of_Russia
1492_0,0,74,Prince Friso of Orange-Nassau,"http://dbpedia.org/resource/William_IV,_Prince_of_Orange"
1492_0,0,75,Prince Friedrich Wilhelm of Prussia,"http://dbpedia.org/resource/Frederick_III,_German_Emperor"
1492_0,0,76,Prince Frederick of Württemberg,http://dbpedia.org/resource/Frederick_I_of_Württemberg
1492_0,0,77,Prince Frederick of Hohenzollern-Sigmaringen,http://dbpedia.org/resource/Prince_Frederick_of_Hohenzollern-Sigmaringen
1492_0,0,78,Prince Frederick of Great Britain,http://dbpedia.org/resource/George_V
1492_0,0,79,Prince Frederick Adolf of Sweden,"http://dbpedia.org/resource/Prince_Frederick_Adolf,_Duke_of_Östergötland"
1492_0,0,80,"Prince Frederick, Duke of York and Albany","http://dbpedia.org/resource/Prince_Frederick,_Duke_of_York_and_Albany"
1492_0,0,81,Prince Franz of Bavaria,"http://dbpedia.org/resource/Maximilian_II_Emanuel,_Elector_of_Bavaria"
1492_0,0,82,Prince Franz de Paula of Liechtenstein,http://dbpedia.org/resource/Prince_Franz_de_Paula_of_Liechtenstein
1492_0,0,83,Prince Ferdinand of Saxe-Coburg and Gotha,http://dbpedia.org/resource/Ferdinand_I_of_Bulgaria
1492_0,0,84,"Prince Ferdinand Pius, Duke of Calabria","http://dbpedia.org/resource/Prince_Ferdinand_Pius,_Duke_of_Calabria"
1492_0,0,85,"Prince Ferdinand, Duke of Montpensier","http://dbpedia.org/resource/Prince_Ferdinand,_Duke_of_Montpensier"
1492_0,0,86,"Prince Ferdinand, Duke of Alençon","http://dbpedia.org/resource/Prince_Ferdinand,_Duke_of_Alençon"
1492_0,0,87,Prince Felix of Bourbon-Parma,http://dbpedia.org/resource/Prince_Felix_of_Bourbon-Parma
1492_0,0,88,"Prince Eugenio, Duke of Genoa","http://dbpedia.org/resource/Prince_Eugenio,_Duke_of_Genoa"
1492_0,0,89,Prince Eugen of Bavaria,http://dbpedia.org/resource/Prince_Eugen_of_Bavaria
1492_0,0,90,"Prince Emmanuel, Duke of Vendôme","http://dbpedia.org/resource/Prince_Emmanuel,_Duke_of_Vendôme"
1492_0,0,91,Prince Emanuele Filiberto of Savoy,"http://dbpedia.org/resource/Prince_Emanuele_Filiberto,_Duke_of_Aosta"
1492_0,0,92,"Prince Emanuele Filiberto, Duke of Aosta","http://dbpedia.org/resource/Prince_Emanuele_Filiberto,_Duke_of_Aosta"
1492_0,0,93,Prince Eitel Friedrich of Prussia,http://dbpedia.org/resource/Prince_Eitel_Friedrich_of_Prussia
1492_0,0,94,"Prince Edward, Duke of York and Albany","http://dbpedia.org/resource/Prince_Edward,_Duke_of_York_and_Albany"
1492_0,0,95,"Prince Edward, Duke of Kent and Strathearn","http://dbpedia.org/resource/Prince_Edward,_Duke_of_Kent_and_Strathearn"
1492_0,0,96,Prince Claus of the Netherlands,http://dbpedia.org/resource/Prince_Claus_of_the_Netherlands
1492_0,0,97,Prince Christopher of Greece and Denmark,http://dbpedia.org/resource/Prince_Christopher_of_Greece_and_Denmark
1492_0,0,98,Prince Christian of Schleswig-Holstein,http://dbpedia.org/resource/Prince_Christian_Victor_of_Schleswig-Holstein
1492_0,0,99,Prince Christian of Denmark,http://dbpedia.org/resource/Christian_VIII_of_Denmark
1492_0,0,100,Prince Christian Victor of Schleswig-Holstein,http://dbpedia.org/resource/Prince_Christian_Victor_of_Schleswig-Holstein
1492_0,0,101,Prince Charles of Prussia,"http://dbpedia.org/resource/Frederick_III,_German_Emperor"
1492_0,0,102,Prince Charles of Hesse-Kassel,http://dbpedia.org/resource/Prince_Charles_of_Hesse-Kassel
1492_0,0,103,Prince Charles of Denmark,http://dbpedia.org/resource/Haakon_VII_of_Norway
1492_0,0,104,Prince Carlos of Bourbon-Two Sicilies,http://dbpedia.org/resource/Charles_III_of_Spain
1492_0,0,105,Prince Carlo Francesco of Savoy,http://dbpedia.org/resource/Prince_Carlo_Francesco_of_Savoy
1492_0,0,106,"Prince Benedetto, Duke of Chablais","http://dbpedia.org/resource/Prince_Benedetto,_Duke_of_Chablais"
1492_0,0,107,"Prince Augustus Frederick, Duke of Sussex","http://dbpedia.org/resource/Prince_Augustus_Frederick,_Duke_of_Sussex"
1492_0,0,108,Prince August Wilhelm of Prussia,http://dbpedia.org/resource/Prince_August_Wilhelm_of_Prussia
1492_0,0,109,Prince Arthur of Connaught,http://dbpedia.org/resource/Prince_Arthur_of_Connaught
1492_0,0,110,"Prince Arthur, Duke of Connaught and Strathearn",http://dbpedia.org/resource/Prince_Arthur_of_Connaught
1492_0,0,111,Prince Arnulf of Bavaria,http://dbpedia.org/resource/Prince_Arnulf_of_Bavaria
1492_0,0,112,Prince Antônio Gastão of Orléans-Braganza,http://dbpedia.org/resource/Prince_Antônio_Gastão_of_Orléans-Braganza
1492_0,0,113,"Prince Antonio, Count of Lecce","http://dbpedia.org/resource/Prince_Antonio,_Count_of_Lecce"
1492_0,0,114,Prince Antônio Gastão of Orléans-Braganza,http://dbpedia.org/resource/Prince_Antônio_Gastão_of_Orléans-Braganza
1492_0,0,115,Prince Andrew of Yugoslavia,http://dbpedia.org/resource/Prince_Andrew_of_Yugoslavia
1492_0,0,116,Prince Andrew of Greece and Denmark,http://dbpedia.org/resource/Prince_Andrew_of_Greece_and_Denmark
1492_0,0,117,Prince Aloys of Liechtenstein,http://dbpedia.org/resource/Prince_Aloys_of_Liechtenstein
1492_0,0,118,Prince Alfred of Liechtenstein,http://dbpedia.org/resource/Prince_Alfred_of_Liechtenstein
1492_0,0,119,Prince Alfred of Great Britain,"http://dbpedia.org/resource/Alfred,_Duke_of_Saxe-Coburg_and_Gotha"
1492_0,0,120,Prince Alfonso of Hohenlohe-Langenburg,http://dbpedia.org/resource/Prince_Alfonso_of_Hohenlohe-Langenburg
