2010_Super_GT_season#7_1,1,1,Masataka Yanagida Kazuki Hoshino,http://dbpedia.org/resource/Kazuyoshi_Hoshino
2010_Super_GT_season#7_1,1,5,Takuto Iguchi Yuji Kunimoto,http://dbpedia.org/resource/Yuji_Kunimoto
2010_Super_GT_season#7_1,1,7,Tetsuya Tanaka Katsuyuki Hiranaka,http://dbpedia.org/resource/Tetsuya_Tanaka_(footballer)
2010_Super_GT_season#7_1,1,11,Kota Sasaki Tetsuya Yamano,
2010_Super_GT_season#7_1,1,14,Hideshi Matsuda Hiroki Yoshimoto,http://dbpedia.org/resource/Hiroki_Yoshimoto
2010_Super_GT_season#7_1,1,17,Masami Kageyama,http://dbpedia.org/resource/Masami_Kageyama
