"F1: 0.00000","Precision: 0.00000","Recall: 0.00000"
"Col","Row","Value","Submitted URI","Correct URI's"
"1","15","Patrick Huisman Marc Goossens Vincent Vosse","http://dbpedia.org/resource/Patrick_Vincent_Dwyer","http://dbpedia.org/resource/Patrick_Huisman"
"1","16","Patrick Huisman Marc Goossens Thierry Boutsen","http://dbpedia.org/resource/Patrick_Dewaere","http://dbpedia.org/resource/Patrick_Huisman"
"1","23","Marc Goossens David Hart Guy Verheyen Jan Heylen","http://de.dbpedia.org/resource/Jan_Goossens","http://dbpedia.org/resource/Marc_Goossens"
"1","30","Laurens Vanthoor Anthony Kumpen Marco Bonanomi Edward Sandström","http://dbpedia.org/resource/List_of_Home_and_Away_characters_(1999)","http://dbpedia.org/resource/Vanthoor http://dbpedia.org/resource/Laurens_Vanthoor"
