375_0,0,1,Journal of Social Work,http://dbpedia.org/resource/Journal_of_Social_Work
375_0,0,2,Journal of Social Philosophy,http://dbpedia.org/resource/Journal_of_Social_Philosophy
375_0,0,3,Journal of Social Issues,http://dbpedia.org/resource/Journal_of_Social_Issues
375_0,0,4,Journal of Small Business Management,http://dbpedia.org/resource/Journal_of_Small_Business_Management
375_0,0,5,Journal of Simulation,http://dbpedia.org/resource/Journal_of_Simulation
375_0,0,6,Journal of Sex Research,http://dbpedia.org/resource/Journal_of_Sex_Research
375_0,0,7,Journal of Sex & Marital Therapy,http://dbpedia.org/resource/Journal_of_Sex_&_Marital_Therapy
375_0,0,8,Journal of Service Research,http://dbpedia.org/resource/Journal_of_Service_Research
375_0,0,9,Journal of Sensory Studies,http://dbpedia.org/resource/Journal_of_Sensory_Studies
375_0,0,10,Journal of Second Language Writing,http://dbpedia.org/resource/Journal_of_Second_Language_Writing
375_0,0,11,Journal of School Nursing,http://dbpedia.org/resource/Journal_of_School_Nursing
375_0,0,12,Journal of School Health,http://dbpedia.org/resource/Journal_of_School_Health
375_0,0,13,Journal of Sandwich Structures and Materials,http://dbpedia.org/resource/Journal_of_Sandwich_Structures_and_Materials
375_0,0,14,Journal of Safety Research,http://dbpedia.org/resource/Journal_of_Safety_Research
375_0,0,15,Journal of Risk Research,http://dbpedia.org/resource/Journal_of_Risk_Research
375_0,0,16,Journal of Rheology,http://dbpedia.org/resource/Journal_of_Rheology
375_0,0,17,Journal of Research on Adolescence,http://dbpedia.org/resource/Journal_of_Research_on_Adolescence
375_0,0,18,Journal of Research in Reading,http://dbpedia.org/resource/Journal_of_Research_in_Reading
375_0,0,19,Journal of Research in Personality,http://dbpedia.org/resource/Journal_of_Research_in_Personality
375_0,0,20,Journal of Research in Crime and Delinquency,http://dbpedia.org/resource/Journal_of_Research_in_Crime_and_Delinquency
375_0,0,21,Journal of Religion & Health,http://dbpedia.org/resource/Journal_of_Religion_&_Health
375_0,0,22,Journal of Reinforced Plastics and Composites,http://dbpedia.org/resource/Journal_of_Reinforced_Plastics_and_Composites
375_0,0,23,Journal of Regional Science,http://dbpedia.org/resource/Journal_of_Regional_Science
375_0,0,24,Journal of Receptors and Signal Transduction,http://dbpedia.org/resource/Journal_of_Receptors_and_Signal_Transduction
375_0,0,25,Journal of Raptor Research,http://dbpedia.org/resource/Journal_of_Raptor_Research
375_0,0,26,Journal of Raman Spectroscopy,http://dbpedia.org/resource/Journal_of_Raman_Spectroscopy
375_0,0,27,Journal of Radiological Protection,http://dbpedia.org/resource/Journal_of_Radiological_Protection
375_0,0,28,Journal of Radiation Research,http://dbpedia.org/resource/Journal_of_Radiation_Research
375_0,0,29,Journal of Quaternary Science,http://dbpedia.org/resource/Journal_of_Quaternary_Science
375_0,0,30,Journal of Quantitative Criminology,http://dbpedia.org/resource/Journal_of_Quantitative_Criminology
375_0,0,31,Journal of Pure and Applied Algebra,http://dbpedia.org/resource/Journal_of_Pure_and_Applied_Algebra
375_0,0,32,Journal of Public Health Policy,http://dbpedia.org/resource/Journal_of_Public_Health_Policy
375_0,0,33,Journal of Public Health Management & Practice,http://dbpedia.org/resource/Journal_of_Public_Health_Management_&_Practice
375_0,0,34,Journal of Public Health,http://dbpedia.org/resource/Journal_of_Public_Health
375_0,0,35,Journal of Public Economics,http://dbpedia.org/resource/Journal_of_Public_Economics
375_0,0,36,Journal of Psychosomatic Obstetrics & Gynecology,http://dbpedia.org/resource/Journal_of_Psychosomatic_Obstetrics_&_Gynecology
375_0,0,37,Journal of Psychopharmacology,http://dbpedia.org/resource/Journal_of_Psychopharmacology
375_0,0,38,Journal of Psychoeducational Assessment,http://dbpedia.org/resource/Journal_of_Psychoeducational_Assessment
375_0,0,39,Journal of Psychiatry & Neuroscience,http://dbpedia.org/resource/Journal_of_Psychiatry_&_Neuroscience
375_0,0,40,Journal of Psychiatric Research,http://dbpedia.org/resource/Journal_of_Psychiatric_Research
375_0,0,41,Journal of Psychiatric Practice,http://dbpedia.org/resource/Journal_of_Psychiatric_Practice
375_0,0,42,Journal of Proteomics,http://dbpedia.org/resource/Journal_of_Proteomics
375_0,0,43,Journal of Proteome Research,http://dbpedia.org/resource/Journal_of_Proteome_Research
375_0,0,44,Journal of Prosthetic Dentistry,http://dbpedia.org/resource/Journal_of_Prosthetic_Dentistry
375_0,0,45,Journal of Product Innovation Management,http://dbpedia.org/resource/Journal_of_Product_Innovation_Management
375_0,0,46,Journal of Pragmatics,http://dbpedia.org/resource/Journal_of_Pragmatics
375_0,0,47,Journal of Power Sources,http://dbpedia.org/resource/Journal_of_Power_Sources
375_0,0,48,Journal of Postgraduate Medicine,http://dbpedia.org/resource/Journal_of_Postgraduate_Medicine
375_0,0,49,Journal of Positive Behavior Interventions,http://dbpedia.org/resource/Journal_of_Positive_Behavior_Interventions
375_0,0,50,Journal of Porphyrins and Phthalocyanines,http://dbpedia.org/resource/Journal_of_Porphyrins_and_Phthalocyanines
375_0,0,51,Journal of Population Economics,http://dbpedia.org/resource/Journal_of_Population_Economics
375_0,0,52,Journal of Polymer Science Part B,http://dbpedia.org/resource/Journal_of_Polymer_Science_Part_B
375_0,0,53,Journal of Polymer Science Part A,http://dbpedia.org/resource/Journal_of_Polymer_Science_Part_A
375_0,0,54,Journal of Political Economy,http://dbpedia.org/resource/Journal_of_Political_Economy
375_0,0,55,Journal of Policy Analysis and Management,http://dbpedia.org/resource/Journal_of_Policy_Analysis_and_Management
375_0,0,56,Journal of Plastic Film and Sheeting,http://dbpedia.org/resource/Journal_of_Plastic_Film_and_Sheeting
375_0,0,57,Journal of Planning Literature,http://dbpedia.org/resource/Journal_of_Planning_Literature
375_0,0,58,Journal of Planning Education and Research,http://dbpedia.org/resource/Journal_of_Planning_Education_and_Research
375_0,0,59,Journal of Pineal Research,http://dbpedia.org/resource/Journal_of_Pineal_Research
375_0,0,60,Journal of Physiotherapy,http://dbpedia.org/resource/Journal_of_Physiotherapy
375_0,0,61,Journal of Physics and Chemistry of Solids,http://dbpedia.org/resource/Journal_of_Physics_and_Chemistry_of_Solids
375_0,0,62,Journal of Physics D,http://dbpedia.org/resource/Journal_of_Physics_D
375_0,0,63,Journal of Physics B,http://dbpedia.org/resource/Journal_of_Physics_B
375_0,0,64,Journal of Physics A,http://dbpedia.org/resource/Journal_of_Physics_A
375_0,0,65,Journal of Physics: Condensed Matter,http://dbpedia.org/resource/Journal_of_Physics:_Condensed_Matter
375_0,0,66,Journal of Physical and Chemical Reference Data,http://dbpedia.org/resource/Journal_of_Physical_and_Chemical_Reference_Data
375_0,0,67,Journal of Physical Organic Chemistry,http://dbpedia.org/resource/Journal_of_Physical_Organic_Chemistry
375_0,0,68,Journal of Physical Oceanography,http://dbpedia.org/resource/Journal_of_Physical_Oceanography
375_0,0,69,Journal of Physical Chemistry Letters,http://dbpedia.org/resource/The_Journal_of_Physical_Chemistry_Letters
375_0,0,70,Journal of Physical Chemistry C,http://dbpedia.org/resource/The_Journal_of_Physical_Chemistry_C
375_0,0,71,Journal of Physical Chemistry B,http://dbpedia.org/resource/The_Journal_of_Physical_Chemistry_B
375_0,0,72,Journal of Physical Chemistry A,http://dbpedia.org/resource/The_Journal_of_Physical_Chemistry_A
375_0,0,73,Journal of Phycology,http://dbpedia.org/resource/Journal_of_Phycology
375_0,0,74,Journal of Phonetics,http://dbpedia.org/resource/Journal_of_Phonetics
375_0,0,75,Journal of Philosophy of Education,http://dbpedia.org/resource/Journal_of_Philosophy_of_Education
375_0,0,76,Journal of Pharmacy and Pharmacology,http://dbpedia.org/resource/Journal_of_Pharmacy_and_Pharmacology
375_0,0,77,Journal of Pharmacology and Experimental Therapeutics,http://dbpedia.org/resource/Journal_of_Pharmacology_and_Experimental_Therapeutics
375_0,0,78,Journal of Petrology,http://dbpedia.org/resource/Journal_of_Petrology
375_0,0,79,Journal of Personality and Social Psychology,http://dbpedia.org/resource/Journal_of_Personality_and_Social_Psychology
375_0,0,80,Journal of Personality Assessment,http://dbpedia.org/resource/Journal_of_Personality_Assessment
375_0,0,81,Journal of Personality,http://dbpedia.org/resource/Journal_of_Personality
375_0,0,82,Journal of Perinatology,http://dbpedia.org/resource/Journal_of_Perinatology
375_0,0,83,Journal of Peptide Science,http://dbpedia.org/resource/Journal_of_Peptide_Science
375_0,0,84,Journal of Pediatric and Adolescent Gynecology,http://dbpedia.org/resource/Journal_of_Pediatric_and_Adolescent_Gynecology
375_0,0,85,Journal of Pediatric Psychology,http://dbpedia.org/resource/Journal_of_Pediatric_Psychology
375_0,0,86,Journal of Pediatric Oncology Nursing,http://dbpedia.org/resource/Journal_of_Pediatric_Oncology_Nursing
375_0,0,87,Journal of Pediatric Health Care,http://dbpedia.org/resource/Journal_of_Pediatric_Health_Care
375_0,0,88,Journal of Pediatric Gastroenterology and Nutrition,http://dbpedia.org/resource/Journal_of_Pediatric_Gastroenterology_and_Nutrition
375_0,0,89,Journal of Peace Research,http://dbpedia.org/resource/Journal_of_Peace_Research
375_0,0,90,Journal of Parenteral and Enteral Nutrition,http://dbpedia.org/resource/Journal_of_Parenteral_and_Enteral_Nutrition
375_0,0,91,Journal of Palliative Medicine,http://dbpedia.org/resource/Journal_of_Palliative_Medicine
375_0,0,92,Journal of Pain and Symptom Management,http://dbpedia.org/resource/Journal_of_Pain_and_Symptom_Management
375_0,0,93,Journal of Orthopaedic Trauma,http://dbpedia.org/resource/Journal_of_Orthopaedic_Trauma
375_0,0,94,Journal of Orthopaedic Research,http://dbpedia.org/resource/Journal_of_Orthopaedic_Research
375_0,0,95,Journal of Orthopaedic & Sports Physical Therapy,http://dbpedia.org/resource/Journal_of_Orthopaedic_&_Sports_Physical_Therapy
375_0,0,96,Journal of Ornithology,http://dbpedia.org/resource/Journal_of_Ornithology
375_0,0,97,Journal of Organometallic Chemistry,http://dbpedia.org/resource/Journal_of_Organometallic_Chemistry
375_0,0,98,Journal of Organizational Behavior,http://dbpedia.org/resource/Journal_of_Organizational_Behavior
375_0,0,99,Journal of Organic Chemistry,http://dbpedia.org/resource/The_Journal_of_Organic_Chemistry
375_0,0,100,Journal of Oral and Maxillofacial Surgery,http://dbpedia.org/resource/Journal_of_Oral_and_Maxillofacial_Surgery
375_0,0,101,Journal of Optics,http://dbpedia.org/resource/Journal_of_Optics_(IOP_Publishing_journal)
375_0,0,102,Journal of Oil Palm Research,http://dbpedia.org/resource/Journal_of_Oil_Palm_Research
375_0,0,103,Journal of Official Statistics,http://dbpedia.org/resource/Journal_of_Official_Statistics
375_0,0,104,Journal of Occupational and Organizational Psychology,http://dbpedia.org/resource/Journal_of_Occupational_and_Organizational_Psychology
375_0,0,105,Journal of Occupational and Environmental Medicine,http://dbpedia.org/resource/Journal_of_Occupational_and_Environmental_Medicine
375_0,0,106,Journal of Occupational Health Psychology,http://dbpedia.org/resource/Journal_of_Occupational_Health_Psychology
375_0,0,107,"Journal of Obstetric, Gynecologic, & Neonatal Nursing","http://dbpedia.org/resource/Journal_of_Obstetric,_Gynecologic,_&_Neonatal_Nursing"
375_0,0,108,Journal of Nutritional Biochemistry,http://dbpedia.org/resource/Journal_of_Nutritional_Biochemistry
375_0,0,109,Journal of Nuclear Materials,http://dbpedia.org/resource/Journal_of_Nuclear_Materials
375_0,0,110,Journal of Nuclear Cardiology,http://dbpedia.org/resource/Journal_of_Nuclear_Cardiology
375_0,0,111,Journal of Nonlinear Optical Physics & Materials,http://dbpedia.org/resource/Journal_of_Nonlinear_Optical_Physics_&_Materials
