692_0,0,1,Climbing Mount Improbable,http://dbpedia.org/resource/Climbing_Mount_Improbable
692_0,0,2,Chris Crawford on Game Design,http://dbpedia.org/resource/Chris_Crawford_on_Game_Design
692_0,0,3,"Chicka, Chicka, 1, 2, 3","http://dbpedia.org/resource/Chicka_Chicka_1,_2,_3"
692_0,0,4,Charlie and the Great Glass Elevator,http://dbpedia.org/resource/Charlie_and_the_Great_Glass_Elevator
692_0,0,5,Cats of the Clans,http://dbpedia.org/resource/Cats_of_the_Clans
692_0,0,6,By the Shores of Silver Lake,http://dbpedia.org/resource/By_the_Shores_of_Silver_Lake
692_0,0,7,Bigger Deal: A Year Inside the Poker Boom,http://dbpedia.org/resource/Bigger_Deal:_A_Year_Inside_the_Poker_Boom
692_0,0,8,As I Walked Out One Midsummer Morning,http://dbpedia.org/resource/As_I_Walked_Out_One_Midsummer_Morning
692_0,0,9,An Urchin in the Storm,http://dbpedia.org/resource/An_Urchin_in_the_Storm
692_0,0,10,A Gift of Dragons,http://dbpedia.org/resource/A_Gift_of_Dragons
692_0,0,11,2061: Odyssey Three,http://dbpedia.org/resource/2061:_Odyssey_Three
