AFC_Asian_Cup_records_and_statistics#9_1,1,1,Ali Daei,http://dbpedia.org/resource/Ali_Daei
AFC_Asian_Cup_records_and_statistics#9_1,1,2,Lee Dong-Gook,http://dbpedia.org/resource/Lee_Dong-gook
AFC_Asian_Cup_records_and_statistics#9_1,1,3,Naohiro Takahara,http://dbpedia.org/resource/Naohiro_Takahara
AFC_Asian_Cup_records_and_statistics#9_1,1,4,"Jassem Al-Houwaidi, Younis Mahmoud",http://dbpedia.org/resource/Jasem_Al-Huwaidi
AFC_Asian_Cup_records_and_statistics#9_1,1,5,"Behtash Fariba, Hossein Kalani, Choi Soon-Ho, Faisal Al-Dakhil,",http://dbpedia.org/resource/Faisal_Al-Dakhil
AFC_Asian_Cup_records_and_statistics#9_1,1,6,"Yasser Al-Qahtani, Alexander Geynrikh, Tim Cahill",http://dbpedia.org/resource/Yasser_Al-Qahtani
AFC_Asian_Cup_records_and_statistics#9_1,1,7,"A'ala Hubail, Ismael Abdullatif, Ali Karimi, Ali Jabbari, Akinori Nishizawa, Woo Sang-Kwon, Chung Hae-Won, Hwang Sun-Hong, Koo Ja-Cheol, Nahum Stelmach, Shao Jiayi, Ali Mabkhout",http://dbpedia.org/resource/Chung_Hong-won
