"F1: 0.44444","Precision: 0.44444","Recall: 0.44444"
"Col","Row","Value","Submitted URI","Correct URI's"
"1","43","Rousseau's raid from Decatur, Ala., to the West Point and Montgomery Railroad, with skirmishes near Coosa River (13th), near Greenpoint and at Ten Island Ford (14th), near Auburn, Ala and near Chehaw, Ala (18th).","http://dbpedia.org/resource/United_States_Military_Academy","http://dbpedia.org/resource/Lovell_H._Rousseau http://dbpedia.org/resource/Lovell_Harrison_Rousseau http://dbpedia.org/resource/Lovell_Rousseau"
"1","59","McCook's raid on the Atlanta and West Point and Macon and Western Railroads, with skirmishes near Campbellton (28th), near Lovejoy's Station (29th), at Clear Creek (30th), and action near Newnan (30th).","http://dbpedia.org/resource/Near_North_Side,_Chicago","http://dbpedia.org/resource/Edward_McCook http://dbpedia.org/resource/Edward_M._McCook http://dbpedia.org/resource/Edward_Moody_McCook"
"1","60","Garrard's raid to South River, with skirmishes at Snapfinger Creek (27th), Flat Rock Bridge and Lithonia (28th).","http://dbpedia.org/resource/Ames_Creek_(South_Santiam_River)","http://dbpedia.org/resource/Kenner_Garrard"
"1","65","Wheeler's raid to North Georgia and East Tennessee, with combats at Dalton (August 14â\u0080\u009315) and other points.","http://dbpedia.org/resource/World_War_II","http://dbpedia.org/resource/General_""Fighting_Joe""_Wheeler http://dbpedia.org/resource/General_“Fighting_Joe”_Wheeler http://dbpedia.org/resource/Joseph_Wheeler"
"1","67","Kilpatrick's raid from Sandtown to Lovejoy's Station, with combats at Camp Creek (18th), Red Oak (19th), Flint River (19th), Jonesborough (19th), and Lovejoy's Station (20th).","http://dbpedia.org/resource/World_War_II","http://dbpedia.org/resource/Hugh_J._Kilpatrick http://dbpedia.org/resource/Judson_Kilpatrick http://dbpedia.org/resource/H._Judson_Kilpatrick http://dbpedia.org/resource/Kill-cavalry http://dbpedia.org/resource/Kilcavalry http://dbpedia.org/resource/Kill_cavalry http://dbpedia.org/resource/Hugh_Judson_Kilpatrick http://dbpedia.org/resource/Hugh_Kilpatrick"
