Family_Force_5#3_2,2,1,Best Night of Our Lives (Special Edition),http://dbpedia.org/resource/Best_Night_of_Our_Lives
Family_Force_5#3_2,2,2,Daylight Is Coming (Extended Edition),http://dbpedia.org/resource/Daylight_Is_Coming
Family_Force_5#3_2,2,3,Born Again (Miracles Edition),http://dbpedia.org/resource/Born_Again_(The_Notorious_B.I.G._album)
Family_Force_5#3_2,2,5,Metamorphosiz: The End Remixes Vol. 1,http://dbpedia.org/resource/Metamorphosiz:_The_End_Remixes_Vol._1
Family_Force_5#3_2,2,6,Capital Kings (iTunes Exclusive),http://dbpedia.org/resource/Capital_Kings_(album)
Family_Force_5#3_2,2,8,All This for a King: The Essential Collection,http://dbpedia.org/resource/All_This_for_a_King:_The_Essential_Collection
Family_Force_5#3_2,2,10,The White Album (Remix Project),http://dbpedia.org/resource/Weezer_(White_Album)
Family_Force_5#3_2,2,13,Eye'm All Mixed Up,http://dbpedia.org/resource/Eye'm_All_Mixed_Up
