"F1: 0.00000","Precision: 0.00000","Recall: 0.00000"
"Col","Row","Value","Submitted URI","Correct URI's"
"3","1","Ed Kavalee, Jane Kennedy, Troy Kinne, Rachel Corbett, Sam Pang","http://dbpedia.org/resource/Characters_of_Holby_City","http://dbpedia.org/resource/Ed_Kavalee"
"3","2","Ed Kavalee, Kate Langbroek, Troy Kinne, Rachel Corbett, Sam Pang","http://dbpedia.org/resource/1999_Pacific_typhoon_season","http://dbpedia.org/resource/Ed_Kavalee"
"3","3","Ed Kavalee, Jane Kennedy, Mick Molloy, Celia Pacquola, Sam Pang","http://dbpedia.org/resource/List_of_Desperate_Housewives_characters","http://dbpedia.org/resource/Ed_Kavalee"
"3","4","Ed Kavalee, Celia Pacquola, Troy Kinne, Rachel Corbett, Sam Pang","nan","http://dbpedia.org/resource/Ed_Kavalee"
"3","5","Ed Kavalee, Jane Kennedy, Glenn Robbins, Celia Pacquola, Sam Pang","http://dbpedia.org/resource/List_of_Desperate_Housewives_characters","http://dbpedia.org/resource/Ed_Kavalee"
"3","6","Ed Kavalee, Jane Kennedy, Glenn Robbins, Ronny Chieng, Sam Pang","http://dbpedia.org/resource/Slavery","http://dbpedia.org/resource/Ed_Kavalee"
"3","7","Ed Kavalee, Celia Pacquola, Mick Molloy, Rachel Corbett, Sam Pang","nan","http://dbpedia.org/resource/Ed_Kavalee"
"3","8","Ed Kavalee, Kate Langbroek, Troy Kinne, Tegan Higginbotham, Sam Pang","nan","http://dbpedia.org/resource/Ed_Kavalee"
