Italy_at_the_2006_Winter_Olympics#5_0,0,2,Simone Bertazzo Matteo Torchio,http://dbpedia.org/resource/Convoy_Buddies
Italy_at_the_2006_Winter_Olympics#5_0,0,3,Fabrizio Tosini Samuele Romanini,http://dbpedia.org/resource/Samuele_Romanini
Italy_at_the_2006_Winter_Olympics#5_0,0,4,Gerda Weissensteiner Jennifer Isacco,http://dbpedia.org/resource/Jennifer_Isacco
Italy_at_the_2006_Winter_Olympics#5_0,0,5,Jessica Gillarduzzi Fabiana Mollica,http://dbpedia.org/resource/Jessica_Gillarduzzi
Italy_at_the_2006_Winter_Olympics#5_0,0,6,Simone Bertazzo Samuele Romanini Matteo Torchio Omar Sacco,http://dbpedia.org/resource/Convoy_Buddies
Italy_at_the_2006_Winter_Olympics#5_0,0,7,Fabrizio Tosini Luca Ottolino Antonio De Sanctis Giorgio Morbidelli,http://it.dbpedia.org/resource/Personaggi_di_Squadra_antimafia_-_Palermo_oggi
