Jalan_Tun_Sambanthan#0_3,3,4,JALAN SYED PUTRA SOUTH ONLY Cheras Seremban Jalan Klang Lama Petaling Jaya Shah Alam Klang,
Jalan_Tun_Sambanthan#0_3,3,5,JALAN SYED PUTRA NORTHWEST ONLY City centre,http://dbpedia.org/resource/The_CW_Plus
Jalan_Tun_Sambanthan#0_3,3,10,KL SENTRAL MONORAIL STATION KLM,http://dbpedia.org/resource/Train_station
Jalan_Tun_Sambanthan#0_3,3,12,KUALA LUMPUR MIDDLE RING ROAD 1 EAST ONLY Sungai Besi Cheras Seremban Petaling Jaya Shah Alam Klang Istana Negara,http://dbpedia.org/resource/Kuala_Lumpur_Middle_Ring_Road_1
Jalan_Tun_Sambanthan#0_3,3,14,P&R KUALA LUMPUR RAILWAY STATION KTM Intercity KTM Komuter KTM ETS,http://dbpedia.org/resource/Kuala_Lumpur_railway_station
Jalan_Tun_Sambanthan#0_3,3,15,DAYABUMI,http://dbpedia.org/resource/Dayabumi_Complex
