Juan_M%C3%B3naco#1_3,3,1,"Heineken Open, Auckland, New Zealand",http://dbpedia.org/resource/ATP_Auckland_Open
Juan_M%C3%B3naco#1_3,3,2,"Movistar Open, Viña del Mar, Chile",http://dbpedia.org/resource/Chile_Open_(tennis)
Juan_M%C3%B3naco#1_3,3,3,"Open de Tenis Comunidad Valenciana, Valencia, Spain",http://dbpedia.org/resource/Valencia_Open
Juan_M%C3%B3naco#1_3,3,4,"Brasil Open, Costa do Sauípe, Brazil",http://dbpedia.org/resource/Brasil_Open
Juan_M%C3%B3naco#1_3,3,5,"VTR Open, Viña del Mar, Chile",http://dbpedia.org/resource/Chile_Open_(tennis)
Juan_M%C3%B3naco#1_3,3,6,"Qatar Open, Doha, Qatar",http://dbpedia.org/resource/Qatar_Open_(tennis)
