List_of_JAG_characters#Legalman_First_Class_Jennifer_.22Jen.22_Coates.2C_USN#21_1,1,1,Navy and Marine Corps Commendation Medal,http://de.dbpedia.org/resource/Navy_&_Marine_Corps_Commendation_Medal
List_of_JAG_characters#Legalman_First_Class_Jennifer_.22Jen.22_Coates.2C_USN#21_1,1,2,Navy and Marine Corps Achievement Medal with gold award star,http://dbpedia.org/resource/Commendation_Medal
List_of_JAG_characters#Legalman_First_Class_Jennifer_.22Jen.22_Coates.2C_USN#21_1,1,4,Navy Unit Commendation with one service star,http://dbpedia.org/resource/Navy_Unit_Commendation
List_of_JAG_characters#Legalman_First_Class_Jennifer_.22Jen.22_Coates.2C_USN#21_1,1,6,National Defense Service Medal with bronze service star,http://dbpedia.org/resource/National_Defense_Service_Medal
List_of_JAG_characters#Legalman_First_Class_Jennifer_.22Jen.22_Coates.2C_USN#21_1,1,7,Humanitarian Service Medal,http://dbpedia.org/resource/Humanitarian_Service_Medal
List_of_JAG_characters#Legalman_First_Class_Jennifer_.22Jen.22_Coates.2C_USN#21_1,1,9,Navy and Marine Corps Overseas Service Ribbon,http://dbpedia.org/resource/Overseas_Service_Ribbon
