List_of_political_parties_in_Australia#7_0,0,1,Australian Christians (WA),http://dbpedia.org/resource/Christian_Democratic_Party_(Australia)
List_of_political_parties_in_Australia#7_0,0,2,Australian Labor Party (Western Australian Branch),http://dbpedia.org/resource/Australian_Labor_Party
List_of_political_parties_in_Australia#7_0,0,3,Family First Party WA,http://dbpedia.org/resource/Family_First_Party
List_of_political_parties_in_Australia#7_0,0,4,National Party of Australia (WA) Inc,http://dbpedia.org/resource/National_Party_of_Australia
List_of_political_parties_in_Australia#7_0,0,5,Shooters and Fishers Party (WA) Inc,"http://dbpedia.org/resource/Shooters,_Fishers_and_Farmers_Party"
List_of_political_parties_in_Australia#7_0,0,6,The Greens (WA) Inc,http://dbpedia.org/resource/Greens_Western_Australia
List_of_political_parties_in_Australia#7_0,0,7,The Liberal Party of Australia (Western Australian Division) Inc,http://dbpedia.org/resource/Liberal_Party_of_Australia
