Little_League_World_Series_(West_Region)#2_2,2,3,Pleasanton American LL Pleasanton,"http://dbpedia.org/resource/Pleasanton,_California"
Little_League_World_Series_(West_Region)#2_2,2,5,Napa National LL Napa,http://dbpedia.org/resource/Bank_of_America_Roval_400
Little_League_World_Series_(West_Region)#2_2,2,6,Red Bluff LL Red Bluff,"http://dbpedia.org/resource/Red_Bluff,_California"
Little_League_World_Series_(West_Region)#2_2,2,7,Petaluma National LL Petaluma,"http://dbpedia.org/resource/Washington,_D.C."
Little_League_World_Series_(West_Region)#2_2,2,8,Belmont-Redwood Shores LL Belmont-Redwood Shores,http://dbpedia.org/resource/Belmont_–_Redwood_Shores_School_District
Little_League_World_Series_(West_Region)#2_2,2,9,Pacifica American LL Pacifica,"http://dbpedia.org/resource/Rockaway_Beach,_Pacifica,_California"
