Malaysian_Open_(tennis)#1_1,1,1,Liang Chen Wang Yafan,http://dbpedia.org/resource/Liang_Chen
Malaysian_Open_(tennis)#1_1,1,2,TÃ­mea Babos Chan Hao-ching,http://dbpedia.org/resource/Tímea_Babos
Malaysian_Open_(tennis)#1_1,1,3,Shuko Aoyama Chang Kai-chen (2),http://dbpedia.org/resource/Chang_Kai-chen
Malaysian_Open_(tennis)#1_1,1,4,Chang Kai-chen Chuang Chia-jung,http://dbpedia.org/resource/Chuang_Chia-jung
Malaysian_Open_(tennis)#1_1,1,5,Dinara Safina Galina Voskoboeva,http://dbpedia.org/resource/Dinara_Safina
Malaysian_Open_(tennis)#1_1,1,6,Chan Yung-jan Zheng Jie,http://dbpedia.org/resource/Yongzheng_Emperor
