Matt_Baggott#0_1,1,1,Knight Bachelor (Kt),http://dbpedia.org/resource/Order_of_the_Bath
Matt_Baggott#0_1,1,2,Order of the British Empire (CBE),http://dbpedia.org/resource/Order_of_the_British_Empire
Matt_Baggott#0_1,1,3,Queen's Police Medal (QPM),http://dbpedia.org/resource/Queen's_Police_Medal
Matt_Baggott#0_1,1,4,Queen Elizabeth II Golden Jubilee Medal,http://dbpedia.org/resource/Queen_Elizabeth_II_Golden_Jubilee_Medal
Matt_Baggott#0_1,1,5,Queen Elizabeth II Diamond Jubilee Medal,http://dbpedia.org/resource/Queen_Elizabeth_II_Golden_Jubilee_Medal
Matt_Baggott#0_1,1,6,Police Long Service and Good Conduct Medal,http://dbpedia.org/resource/Police_Long_Service_and_Good_Conduct_Medal
