Politics_of_Bangladesh#0_1,1,1,Awami League,http://dbpedia.org/resource/Awami_League
Politics_of_Bangladesh#0_1,1,4,Jamaat-e-Islami,http://dbpedia.org/resource/Bangladesh_Jamaat-e-Islami
Politics_of_Bangladesh#0_1,1,5,Pakistan Muslim League (Convention),http://dbpedia.org/resource/Pakistan_Muslim_League_(N)
Politics_of_Bangladesh#0_1,1,6,Pakistan Muslim League (Kou),http://dbpedia.org/resource/Pakistan_Muslim_League_(N)
Politics_of_Bangladesh#0_1,1,7,Pakistan Muslim League (Kayum),http://dbpedia.org/resource/Pakistan_Muslim_League_(N)
Politics_of_Bangladesh#0_1,1,8,National Awami Party (Wali),http://dbpedia.org/resource/National_Awami_Party
