Timeline_of_Indian_history#33_2,2,1,Ala-ud-din Khilji's army under Malik Kafur occupies Devagiri ending the Seuna Yadava Kingdom,http://dbpedia.org/resource/Allies_of_World_War_II
Timeline_of_Indian_history#33_2,2,2,Ulugh Khan defeats Prataparudra II ending the Kakatiya dynasty,http://dbpedia.org/resource/Muhammad_bin_Tughluq
Timeline_of_Indian_history#33_2,2,3,Vijayanagara Empire established by Harihara I and his brother Bukka Raya I,http://dbpedia.org/resource/Harihara_I
Timeline_of_Indian_history#33_2,2,4,Veera Ballala III was killed at the Battle of Madurai.,http://dbpedia.org/resource/Imperivm:_Great_Battles_of_Rome
Timeline_of_Indian_history#33_2,2,6,Samma Dynasty assumes rule over Sindh,http://dbpedia.org/resource/Samma_dynasty
Timeline_of_Indian_history#33_2,2,7,"Bukka, the Vijayanagara ruler and his son Kumara Kamapna capture the entire Tamil speaking parts.",http://dbpedia.org/resource/Augustus_III_of_Poland
Timeline_of_Indian_history#33_2,2,8,Timur plunders Lahore,
