Tripleman%C3%ADa_V-B#0_1,1,1,"Octagoncito, Chivito Rayada, and Mini Cibernetico defeated Pentagóncito, Mini Mankind, and Mini Goldust",http://dbpedia.org/resource/Kingdom_Come_(comics)
Tripleman%C3%ADa_V-B#0_1,1,2,"Los Vipers (Histeria, Maniaco and Mosco de la Merced) defeated Venum and Las Chivas Rayadas (Chivas Rayadas I and Chivas Rayadas II) by disqualification",http://dbpedia.org/resource/Professional_wrestling
Tripleman%C3%ADa_V-B#0_1,1,3,"Abismo Negro, Kraneo, Perro Aguayo Jr., and El Mexicano defeated El Picudo, May Flowers, Crazy 33, and Hijo del Espectro",http://dbpedia.org/resource/Perro_Aguayo_Jr.
Tripleman%C3%ADa_V-B#0_1,1,4,"Blue Demon Jr., Tinieblas and Tinieblas Jr. defeated Pentagón, Scarecrow, and Killer",http://dbpedia.org/resource/List_of_Dragon_Ball_characters
Tripleman%C3%ADa_V-B#0_1,1,5,Sangre Chicana defeated Heavy Metal by disqualification,http://dbpedia.org/resource/Heavy_metal_music
Tripleman%C3%ADa_V-B#0_1,1,7,Latin Lover defeated Pierroth Jr.,http://dbpedia.org/resource/Latin_Lover_(TV_series)
Tripleman%C3%ADa_V-B#0_1,1,8,"Perro Aguayo, Octagón, Cibernético and Canek defeated Jake Roberts, Gorgeous George III, El Cobarde Jr. and Fuerza Guerrera",http://dbpedia.org/resource/The_Maestro_(wrestler)
