F1: 0.00000,Precision: 0.00000,Recall: 0.00000,,
Col,Row,Value,Submitted URI,Correct URI's
2,1,Henrieta Farkasova Guide: Natalia Subrtova,http://dbpedia.org/resource/Henrieta_Delavrancea,http://dbpedia.org/resource/Henrieta_Farkašová http://dbpedia.org/resource/Henrieta_Farkasova
2,2,Alexandra Frantseva Guide: Evgenia Kolosovskaya,http://dbpedia.org/resource/Garrett_Conover_and_Alexandra_Conover_Bennett,http://dbpedia.org/resource/Alexandra_Frantseva http://dbpedia.org/resource/Aleksandra_Frantceva http://dbpedia.org/resource/Aleksandra_Frantseva
2,3,Kelly Gallagher Guide: Charlotte Evans,http://dbpedia.org/resource/Charlotte_Evans,http://dbpedia.org/resource/Kelly_Gallagher_(alpine_skier)
2,4,Melissa Perrine Guide: Andrew Bor,http://dbpedia.org/resource/Andy_Bor,http://dbpedia.org/resource/Melissa_Perrine
2,8,Danelle Umstead Guide: Robert Umstead,http://dbpedia.org/resource/USS_Samuel_B._Roberts_(FFG-58),http://dbpedia.org/resource/Danelle_Umstead http://dbpedia.org/resource/Danielle_Umstead
