F1: 0.00000,Precision: 0.00000,Recall: 0.00000,,
Col,Row,Value,Submitted URI,Correct URI's
1,4,Thailand (THA) Patarapa Naovaniruth Nattaporn Suwannavasit,http://dbpedia.org/resource/Thaïs_(opera),http://dbpedia.org/resource/Thailand_at_the_2009_Asian_Youth_Games
1,6,Indonesia (INA) Cheya Chantika Syncheria Ng,http://dbpedia.org/resource/Vice_President_of_Indonesia,http://dbpedia.org/resource/Indonesia_at_the_2009_Asian_Youth_Games
1,8,China (CHN) Li Qing Wu Junyi,http://dbpedia.org/resource/Prince_Li_(禮),http://dbpedia.org/resource/China_at_the_2009_Asian_Youth_Games
1,9,China (CHN) Li Qing Wang Ying,http://dbpedia.org/resource/Prince_Li_(禮),http://dbpedia.org/resource/China_at_the_2009_Asian_Youth_Games
