v10_1293_0,0,1,Journal of the Gay and Lesbian Medical Association,http://dbpedia.org/resource/Journal_of_the_Gay_and_Lesbian_Medical_Association
v10_1293_0,0,2,Journal of the Chemical Society of Pakistan,http://dbpedia.org/resource/Journal_of_the_Chemical_Society_of_Pakistan
v10_1293_0,0,3,"Journal of the Chemical Society, Faraday Transactions","http://dbpedia.org/resource/Journal_of_the_Chemical_Society,_Faraday_Transactions"
v10_1293_0,0,4,Journal of the Canadian Society of Forensic Science,http://dbpedia.org/resource/Journal_of_the_Canadian_Society_of_Forensic_Science
v10_1293_0,0,5,Journal of the British Interplanetary Society,http://dbpedia.org/resource/Journal_of_the_British_Interplanetary_Society
v10_1293_0,0,6,Journal of the British Astronomical Association,http://dbpedia.org/resource/Journal_of_the_British_Astronomical_Association
v10_1293_0,0,7,Journal of the Association for Information Science and Technology,http://dbpedia.org/resource/Journal_of_the_Association_for_Information_Science_and_Technology
v10_1293_0,0,8,Journal of the American Medical Informatics Association,http://dbpedia.org/resource/Journal_of_the_American_Medical_Informatics_Association
v10_1293_0,0,9,Journal of the American College of Cardiology,http://dbpedia.org/resource/Journal_of_the_American_College_of_Cardiology
v10_1293_0,0,10,Journal of the American Chemical Society,http://dbpedia.org/resource/Journal_of_the_American_Chemical_Society
v10_1293_0,0,11,Journal of the American Ceramic Society,http://dbpedia.org/resource/Journal_of_the_American_Ceramic_Society
v10_1293_0,0,12,Journal of the American Board of Family Medicine,http://dbpedia.org/resource/Journal_of_the_American_Board_of_Family_Medicine
v10_1293_0,0,13,Journal of the American Academy of Dermatology,http://dbpedia.org/resource/Journal_of_the_American_Academy_of_Dermatology
v10_1293_0,0,14,Journal of the American Academy of Child and Adolescent Psychiatry,http://dbpedia.org/resource/Journal_of_the_American_Academy_of_Child_and_Adolescent_Psychiatry
v10_1293_0,0,15,Journal of the Academy of Nutrition and Dietetics,http://dbpedia.org/resource/Journal_of_the_Academy_of_Nutrition_and_Dietetics
v10_1293_0,0,16,Journal of Zoological Systematics and Evolutionary Research,http://dbpedia.org/resource/Journal_of_Zoological_Systematics_and_Evolutionary_Research
v10_1293_0,0,17,Journal of Zhejiang University Science B,http://dbpedia.org/resource/Journal_of_Zhejiang_University_Science_B
v10_1293_0,0,18,Journal of Zhejiang University Science A,http://dbpedia.org/resource/Journal_of_Zhejiang_University_Science_A
v10_1293_0,0,19,Journal of World History,http://dbpedia.org/resource/Journal_of_World_History
v10_1293_0,0,20,Journal of Women & Aging,http://dbpedia.org/resource/Journal_of_Women_&_Aging
v10_1293_0,0,21,Journal of Women's Health,http://dbpedia.org/resource/Journal_of_Women's_Health
v10_1293_0,0,22,Journal of Vocational Behavior,http://dbpedia.org/resource/Journal_of_Vocational_Behavior
v10_1293_0,0,23,Journal of Virology,http://dbpedia.org/resource/Journal_of_Virology
v10_1293_0,0,24,Journal of Vibration and Control,http://dbpedia.org/resource/Journal_of_Vibration_and_Control
v10_1293_0,0,25,Journal of Urban Economics,http://dbpedia.org/resource/Journal_of_Urban_Economics
v10_1293_0,0,26,Journal of Traumatic Stress,http://dbpedia.org/resource/Journal_of_Traumatic_Stress
v10_1293_0,0,27,Journal of Translational Medicine,http://dbpedia.org/resource/Journal_of_Translational_Medicine
v10_1293_0,0,28,Journal of Toxicology and Environmental Health,http://dbpedia.org/resource/Journal_of_Toxicology_and_Environmental_Health
v10_1293_0,0,29,Journal of Thermoplastic Composite Materials,http://dbpedia.org/resource/Journal_of_Thermoplastic_Composite_Materials
v10_1293_0,0,30,Journal of Thermal Spray Technology,http://dbpedia.org/resource/Journal_of_Thermal_Spray_Technology
v10_1293_0,0,31,Journal of Theoretical Politics,http://dbpedia.org/resource/Journal_of_Theoretical_Politics
v10_1293_0,0,32,Journal of Theoretical Biology,http://dbpedia.org/resource/Journal_of_Theoretical_Biology
v10_1293_0,0,33,Journal of Texture Studies,http://dbpedia.org/resource/Journal_of_Texture_Studies
v10_1293_0,0,34,Journal of Technical Writing and Communication,http://dbpedia.org/resource/Journal_of_Technical_Writing_and_Communication
v10_1293_0,0,35,Journal of Synchrotron Radiation,http://dbpedia.org/resource/Journal_of_Synchrotron_Radiation
v10_1293_0,0,36,Journal of Symbolic Logic,http://dbpedia.org/resource/Journal_of_Symbolic_Logic
v10_1293_0,0,37,Journal of Surgical Research,http://dbpedia.org/resource/Journal_of_Surgical_Research
v10_1293_0,0,38,Journal of Surgical Oncology,http://dbpedia.org/resource/Journal_of_Surgical_Oncology
v10_1293_0,0,39,Journal of Structural Geology,http://dbpedia.org/resource/Journal_of_Structural_Geology
v10_1293_0,0,40,Journal of Strategic Information Systems,http://dbpedia.org/resource/Journal_of_Strategic_Information_Systems
v10_1293_0,0,41,Journal of South American Earth Sciences,http://dbpedia.org/resource/Journal_of_South_American_Earth_Sciences
v10_1293_0,0,42,Journal of Solid State Chemistry,http://dbpedia.org/resource/Journal_of_Solid_State_Chemistry
v10_1293_0,0,43,Journal of Sol-Gel Science and Technology,http://dbpedia.org/resource/Journal_of_Sol-Gel_Science_and_Technology
v10_1293_0,0,44,Journal of Social and Personal Relationships,http://dbpedia.org/resource/Journal_of_Social_and_Personal_Relationships
v10_1293_0,0,45,Journal of Small Business Management,http://dbpedia.org/resource/Journal_of_Small_Business_Management
v10_1293_0,0,46,Journal of Sex Research,http://dbpedia.org/resource/Journal_of_Sex_Research
v10_1293_0,0,47,Journal of Sensory Studies,http://dbpedia.org/resource/Journal_of_Sensory_Studies
v10_1293_0,0,48,Journal of Semitic Studies,http://dbpedia.org/resource/Journal_of_Semitic_Studies
v10_1293_0,0,49,Journal of Sandwich Structures and Materials,http://dbpedia.org/resource/Journal_of_Sandwich_Structures_and_Materials
v10_1293_0,0,50,Journal of Rheology,http://dbpedia.org/resource/Journal_of_Rheology
v10_1293_0,0,51,Journal of Religion & Health,http://dbpedia.org/resource/Journal_of_Religion_&_Health
v10_1293_0,0,52,Journal of Reinforced Plastics and Composites,http://dbpedia.org/resource/Journal_of_Reinforced_Plastics_and_Composites
v10_1293_0,0,53,Journal of Rehabilitation Research and Development,http://dbpedia.org/resource/Journal_of_Rehabilitation_Research_and_Development
v10_1293_0,0,54,Journal of Receptors and Signal Transduction,http://dbpedia.org/resource/Journal_of_Receptors_and_Signal_Transduction
v10_1293_0,0,55,Journal of Radiation Research,http://dbpedia.org/resource/Journal_of_Radiation_Research
v10_1293_0,0,56,Journal of Quantitative Criminology,http://dbpedia.org/resource/Journal_of_Quantitative_Criminology
v10_1293_0,0,57,Journal of Pure and Applied Algebra,http://dbpedia.org/resource/Journal_of_Pure_and_Applied_Algebra
v10_1293_0,0,58,Journal of Public Health Policy,http://dbpedia.org/resource/Journal_of_Public_Health_Policy
v10_1293_0,0,59,Journal of Public Economics,http://dbpedia.org/resource/Journal_of_Public_Economics
v10_1293_0,0,60,Journal of Psychopharmacology,http://dbpedia.org/resource/Journal_of_Psychopharmacology
v10_1293_0,0,61,Journal of Psychiatry & Neuroscience,http://dbpedia.org/resource/Journal_of_Psychiatry_&_Neuroscience
v10_1293_0,0,62,Journal of Psychiatric Research,http://dbpedia.org/resource/Journal_of_Psychiatric_Research
v10_1293_0,0,63,Journal of Proteomics,http://dbpedia.org/resource/Journal_of_Proteomics
v10_1293_0,0,64,Journal of Proteome Research,http://dbpedia.org/resource/Journal_of_Proteome_Research
v10_1293_0,0,65,Journal of Prosthetic Dentistry,http://dbpedia.org/resource/Journal_of_Prosthetic_Dentistry
v10_1293_0,0,66,Journal of Product Innovation Management,http://dbpedia.org/resource/Journal_of_Product_Innovation_Management
v10_1293_0,0,67,Journal of Population Economics,http://dbpedia.org/resource/Journal_of_Population_Economics
v10_1293_0,0,68,Journal of Polymer Science Part B,http://dbpedia.org/resource/Journal_of_Polymer_Science_Part_B
v10_1293_0,0,69,Journal of Polymer Science Part A,http://dbpedia.org/resource/Journal_of_Polymer_Science_Part_A
v10_1293_0,0,70,Journal of Political Economy,http://dbpedia.org/resource/Journal_of_Political_Economy
v10_1293_0,0,71,Journal of Plastic Film and Sheeting,http://dbpedia.org/resource/Journal_of_Plastic_Film_and_Sheeting
v10_1293_0,0,72,Journal of Pineal Research,http://dbpedia.org/resource/Journal_of_Pineal_Research
v10_1293_0,0,73,Journal of Physics and Chemistry of Solids,http://dbpedia.org/resource/Journal_of_Physics_and_Chemistry_of_Solids
v10_1293_0,0,74,Journal of Physics D,http://dbpedia.org/resource/Journal_of_Physics_D
v10_1293_0,0,75,Journal of Physics B,http://dbpedia.org/resource/Journal_of_Physics_B
v10_1293_0,0,76,Journal of Physics A,http://dbpedia.org/resource/Journal_of_Physics_A
v10_1293_0,0,77,Journal of Physics: Condensed Matter,http://dbpedia.org/resource/Journal_of_Physics:_Condensed_Matter
v10_1293_0,0,78,Journal of Physical and Chemical Reference Data,http://dbpedia.org/resource/Journal_of_Physical_and_Chemical_Reference_Data
v10_1293_0,0,79,Journal of Physical Oceanography,http://dbpedia.org/resource/Journal_of_Physical_Oceanography
v10_1293_0,0,80,Journal of Physical Chemistry Letters,http://dbpedia.org/resource/The_Journal_of_Physical_Chemistry_Letters
v10_1293_0,0,81,Journal of Phycology,http://dbpedia.org/resource/Journal_of_Phycology
v10_1293_0,0,82,Journal of Photochemistry and Photobiology,http://dbpedia.org/resource/Journal_of_Photochemistry_and_Photobiology
v10_1293_0,0,83,Journal of Philosophical Logic,http://dbpedia.org/resource/Journal_of_Philosophical_Logic
v10_1293_0,0,84,Journal of Pharmacy and Pharmacology,http://dbpedia.org/resource/Journal_of_Pharmacy_and_Pharmacology
v10_1293_0,0,85,Journal of Pharmacology and Experimental Therapeutics,http://dbpedia.org/resource/Journal_of_Pharmacology_and_Experimental_Therapeutics
v10_1293_0,0,86,Journal of Personality and Social Psychology,http://dbpedia.org/resource/Journal_of_Personality_and_Social_Psychology
v10_1293_0,0,87,Journal of Peptide Science,http://dbpedia.org/resource/Journal_of_Peptide_Science
v10_1293_0,0,88,Journal of Pediatric Health Care,http://dbpedia.org/resource/Journal_of_Pediatric_Health_Care
v10_1293_0,0,89,Journal of Pediatric Gastroenterology and Nutrition,http://dbpedia.org/resource/Journal_of_Pediatric_Gastroenterology_and_Nutrition
v10_1293_0,0,90,Journal of Parasitology,http://dbpedia.org/resource/Journal_of_Parasitology
v10_1293_0,0,91,Journal of Orthopaedic Research,http://dbpedia.org/resource/Journal_of_Orthopaedic_Research
v10_1293_0,0,92,Journal of Ornithology,http://dbpedia.org/resource/Journal_of_Ornithology
v10_1293_0,0,93,Journal of Organizational Behavior,http://dbpedia.org/resource/Journal_of_Organizational_Behavior
v10_1293_0,0,94,Journal of Oral and Maxillofacial Surgery,http://dbpedia.org/resource/Journal_of_Oral_and_Maxillofacial_Surgery
v10_1293_0,0,95,Journal of Occupational and Organizational Psychology,http://dbpedia.org/resource/Journal_of_Occupational_and_Organizational_Psychology
v10_1293_0,0,96,Journal of Occupational and Environmental Medicine,http://dbpedia.org/resource/Journal_of_Occupational_and_Environmental_Medicine
v10_1293_0,0,97,"Journal of Obstetric, Gynecologic, & Neonatal Nursing","http://dbpedia.org/resource/Journal_of_Obstetric,_Gynecologic,_&_Neonatal_Nursing"
v10_1293_0,0,98,Journal of Nutritional Biochemistry,http://dbpedia.org/resource/Journal_of_Nutritional_Biochemistry
v10_1293_0,0,99,Journal of Number Theory,http://dbpedia.org/resource/Journal_of_Number_Theory
v10_1293_0,0,100,Journal of Nuclear Medicine Technology,http://dbpedia.org/resource/Journal_of_Nuclear_Medicine_Technology
v10_1293_0,0,101,Journal of Nuclear Materials,http://dbpedia.org/resource/Journal_of_Nuclear_Materials
v10_1293_0,0,102,Journal of Nuclear Cardiology,http://dbpedia.org/resource/Journal_of_Nuclear_Cardiology
v10_1293_0,0,103,Journal of Nonlinear Optical Physics & Materials,http://dbpedia.org/resource/Journal_of_Nonlinear_Optical_Physics_&_Materials
v10_1293_0,0,104,Journal of Non-Equilibrium Thermodynamics,http://dbpedia.org/resource/Journal_of_Non-Equilibrium_Thermodynamics
v10_1293_0,0,105,Journal of New Music Research,http://dbpedia.org/resource/Journal_of_New_Music_Research
v10_1293_0,0,106,Journal of Neurotherapy,http://dbpedia.org/resource/Journal_of_Neurotherapy
v10_1293_0,0,107,Journal of Neurosurgery,http://dbpedia.org/resource/Journal_of_Neurosurgery
v10_1293_0,0,108,Journal of Neuroscience Research,http://dbpedia.org/resource/Journal_of_Neuroscience_Research
v10_1293_0,0,109,Journal of Neuroscience Methods,http://dbpedia.org/resource/Journal_of_Neuroscience_Methods
v10_1293_0,0,110,Journal of Neurophysiology,http://dbpedia.org/resource/Journal_of_Neurophysiology
v10_1293_0,0,111,Journal of Neuropathology & Experimental Neurology,http://dbpedia.org/resource/Journal_of_Neuropathology_&_Experimental_Neurology
v10_1293_0,0,112,Journal of Neurology,http://dbpedia.org/resource/Journal_of_Neurology
v10_1293_0,0,113,Journal of Neuroinflammation,http://dbpedia.org/resource/Journal_of_Neuroinflammation
v10_1293_0,0,114,Journal of Neurogenetics,http://dbpedia.org/resource/Journal_of_Neurogenetics
v10_1293_0,0,115,Journal of Neurochemistry,http://dbpedia.org/resource/Journal_of_Neurochemistry
v10_1293_0,0,116,Journal of Neuro-Oncology,http://dbpedia.org/resource/Journal_of_Neuro-Oncology
