v10_382_0,0,1,Where Do You Go,http://dbpedia.org/resource/Where_Do_You_Go_(La_Bouche_song)
v10_382_0,0,2,Where Do We Go from Here,http://dbpedia.org/resource/Where_Do_I_Go_from_Here_(The_Supremes_song)
v10_382_0,0,3,Where Do We Go from Here?,http://dbpedia.org/resource/Where_Do_I_Go_from_Here_(The_Supremes_song)
v10_382_0,0,4,Where Do We Go,http://dbpedia.org/resource/Where_Do_We_Go
v10_382_0,0,5,Where Do I Go from You,http://dbpedia.org/resource/Where_Do_I_Go_from_You
v10_382_0,0,6,Where Do I Fit in the Picture,http://dbpedia.org/resource/Where_Do_I_Fit_in_the_Picture
v10_382_0,0,7,Where Do I Begin,http://dbpedia.org/resource/Where_Do_I_Begin_(song)
v10_382_0,0,8,Where Do Broken Hearts Go,http://dbpedia.org/resource/Where_Do_Broken_Hearts_Go
v10_382_0,0,9,Where Did the Feeling Go?,http://dbpedia.org/resource/Where_Did_the_Feeling_Go?
v10_382_0,0,10,Where Did We Go Wrong,http://dbpedia.org/resource/Where_Did_I_Go_Wrong
v10_382_0,0,11,Where Did Our Love Go,http://dbpedia.org/resource/Where_Did_Our_Love_Go
v10_382_0,0,12,Where Did It All Go Wrong?,http://dbpedia.org/resource/Where_Did_It_All_Go_Wrong?
v10_382_0,0,13,Where Did I Go Wrong,http://dbpedia.org/resource/Where_Did_I_Go_Wrong
v10_382_0,0,14,Where Did All the Love Go?,http://dbpedia.org/resource/Where_Did_All_the_Love_Go?
v10_382_0,0,15,Where Are You Now,http://dbpedia.org/resource/Where_Are_You_Now_(Clint_Black_song)
v10_382_0,0,16,Where Are You Going,http://dbpedia.org/resource/Where_Are_You_Going
v10_382_0,0,17,"Where Are You, Christmas?","http://dbpedia.org/resource/Where_Are_You,_Christmas?"
v10_382_0,0,18,Where Are We Runnin'?,http://dbpedia.org/resource/Where_Are_We_Runnin'?
v10_382_0,0,19,Where Are We Now?,http://dbpedia.org/resource/Where_Are_We_Now?
v10_382_0,0,20,Where's the Playground Susie,http://dbpedia.org/resource/Where's_the_Playground_Susie
v10_382_0,0,21,Where's the Love,http://dbpedia.org/resource/Where's_the_Love
v10_382_0,0,22,Where's Your Love,http://dbpedia.org/resource/Where's_Your_Love
v10_382_0,0,23,Where's Your Head At,http://dbpedia.org/resource/Where's_Your_Head_At
v10_382_0,0,24,Where's Summer B.?,http://dbpedia.org/resource/Where's_Summer_B.?
v10_382_0,0,25,Where'd You Go,http://dbpedia.org/resource/Where'd_You_Go_(Fort_Minor_song)
v10_382_0,0,26,Wher'm I Gonna Live?,http://dbpedia.org/resource/Wher'm_I_Gonna_Live?
v10_382_0,0,27,Whenever You Need Somebody,http://dbpedia.org/resource/Whenever_You_Need_Somebody_(song)
v10_382_0,0,28,Whenever You Need Me,http://dbpedia.org/resource/Whenever_You_Need_Me_(T'Pau_song)
v10_382_0,0,29,Whenever You Need Me,http://dbpedia.org/resource/Whenever_You_Need_Me_(T'Pau_song)
v10_382_0,0,30,Whenever You're Ready,http://dbpedia.org/resource/Whenever_You're_Around
v10_382_0,0,31,Whenever You're Near Me,http://dbpedia.org/resource/Whenever_You're_Near_Me
v10_382_0,0,32,Whenever You're Near,http://dbpedia.org/resource/Whenever_You're_Near
v10_382_0,0,33,Whenever You're Around,http://dbpedia.org/resource/Whenever_You're_Around
v10_382_0,0,34,Whenever There Is Love,http://dbpedia.org/resource/Whenever_There_Is_Love
v10_382_0,0,35,Whenever God Shines His Light,http://dbpedia.org/resource/Whenever_God_Shines_His_Light
v10_382_0,0,36,When the Wind Blows,http://dbpedia.org/resource/When_the_Wind_Blows_(song)
v10_382_0,0,37,When the War Is Over,http://dbpedia.org/resource/When_the_War_Is_Over
v10_382_0,0,38,When the Trickster Starts a-Poking,http://dbpedia.org/resource/When_the_Trickster_Starts_a-Poking
v10_382_0,0,39,When the Tigers Broke Free,http://dbpedia.org/resource/When_the_Tigers_Broke_Free
v10_382_0,0,40,When the Thought of You Catches Up with Me,http://dbpedia.org/resource/When_the_Thought_of_You_Catches_Up_with_Me
v10_382_0,0,41,When the Sun Goes Down,http://dbpedia.org/resource/When_the_Sun_Goes_Down_(Kenny_Chesney_song)
v10_382_0,0,42,When the Spirit Slips Away,http://dbpedia.org/resource/When_the_Spirit_Slips_Away
v10_382_0,0,43,When the Snow Falls,http://dbpedia.org/resource/When_the_Snow_Falls
v10_382_0,0,44,When the Sinner,http://dbpedia.org/resource/When_the_Sinner
v10_382_0,0,45,When the Shit Goes Down,http://dbpedia.org/resource/When_the_Shit_Goes_Down
v10_382_0,0,46,When the President Talks to God,http://dbpedia.org/resource/When_the_President_Talks_to_God
v10_382_0,0,47,When the Money's Gone,http://dbpedia.org/resource/When_the_Money's_Gone
v10_382_0,0,48,When the Lovelight Starts Shining Through His Eyes,http://dbpedia.org/resource/When_the_Lovelight_Starts_Shining_Through_His_Eyes
v10_382_0,0,49,When the Lights Go Out,http://dbpedia.org/resource/When_the_Lights_Go_Out
v10_382_0,0,50,When the Heartache Is Over,http://dbpedia.org/resource/When_the_Heartache_Is_Over
v10_382_0,0,51,When the Hangover Strikes,http://dbpedia.org/resource/When_the_Hangover_Strikes
v10_382_0,0,52,"When the Going Gets Tough, the Tough Get Going","http://dbpedia.org/resource/When_the_Going_Gets_Tough,_the_Tough_Get_Going_(song)"
v10_382_0,0,53,When the Girl in Your Arms Is the Girl in Your Heart,http://dbpedia.org/resource/When_the_Girl_in_Your_Arms_Is_the_Girl_in_Your_Heart
v10_382_0,0,54,When the Beat Drops Out,http://dbpedia.org/resource/When_the_Beat_Drops_Out
v10_382_0,0,55,When the Bassline Drops,http://dbpedia.org/resource/When_the_Bassline_Drops
v10_382_0,0,56,When the Bartender Cries,http://dbpedia.org/resource/When_the_Bartender_Cries
v10_382_0,0,57,When the Angels Sing,http://dbpedia.org/resource/When_the_Angels_Sing
v10_382_0,0,58,When a Woman's Fed Up,http://dbpedia.org/resource/When_a_Woman's_Fed_Up
v10_382_0,0,59,When a Woman,http://dbpedia.org/resource/When_a_Woman
v10_382_0,0,60,When a Man Lies,http://dbpedia.org/resource/When_a_Man_Lies
v10_382_0,0,61,When a Blind Man Cries,http://dbpedia.org/resource/When_a_Blind_Man_Cries
v10_382_0,0,62,When Your Heart Stops Beating,http://dbpedia.org/resource/When_Your_Heart_Stops_Beating_(song)
v10_382_0,0,63,When You Were Young,http://dbpedia.org/resource/Where_Were_You_(When_the_World_Stopped_Turning)
v10_382_0,0,64,When You Were Mine,http://dbpedia.org/resource/When_You_Were_Mine_(Prince_song)
v10_382_0,0,65,When You Wasn't Famous,http://dbpedia.org/resource/When_You_Wasn't_Famous
