v10_1360_0,0,1,Gösgen Nuclear Power Plant,http://dbpedia.org/resource/Gösgen_Nuclear_Power_Plant
v10_1360_0,0,2,Gravelines Nuclear Power Station,http://dbpedia.org/resource/Gravelines_Nuclear_Power_Station
v10_1360_0,0,3,Grafenrheinfeld nuclear power plant,http://dbpedia.org/resource/Grafenrheinfeld_nuclear_power_plant
v10_1360_0,0,4,Gouina Hydroelectric Plant,http://dbpedia.org/resource/Gouina_Hydroelectric_Plant
v10_1360_0,0,5,Golfech Nuclear Power Plant,http://dbpedia.org/resource/Golfech_Nuclear_Power_Plant
v10_1360_0,0,6,Goldisthal Pumped Storage Station,http://dbpedia.org/resource/Goldisthal_Pumped_Storage_Station
v10_1360_0,0,7,Glomfjord power plant,http://dbpedia.org/resource/Glomfjord_power_plant
v10_1360_0,0,8,Genesis Solar Energy Project,http://dbpedia.org/resource/Genesis_Solar_Energy_Project
v10_1360_0,0,9,Gariuai Hydroelectric Plant,http://dbpedia.org/resource/Gariuai_Hydroelectric_Plant
v10_1360_0,0,10,Gösgen Nuclear Power Plant,http://dbpedia.org/resource/Gösgen_Nuclear_Power_Plant
v10_1360_0,0,11,Fortum Klaipėda Combined Heat and Power Plant,http://dbpedia.org/resource/Fortum_Klaipėda_Combined_Heat_and_Power_Plant
v10_1360_0,0,12,Flamanville Nuclear Power Plant,http://dbpedia.org/resource/Flamanville_Nuclear_Power_Plant
v10_1360_0,0,13,Fessenheim Nuclear Power Plant,http://dbpedia.org/resource/Fessenheim_Nuclear_Power_Plant
v10_1360_0,0,14,Fengning Pumped Storage Power Station,http://dbpedia.org/resource/Żarnowiec_Pumped_Storage_Power_Station
v10_1360_0,0,15,Erlasee Solar Park,http://dbpedia.org/resource/Erlasee_Solar_Park
v10_1360_0,0,16,Entracque Power Plant,http://dbpedia.org/resource/Entracque_Power_Plant
v10_1360_0,0,17,Emsland Nuclear Power Plant,http://dbpedia.org/resource/Emsland_Nuclear_Power_Plant
v10_1360_0,0,18,Dorobanțu Wind Farm,http://dbpedia.org/resource/Dorobanțu_Wind_Farm
v10_1360_0,0,19,Doel Nuclear Power Station,http://dbpedia.org/resource/Doel_Nuclear_Power_Station
v10_1360_0,0,20,Davis–Besse Nuclear Power Station,http://dbpedia.org/resource/Davis–Besse_Nuclear_Power_Station
v10_1360_0,0,21,Cruas Nuclear Power Plant,http://dbpedia.org/resource/Cruas_Nuclear_Power_Plant
v10_1360_0,0,22,Cruachan Power Station,http://dbpedia.org/resource/Cruachan_Power_Station
v10_1360_0,0,23,Cottbus-Drewitz Solarpark,http://dbpedia.org/resource/Cottbus-Drewitz_Solarpark
v10_1360_0,0,24,Civaux Nuclear Power Plant,http://dbpedia.org/resource/Civaux_Nuclear_Power_Plant
v10_1360_0,0,25,Chooz Nuclear Power Plant,http://dbpedia.org/resource/Chooz_Nuclear_Power_Plant
v10_1360_0,0,26,Chinon Nuclear Power Plant,http://dbpedia.org/resource/Chinon_Nuclear_Power_Plant
v10_1360_0,0,27,Chernobyl Nuclear Power Plant,http://dbpedia.org/resource/Chernobyl_Nuclear_Power_Plant
v10_1360_0,0,28,Cattenom Nuclear Power Plant,http://dbpedia.org/resource/Cattenom_Nuclear_Power_Plant
v10_1360_0,0,29,Burgos Wind Farm,http://dbpedia.org/resource/Burgos_Wind_Farm
v10_1360_0,0,30,Brunsbüttel Nuclear Power Plant,http://dbpedia.org/resource/Brunsbüttel_Nuclear_Power_Plant
