v10_1896_0,0,1,Cool Gardens,http://dbpedia.org/resource/Cool_Gardens
v10_1896_0,0,2,Collected Poems,http://dbpedia.org/resource/Collected_Poems_(Tierney)
v10_1896_0,0,3,City of Gold,http://dbpedia.org/resource/City_of_Gold_(book)
v10_1896_0,0,4,Chris Crawford on Game Design,http://dbpedia.org/resource/Chris_Crawford_on_Game_Design
v10_1896_0,0,5,Cecily G. and the Nine Monkeys,http://dbpedia.org/resource/Cecily_G._and_the_Nine_Monkeys
v10_1896_0,0,6,Black Ships Before Troy,http://dbpedia.org/resource/Black_Ships_Before_Troy
v10_1896_0,0,7,Biscuit Bear,http://dbpedia.org/resource/Biscuit_Bear
v10_1896_0,0,8,Bigger Deal: A Year Inside the Poker Boom,http://dbpedia.org/resource/Bigger_Deal:_A_Year_Inside_the_Poker_Boom
v10_1896_0,0,9,Barlowe's Guide to Fantasy,http://dbpedia.org/resource/Barlowe's_Guide_to_Fantasy
v10_1896_0,0,10,Baboushka and the Three Kings,http://dbpedia.org/resource/Baboushka_and_the_Three_Kings
v10_1896_0,0,11,As I Walked Out One Midsummer Morning,http://dbpedia.org/resource/As_I_Walked_Out_One_Midsummer_Morning
v10_1896_0,0,12,Arrow to the Sun,http://dbpedia.org/resource/Arrow_to_the_Sun
