v10_1481_4,4,1,Humehume,http://dbpedia.org/resource/Humehume
v10_1481_4,4,2,C. t. Great,http://dbpedia.org/resource/Cyrus_the_Great
v10_1481_4,4,3,"Godwin, Earl of Wessex",http://dbpedia.org/resource/Harold_Godwinson
v10_1481_4,4,4,S. Syr,http://dbpedia.org/resource/Wilfrid_Laurier
v10_1481_4,4,5,M. H. Sultan,http://dbpedia.org/resource/Zayed_bin_Sultan_Al_Nahyan
v10_1481_4,4,6,"Karl Eusebius, Prince of Liechtenstein","http://dbpedia.org/resource/Karl_Eusebius,_Prince_of_Liechtenstein"
v10_1481_4,4,7,R. Shah,http://dbpedia.org/resource/Reza_Shah
v10_1481_4,4,8,M. H. Mirza,http://dbpedia.org/resource/Mohammad_Hassan_Mirza
v10_1481_4,4,9,H. Fairhair,http://dbpedia.org/resource/Harald_Fairhair
v10_1481_4,4,10,Frederick VIII of Denmark,http://dbpedia.org/resource/Frederick_VIII_of_Denmark
v10_1481_4,4,11,Charles IX of Sweden,http://dbpedia.org/resource/Charles_IX_of_Sweden
v10_1481_4,4,12,E. J. Vasa,http://dbpedia.org/resource/Sigismund_III_Vasa
v10_1481_4,4,13,Gustav III of Sweden,http://dbpedia.org/resource/Gustav_III_of_Sweden
v10_1481_4,4,14,Adolf Frederick of Sweden,"http://dbpedia.org/resource/Adolf_Frederick,_King_of_Sweden"
v10_1481_4,4,15,Oscar II of Sweden,http://dbpedia.org/resource/Oscar_II_of_Sweden
v10_1481_4,4,16,Gustaf V of Sweden,http://dbpedia.org/resource/Gustaf_V_of_Sweden
v10_1481_4,4,17,S. Hákonarson,http://dbpedia.org/resource/Magnus_VI_of_Norway
v10_1481_4,4,18,Babur,http://dbpedia.org/resource/Babur
v10_1481_4,4,19,Y. P. Chun,"http://dbpedia.org/resource/Yixuan,_Prince_Chun"
v10_1481_4,4,20,C. a. Iago,http://dbpedia.org/resource/James_VI_and_I
v10_1481_4,4,21,Alexandra Iosifovna of Altenburg,http://dbpedia.org/resource/Princess_Alexandra_of_Saxe-Altenburg
v10_1481_4,4,22,Princess Victoria Melita of Saxe-Coburg and Gotha,http://dbpedia.org/resource/Princess_Victoria_Melita_of_Saxe-Coburg_and_Gotha
v10_1481_4,4,23,Alexander II of Russia,http://dbpedia.org/resource/Alexander_I_of_Russia
v10_1481_4,4,24,Grand Duchess Alexandra Petrovna,http://dbpedia.org/resource/Alexandra_Feodorovna_(Charlotte_of_Prussia)
v10_1481_4,4,25,Alexandra Iosifovna of Altenburg,http://dbpedia.org/resource/Princess_Alexandra_of_Saxe-Altenburg
v10_1481_4,4,26,A. Feodorovna,http://dbpedia.org/resource/Alexandra_Feodorovna_(Alix_of_Hesse)
v10_1481_4,4,27,Alexandra Iosifovna of Altenburg,http://dbpedia.org/resource/Princess_Alexandra_of_Saxe-Altenburg
v10_1481_4,4,28,Alexander III of Russia,http://dbpedia.org/resource/Alexander_III_of_Russia
v10_1481_4,4,29,Grand Duke Paul Alexandrovich of Russia,http://dbpedia.org/resource/Grand_Duke_Paul_Alexandrovich_of_Russia
v10_1481_4,4,30,Grand Duke Vladimir Alexandrovich of Russia,http://dbpedia.org/resource/Grand_Duke_Vladimir_Alexandrovich_of_Russia
v10_1481_4,4,31,Alexander II of Russia,http://dbpedia.org/resource/Alexander_I_of_Russia
v10_1481_4,4,32,Grand Duke Michael Nikolaevich of Russia,http://dbpedia.org/resource/Grand_Duke_Michael_Nikolaevich_of_Russia
v10_1481_4,4,33,Alexander III of Russia,http://dbpedia.org/resource/Alexander_III_of_Russia
v10_1481_4,4,34,A. Feodorovna,http://dbpedia.org/resource/Alexandra_Feodorovna_(Alix_of_Hesse)
v10_1481_4,4,35,"Cyril Vladimirovich, Grand Duke of Russia",http://dbpedia.org/resource/Grand_Duke_Kirill_Vladimirovich_of_Russia
v10_1481_4,4,36,Grand Duke Vladimir Alexandrovich of Russia,http://dbpedia.org/resource/Grand_Duke_Vladimir_Alexandrovich_of_Russia
v10_1481_4,4,37,Catherine I of Russia,http://dbpedia.org/resource/Catherine_the_Great
v10_1481_4,4,38,A. Feodorovna,http://dbpedia.org/resource/Alexandra_Feodorovna_(Alix_of_Hesse)
v10_1481_4,4,39,George I of Greece,http://dbpedia.org/resource/George_I_of_Greece
v10_1481_4,4,40,Alexander II of Russia,http://dbpedia.org/resource/Alexander_I_of_Russia
v10_1481_4,4,41,John B. Kelly Sr.,http://dbpedia.org/resource/John_B._Kelly_Jr.
v10_1481_4,4,42,H. Daewongun,http://dbpedia.org/resource/Heungseon_Daewongun
v10_1481_4,4,43,"Henry II, Duke of Bavaria","http://dbpedia.org/resource/Henry_II,_Holy_Roman_Emperor"
v10_1481_4,4,44,"Cosimo II de' Medici, Grand Duke of Tuscany","http://dbpedia.org/resource/Cosimo_II_de'_Medici,_Grand_Duke_of_Tuscany"
v10_1481_4,4,45,Cosimo III de' Medici,"http://dbpedia.org/resource/Cosimo_II_de'_Medici,_Grand_Duke_of_Tuscany"
v10_1481_4,4,46,N. P. Luân,http://dbpedia.org/resource/Nguyễn_Phúc_Luân
v10_1481_4,4,47,Faisal I of Iraq,http://dbpedia.org/resource/Faisal_I_of_Iraq
v10_1481_4,4,48,S. II,http://dbpedia.org/resource/Elizabeth_II
v10_1481_4,4,49,A. Minor,http://dbpedia.org/resource/Antonia_Minor
v10_1481_4,4,50,"George II, Prince of Waldeck and Pyrmont","http://dbpedia.org/resource/George_II,_Prince_of_Waldeck_and_Pyrmont"
v10_1481_4,4,51,F. o. Mecklenburg-Strelitz,http://dbpedia.org/resource/Frederica_of_Mecklenburg-Strelitz
v10_1481_4,4,52,G. V,http://dbpedia.org/resource/George_V
v10_1481_4,4,53,A. o. Denmark,http://dbpedia.org/resource/Alexandra_of_Denmark
v10_1481_4,4,54,T. T. IV,http://dbpedia.org/resource/William_IV_of_the_United_Kingdom
v10_1481_4,4,55,Edward IV of England,http://dbpedia.org/resource/Edward_IV_of_England
v10_1481_4,4,56,Grand Duke Michael Alexandrovich of Russia,http://dbpedia.org/resource/Grand_Duke_Michael_Alexandrovich_of_Russia
v10_1481_4,4,57,Christian IX of Denmark,http://dbpedia.org/resource/Christian_IX_of_Denmark
v10_1481_4,4,58,"Ernest Augustus, Elector of Brunswick-Lüneburg","http://dbpedia.org/resource/Ernest_Augustus,_Elector_of_Brunswick-Lüneburg"
v10_1481_4,4,59,George III of the United Kingdom,"http://dbpedia.org/resource/Prince_Adolphus,_Duke_of_Cambridge"
v10_1481_4,4,60,Constantine I of Greece,http://dbpedia.org/resource/Constantine_I_of_Greece
v10_1481_4,4,61,George I of Great Britain,http://dbpedia.org/resource/William_IV_of_the_United_Kingdom
v10_1481_4,4,62,"Frederick, Prince of Wales",http://dbpedia.org/resource/George_V
v10_1481_4,4,63,Alexander Bagration of Mukhrani,http://dbpedia.org/resource/Alexander_Bagration_of_Mukhrani
v10_1481_4,4,64,Amalie Auguste of Bavaria,http://dbpedia.org/resource/Amalie_Auguste_of_Bavaria
v10_1481_4,4,65,"Ernest Louis, Grand Duke of Hesse","http://dbpedia.org/resource/Ernest_Louis,_Grand_Duke_of_Hesse"
v10_1481_4,4,66,Frederick Augustus III of Saxony,http://dbpedia.org/resource/Frederick_Augustus_III_of_Saxony
v10_1481_4,4,67,M. Mahal,http://dbpedia.org/resource/Mumtaz_Mahal
v10_1481_4,4,68,Henry IV of France,http://dbpedia.org/resource/Henry_IV_of_France
v10_1481_4,4,69,"Prince Louis, Duke of Nemours","http://dbpedia.org/resource/Prince_Louis,_Duke_of_Nemours"
v10_1481_4,4,70,M. Adulyadej,http://dbpedia.org/resource/Bhumibol_Adulyadej
v10_1481_4,4,71,"Francesco Alvaro Maria Giorgio Ruspoli, 1st Duke of Morignano","http://dbpedia.org/resource/Francesco_Alvaro_Maria_Giorgio_Ruspoli,_1st_Duke_of_Morignano"
v10_1481_4,4,72,Augustus,http://dbpedia.org/resource/Stanisław_August_Poniatowski
v10_1481_4,4,73,B. d. Montfort,http://dbpedia.org/resource/Bertrade_de_Montfort
v10_1481_4,4,74,I. Pasha,http://dbpedia.org/resource/Mustafa_Kemal_Atatürk
v10_1481_4,4,75,Alfonso I of Asturias,http://dbpedia.org/resource/Alfonso_I_of_Asturias
v10_1481_4,4,76,Frederick William I of Prussia,"http://dbpedia.org/resource/Frederick_III,_German_Emperor"
v10_1481_4,4,77,Albert I of Germany,"http://dbpedia.org/resource/Wilhelm_II,_German_Emperor"
v10_1481_4,4,78,Frederick I of Prussia,"http://dbpedia.org/resource/Frederick_III,_German_Emperor"
v10_1481_4,4,79,Frederick William III of Prussia,"http://dbpedia.org/resource/Frederick_III,_German_Emperor"
v10_1481_4,4,80,Prince Augustus William of Prussia,http://dbpedia.org/resource/Prince_Augustus_William_of_Prussia
v10_1481_4,4,81,Christian VI of Denmark,http://dbpedia.org/resource/Christian_VI_of_Denmark
v10_1481_4,4,82,Caroline Matilda of Great Britain,http://dbpedia.org/resource/Caroline_Matilda_of_Great_Britain
v10_1481_4,4,83,Christian VIII of Denmark,http://dbpedia.org/resource/Christian_VIII_of_Denmark
v10_1481_4,4,84,L. o. Hesse-Kassel,http://dbpedia.org/resource/Louise_of_Hesse-Kassel
v10_1481_4,4,85,"Charles I, Landgrave of Hesse-Kassel","http://dbpedia.org/resource/Charles_I,_Landgrave_of_Hesse-Kassel"
v10_1481_4,4,86,Christian I of Denmark,http://dbpedia.org/resource/Christian_VIII_of_Denmark
v10_1481_4,4,87,Christian X of Denmark,http://dbpedia.org/resource/Christian_X_of_Denmark
v10_1481_4,4,88,Christian V of Denmark,http://dbpedia.org/resource/Christian_V_of_Denmark
v10_1481_4,4,89,Christian III of Denmark,http://dbpedia.org/resource/Christian_III_of_Denmark
v10_1481_4,4,90,"Philip Joseph, Prince of Salm-Kyrburg","http://dbpedia.org/resource/Philip_Joseph,_Prince_of_Salm-Kyrburg"
v10_1481_4,4,91,C. o. Masovia,http://dbpedia.org/resource/Cymburgis_of_Masovia
v10_1481_4,4,92,"William I, German Emperor","http://dbpedia.org/resource/Frederick_III,_German_Emperor"
v10_1481_4,4,93,"Henry VI, Holy Roman Emperor","http://dbpedia.org/resource/Charles_VI,_Holy_Roman_Emperor"
v10_1481_4,4,94,"Frederick II, Duke of Swabia","http://dbpedia.org/resource/Frederick_II,_Duke_of_Swabia"
v10_1481_4,4,95,Maria Josepha of Austria,http://dbpedia.org/resource/Marie_Antoinette
v10_1481_4,4,96,J. Kettler,http://dbpedia.org/resource/Jacob_Kettler
v10_1481_4,4,97,"Frederick Christian, Elector of Saxony","http://dbpedia.org/resource/Frederick_Christian,_Elector_of_Saxony"
v10_1481_4,4,98,Prince Maximilian of Saxony,"http://dbpedia.org/resource/Maximilian,_Hereditary_Prince_of_Saxony"
v10_1481_4,4,99,Maria Anna of Portugal,http://dbpedia.org/resource/Maria_Anna_of_Spain
v10_1481_4,4,100,"Peter II, Grand Duke of Oldenburg","http://dbpedia.org/resource/Peter_II,_Grand_Duke_of_Oldenburg"
v10_1481_4,4,101,George II of Great Britain,http://dbpedia.org/resource/Queen_Elizabeth_The_Queen_Mother
v10_1481_4,4,102,Frederick V of Denmark,http://dbpedia.org/resource/Frederick_V_of_Denmark
v10_1481_4,4,103,Landgravine Amalie of Hesse-Darmstadt,http://dbpedia.org/resource/Princess_Amalie_of_Hesse-Darmstadt
v10_1481_4,4,104,"Gaston, Duke of Orléans","http://dbpedia.org/resource/Gaston,_Duke_of_Orléans"
v10_1481_4,4,105,Archduchess Elisabeth Amalie of Austria,http://dbpedia.org/resource/Archduchess_Elisabeth_Amalie_of_Austria
v10_1481_4,4,106,Prince Emanuel of Liechtenstein,http://dbpedia.org/resource/Prince_Emanuel_of_Liechtenstein_(1700–1771)
v10_1481_4,4,107,"Albert, 8th Prince of Thurn and Taxis","http://dbpedia.org/resource/Albert,_8th_Prince_of_Thurn_and_Taxis"
v10_1481_4,4,108,"Aloys II, Prince of Liechtenstein","http://dbpedia.org/resource/Aloys_II,_Prince_of_Liechtenstein"
v10_1481_4,4,109,Infante Francisco de Paula of Spain,"http://dbpedia.org/resource/Infante_Francisco_de_Paula,_Duke_of_Cádiz"
v10_1481_4,4,110,Francis IV of Modena,"http://dbpedia.org/resource/Francis_IV,_Duke_of_Modena"
v10_1481_4,4,111,Ferdinand I of the Two Sicilies,http://dbpedia.org/resource/Charles_III_of_Spain
v10_1481_4,4,112,Maria Christina of Savoy,http://dbpedia.org/resource/Maria_Cristina_of_Savoy
v10_1481_4,4,113,C. d. Medici,http://dbpedia.org/resource/Cosimo_de'_Medici
v10_1481_4,4,114,F. I. Rákóczi,http://dbpedia.org/resource/Francis_II_Rákóczi
v10_1481_4,4,115,S. o. Saxony,http://dbpedia.org/resource/Augustus_III_of_Poland
v10_1481_4,4,116,"Leopold, Duke of Lorraine","http://dbpedia.org/resource/Leopold_II,_Holy_Roman_Emperor"
v10_1481_4,4,117,"John V, Duke of Brittany","http://dbpedia.org/resource/John_V,_Duke_of_Brittany"
v10_1481_4,4,118,Duke Alexander of Württemberg,"http://dbpedia.org/resource/Francis,_Duke_of_Teck"
v10_1481_4,4,119,"Emanuele Ruspoli, 1st Prince of Poggio Suasa","http://dbpedia.org/resource/Emanuele_Ruspoli,_1st_Prince_of_Poggio_Suasa"
v10_1481_4,4,120,"Gaston, Duke of Orléans","http://dbpedia.org/resource/Gaston,_Duke_of_Orléans"
v10_1481_4,4,121,"Honoré IV, Prince of Monaco","http://dbpedia.org/resource/Honoré_IV,_Prince_of_Monaco"
v10_1481_4,4,122,M. L. d'Orléans,http://dbpedia.org/resource/Marie_Louise_d’Orléans
v10_1481_4,4,123,Philip V of Spain,http://dbpedia.org/resource/Philip_IV_of_Spain
v10_1481_4,4,124,Charles IV of Spain,"http://dbpedia.org/resource/Charles_V,_Holy_Roman_Emperor"
v10_1481_4,4,125,Maria Amalia of Naples and Sicily,http://dbpedia.org/resource/Maria_Amalia_of_Saxony
v10_1481_4,4,126,"Maximilian I, Elector of Bavaria",http://dbpedia.org/resource/Maximilian_I_Joseph_of_Bavaria
v10_1481_4,4,127,Charles III of Spain,"http://dbpedia.org/resource/Charles_V,_Holy_Roman_Emperor"
v10_1481_4,4,128,A. o. Braganza,http://dbpedia.org/resource/Catherine_of_Braganza
v10_1481_4,4,129,C. Manuel,http://fr.dbpedia.org/resource/Clément_Manuel
v10_1481_4,4,130,Francis I of the Two Sicilies,http://dbpedia.org/resource/Maria_Theresa_of_Naples_and_Sicily
v10_1481_4,4,131,"Ferdinand II, Holy Roman Emperor","http://dbpedia.org/resource/Charles_V,_Holy_Roman_Emperor"
v10_1481_4,4,132,"Charles II, Archduke of Austria",http://dbpedia.org/resource/Franz_Joseph_I_of_Austria
v10_1481_4,4,133,J. o. Castile,http://dbpedia.org/resource/Joanna_of_Castile
v10_1481_4,4,134,"Frederick, Hereditary Prince of Denmark",http://dbpedia.org/resource/Christian_VIII_of_Denmark
v10_1481_4,4,135,D. o. Aragon,http://dbpedia.org/resource/Ferdinand_II_of_Aragon
