v10_1294_0,0,1,Journal of Near-Death Studies,http://dbpedia.org/resource/Journal_of_Near-Death_Studies
v10_1294_0,0,2,Journal of Natural Products,http://dbpedia.org/resource/Journal_of_Natural_Products
v10_1294_0,0,3,Journal of Nanoparticle Research,http://dbpedia.org/resource/Journal_of_Nanoparticle_Research
v10_1294_0,0,4,Journal of Musculoskeletal Pain,http://dbpedia.org/resource/Journal_of_Musculoskeletal_Pain
v10_1294_0,0,5,Journal of Multivariate Analysis,http://dbpedia.org/resource/Journal_of_Multivariate_Analysis
v10_1294_0,0,6,"Journal of Money, Credit and Banking","http://dbpedia.org/resource/Journal_of_Money,_Credit_and_Banking"
v10_1294_0,0,7,Journal of Monetary Economics,http://dbpedia.org/resource/Journal_of_Monetary_Economics
v10_1294_0,0,8,Journal of Molecular and Cellular Cardiology,http://dbpedia.org/resource/Journal_of_Molecular_and_Cellular_Cardiology
v10_1294_0,0,9,Journal of Molecular Recognition,http://dbpedia.org/resource/Journal_of_Molecular_Recognition
v10_1294_0,0,10,Journal of Molecular Neuroscience,http://dbpedia.org/resource/Journal_of_Molecular_Neuroscience
v10_1294_0,0,11,Journal of Molecular Medicine,http://dbpedia.org/resource/Journal_of_Molecular_Medicine
v10_1294_0,0,12,Journal of Molecular Evolution,http://dbpedia.org/resource/Journal_of_Molecular_Evolution
v10_1294_0,0,13,Journal of Molecular Endocrinology,http://dbpedia.org/resource/Journal_of_Molecular_Endocrinology
v10_1294_0,0,14,Journal of Molecular Biology,http://dbpedia.org/resource/Journal_of_Molecular_Biology
v10_1294_0,0,15,Journal of Modern Optics,http://dbpedia.org/resource/Journal_of_Modern_Optics
v10_1294_0,0,16,"Journal of Mining and Metallurgy, Section B","http://dbpedia.org/resource/Journal_of_Mining_and_Metallurgy,_Section_B"
v10_1294_0,0,17,Journal of Mining Science,http://dbpedia.org/resource/Journal_of_Mining_Science
v10_1294_0,0,18,Journal of Microscopy,http://dbpedia.org/resource/Journal_of_Microscopy
v10_1294_0,0,19,Journal of Microencapsulation,http://dbpedia.org/resource/Journal_of_Microencapsulation
v10_1294_0,0,20,Journal of Medicine,http://dbpedia.org/resource/Journal_of_Legal_Medicine
v10_1294_0,0,21,Journal of Medicinal Chemistry,http://dbpedia.org/resource/Journal_of_Medicinal_Chemistry
v10_1294_0,0,22,Journal of Medical Virology,http://dbpedia.org/resource/Journal_of_Medical_Virology
v10_1294_0,0,23,Journal of Medical Genetics,http://dbpedia.org/resource/Journal_of_Medical_Genetics
v10_1294_0,0,24,Journal of Medical Entomology,http://dbpedia.org/resource/Journal_of_Medical_Entomology
v10_1294_0,0,25,Journal of Medical Biochemistry,http://dbpedia.org/resource/Journal_of_Medical_Biochemistry
v10_1294_0,0,26,Journal of Mathematical Psychology,http://dbpedia.org/resource/Journal_of_Mathematical_Psychology
v10_1294_0,0,27,Journal of Mathematical Physics,http://dbpedia.org/resource/Journal_of_Mathematical_Physics
v10_1294_0,0,28,Journal of Mathematical Economics,http://dbpedia.org/resource/Journal_of_Mathematical_Economics
v10_1294_0,0,29,Journal of Mathematical Biology,http://dbpedia.org/resource/Journal_of_Mathematical_Biology
v10_1294_0,0,30,Journal of Materials Science: Materials in Medicine,http://dbpedia.org/resource/Journal_of_Materials_Science:_Materials_in_Medicine
v10_1294_0,0,31,Journal of Materials Science: Materials in Electronics,http://dbpedia.org/resource/Journal_of_Materials_Science:_Materials_in_Electronics
v10_1294_0,0,32,Journal of Materials Research and Technology,http://dbpedia.org/resource/Journal_of_Materials_Research_and_Technology
v10_1294_0,0,33,Journal of Materials Engineering and Performance,http://dbpedia.org/resource/Journal_of_Materials_Engineering_and_Performance
v10_1294_0,0,34,Journal of Materials Chemistry C,http://dbpedia.org/resource/Journal_of_Materials_Chemistry_C
v10_1294_0,0,35,Journal of Materials Chemistry B,http://dbpedia.org/resource/Journal_of_Materials_Chemistry_B
v10_1294_0,0,36,Journal of Materials Chemistry A,http://dbpedia.org/resource/Journal_of_Materials_Chemistry_A
v10_1294_0,0,37,Journal of Materials Chemistry,http://dbpedia.org/resource/Journal_of_Materials_Chemistry
v10_1294_0,0,38,Journal of Mass Spectrometry,http://dbpedia.org/resource/Journal_of_Mass_Spectrometry
v10_1294_0,0,39,Journal of Marriage and Family,http://dbpedia.org/resource/Journal_of_Marriage_and_Family
v10_1294_0,0,40,Journal of Marketing Research,http://dbpedia.org/resource/Journal_of_Marketing_Research
v10_1294_0,0,41,Journal of Management Education,http://dbpedia.org/resource/Journal_of_Management_Education
v10_1294_0,0,42,Journal of Management,http://dbpedia.org/resource/Journal_of_Management
v10_1294_0,0,43,Journal of Magnetism and Magnetic Materials,http://dbpedia.org/resource/Journal_of_Magnetism_and_Magnetic_Materials
v10_1294_0,0,44,Journal of Low Temperature Physics,http://dbpedia.org/resource/Journal_of_Low_Temperature_Physics
v10_1294_0,0,45,Journal of Lipid Research,http://dbpedia.org/resource/Journal_of_Lipid_Research
v10_1294_0,0,46,Journal of Lightwave Technology,http://dbpedia.org/resource/Journal_of_Lightwave_Technology
v10_1294_0,0,47,Journal of Library Administration,http://dbpedia.org/resource/Journal_of_Library_Administration
v10_1294_0,0,48,Journal of Librarianship and Information Science,http://dbpedia.org/resource/Journal_of_Librarianship_and_Information_Science
v10_1294_0,0,49,Journal of Labelled Compounds and Radiopharmaceuticals,http://dbpedia.org/resource/Journal_of_Labelled_Compounds_and_Radiopharmaceuticals
v10_1294_0,0,50,Journal of Invertebrate Pathology,http://dbpedia.org/resource/Journal_of_Invertebrate_Pathology
v10_1294_0,0,51,Journal of International Economics,http://dbpedia.org/resource/Journal_of_International_Economics
v10_1294_0,0,52,Journal of Internal Medicine,http://dbpedia.org/resource/Journal_of_Internal_Medicine
v10_1294_0,0,53,Journal of Intelligent and Robotic Systems,http://dbpedia.org/resource/Journal_of_Intelligent_and_Robotic_Systems
v10_1294_0,0,54,Journal of Intelligent Material Systems and Structures,http://dbpedia.org/resource/Journal_of_Intelligent_Material_Systems_and_Structures
v10_1294_0,0,55,Journal of Intellectual & Developmental Disability,http://dbpedia.org/resource/Journal_of_Intellectual_&_Developmental_Disability
v10_1294_0,0,56,Journal of Integrative Medicine,http://dbpedia.org/resource/Journal_of_Integrative_Medicine
v10_1294_0,0,57,Journal of Instrumentation,http://dbpedia.org/resource/Journal_of_Instrumentation
v10_1294_0,0,58,Journal of Inorganic Biochemistry,http://dbpedia.org/resource/Journal_of_Inorganic_Biochemistry
v10_1294_0,0,59,Journal of Inherited Metabolic Disease,http://dbpedia.org/resource/Journal_of_Inherited_Metabolic_Disease
v10_1294_0,0,60,Journal of Information Science,http://dbpedia.org/resource/Journal_of_Information_Science
v10_1294_0,0,61,Journal of Infection,http://dbpedia.org/resource/Journal_of_Infection
v10_1294_0,0,62,Journal of Industrial Textiles,http://dbpedia.org/resource/Journal_of_Industrial_Textiles
v10_1294_0,0,63,Journal of Industrial Ecology,http://dbpedia.org/resource/Journal_of_Industrial_Ecology
v10_1294_0,0,64,Journal of Immunology,http://dbpedia.org/resource/Journal_of_Immunology
v10_1294_0,0,65,Journal of Hypertension,http://dbpedia.org/resource/Journal_of_Hypertension
v10_1294_0,0,66,Journal of Hymenoptera Research,http://dbpedia.org/resource/Journal_of_Hymenoptera_Research
v10_1294_0,0,67,Journal of Huntington's Disease,http://dbpedia.org/resource/Journal_of_Huntington's_Disease
v10_1294_0,0,68,Journal of Human Lactation,http://dbpedia.org/resource/Journal_of_Human_Lactation
v10_1294_0,0,69,Journal of Human Hypertension,http://dbpedia.org/resource/Journal_of_Human_Hypertension
v10_1294_0,0,70,Journal of Human Genetics,http://dbpedia.org/resource/Journal_of_Human_Genetics
v10_1294_0,0,71,Journal of Housing Economics,http://dbpedia.org/resource/Journal_of_Housing_Economics
v10_1294_0,0,72,Journal of Homosexuality,http://dbpedia.org/resource/Journal_of_Homosexuality
v10_1294_0,0,73,Journal of Holistic Nursing,http://dbpedia.org/resource/Journal_of_Holistic_Nursing
v10_1294_0,0,74,Journal of High Energy Physics,http://dbpedia.org/resource/Journal_of_High_Energy_Physics
v10_1294_0,0,75,Journal of Heterocyclic Chemistry,http://dbpedia.org/resource/Journal_of_Heterocyclic_Chemistry
v10_1294_0,0,76,Journal of Heredity,http://dbpedia.org/resource/Journal_of_Heredity
v10_1294_0,0,77,Journal of Health and Social Behavior,http://dbpedia.org/resource/Journal_of_Health_and_Social_Behavior
v10_1294_0,0,78,Journal of Health Psychology,http://dbpedia.org/resource/Journal_of_Health_Psychology
v10_1294_0,0,79,"Journal of Health Politics, Policy and Law","http://dbpedia.org/resource/Journal_of_Health_Politics,_Policy_and_Law"
v10_1294_0,0,80,"Journal of Guidance, Control, and Dynamics","http://dbpedia.org/resource/Journal_of_Guidance,_Control,_and_Dynamics"
v10_1294_0,0,81,Journal of Group Theory,http://dbpedia.org/resource/Journal_of_Group_Theory
v10_1294_0,0,82,Journal of Grid Computing,http://dbpedia.org/resource/Journal_of_Grid_Computing
v10_1294_0,0,83,Journal of Graph Theory,http://dbpedia.org/resource/Journal_of_Graph_Theory
v10_1294_0,0,84,Journal of Geophysical Research,http://dbpedia.org/resource/Journal_of_Geophysical_Research
v10_1294_0,0,85,Journal of General Virology,http://dbpedia.org/resource/Journal_of_General_Virology
v10_1294_0,0,86,Journal of Gender Studies,http://dbpedia.org/resource/Journal_of_Gender_Studies
v10_1294_0,0,87,Journal of Gay and Lesbian Social Services,http://dbpedia.org/resource/Journal_of_Gay_and_Lesbian_Social_Services
v10_1294_0,0,88,Journal of French Language Studies,http://dbpedia.org/resource/Journal_of_French_Language_Studies
v10_1294_0,0,89,Journal of Food Science,http://dbpedia.org/resource/Journal_of_Food_Science
v10_1294_0,0,90,Journal of Food Safety,http://dbpedia.org/resource/Journal_of_Food_Safety
v10_1294_0,0,91,Journal of Food Quality,http://dbpedia.org/resource/Journal_of_Food_Quality
v10_1294_0,0,92,Journal of Food Processing and Preservation,http://dbpedia.org/resource/Journal_of_Food_Processing_and_Preservation
v10_1294_0,0,93,Journal of Food Process Engineering,http://dbpedia.org/resource/Journal_of_Food_Process_Engineering
v10_1294_0,0,94,Journal of Food Biochemistry,http://dbpedia.org/resource/Journal_of_Food_Biochemistry
v10_1294_0,0,95,Journal of Fluid Mechanics,http://dbpedia.org/resource/Journal_of_Fluid_Mechanics
v10_1294_0,0,96,Journal of Fish Biology,http://dbpedia.org/resource/Journal_of_Fish_Biology
v10_1294_0,0,97,Journal of Fire Sciences,http://dbpedia.org/resource/Journal_of_Fire_Sciences
v10_1294_0,0,98,Journal of Fire Protection Engineering,http://dbpedia.org/resource/Journal_of_Fire_Protection_Engineering
v10_1294_0,0,99,Journal of Financial Economics,http://dbpedia.org/resource/Journal_of_Financial_Economics
v10_1294_0,0,100,Journal of Family Issues,http://dbpedia.org/resource/Journal_of_Family_Issues
v10_1294_0,0,101,Journal of Exposure Science and Environmental Epidemiology,http://dbpedia.org/resource/Journal_of_Exposure_Science_and_Environmental_Epidemiology
v10_1294_0,0,102,Journal of Experimental and Theoretical Artificial Intelligence,http://dbpedia.org/resource/Journal_of_Experimental_and_Theoretical_Artificial_Intelligence
v10_1294_0,0,103,Journal of Experimental Social Psychology,http://dbpedia.org/resource/Journal_of_Experimental_Social_Psychology
