v10_189_0,0,1,You Need a Mess of Help to Stand Alone,http://dbpedia.org/resource/You_Need_a_Mess_of_Help_to_Stand_Alone_(album)
v10_189_0,0,2,You Nasty,http://dbpedia.org/resource/You_Nasty
v10_189_0,0,3,You Must Not Be Drinking Enough,http://dbpedia.org/resource/You_Must_Not_Be_Drinking_Enough
v10_189_0,0,4,You Must Love Me,http://dbpedia.org/resource/You_Must_Love_Me
v10_189_0,0,5,You Must Go On,http://dbpedia.org/resource/You_Must_Go_On
v10_189_0,0,6,You Must First Learn to Draw the Real,http://dbpedia.org/resource/You_Must_First_Learn_to_Draw_the_Real
v10_189_0,0,7,You Must Believe in Spring,http://dbpedia.org/resource/You_Must_Believe_in_Spring_(Bill_Evans_album)
v10_189_0,0,8,You Must Be Certain of the Devil,http://dbpedia.org/resource/You_Must_Be_Certain_of_the_Devil
v10_189_0,0,9,You Move Me,http://dbpedia.org/resource/You_Move_Me
v10_189_0,0,10,You Might Think,http://dbpedia.org/resource/You_Might_Think
v10_189_0,0,11,You Mean the World to Me,http://dbpedia.org/resource/You_Mean_the_World_to_Me_(Toni_Braxton_song)
v10_189_0,0,12,You May Be Right,http://dbpedia.org/resource/You_May_Be_Right_(song)
v10_189_0,0,13,You Make the Whole World Cry,http://dbpedia.org/resource/You_Make_the_Whole_World_Cry
v10_189_0,0,14,You Make the Rain Fall,http://dbpedia.org/resource/You_Make_the_Rain_Fall
v10_189_0,0,15,You Make Me Sick,http://dbpedia.org/resource/You_Make_Me_Sick
v10_189_0,0,16,You Make Me Feel So Free,http://dbpedia.org/resource/You_Make_Me_Feel_So_Free
v10_189_0,0,17,You Make Me Feel Like a Man,http://dbpedia.org/resource/You_Make_Me_Feel_Like_a_Man
v10_189_0,0,18,You Make Me Feel Like Dancing,http://dbpedia.org/resource/You_Make_Me_Feel_Like_Dancing
v10_189_0,0,19,You Make Loving Fun,http://dbpedia.org/resource/You_Make_Loving_Fun
v10_189_0,0,20,You Made a Wanted Man of Me,http://dbpedia.org/resource/You_Made_a_Wanted_Man_of_Me
v10_189_0,0,21,You Made a Rock of a Rolling Stone,http://dbpedia.org/resource/You_Made_a_Rock_of_a_Rolling_Stone
v10_189_0,0,22,You Made Me Realise,http://dbpedia.org/resource/You_Made_Me_Realise
v10_189_0,0,23,You Love the Thunder,http://dbpedia.org/resource/You_Love_the_Thunder
v10_189_0,0,24,You Look So Good in Love,http://dbpedia.org/resource/You_Look_So_Good_in_Love
v10_189_0,0,25,You Look So Fine,http://dbpedia.org/resource/You_Look_So_Fine
v10_189_0,0,26,You Look Like I Need a Drink,http://dbpedia.org/resource/You_Look_Like_I_Need_a_Drink
v10_189_0,0,27,You Look Good in My Shirt,http://dbpedia.org/resource/You_Look_Good_in_My_Shirt
v10_189_0,0,28,You Little Thief,http://dbpedia.org/resource/You_Little_Thief
v10_189_0,0,29,You Light Up My Life,http://dbpedia.org/resource/You_Light_Up_My_Life_(song)
v10_189_0,0,30,You Light Up My Life: Inspirational Songs,http://dbpedia.org/resource/You_Light_Up_My_Life:_Inspirational_Songs
v10_189_0,0,31,You Lied to Me,http://dbpedia.org/resource/Until_You_Come_Back_to_Me_(That's_What_I'm_Gonna_Do)
v10_189_0,0,32,You Lie,http://dbpedia.org/resource/You_Lie_(The_Band_Perry_song)
v10_189_0,0,33,You Lie,http://dbpedia.org/resource/You_Lie_(The_Band_Perry_song)
v10_189_0,0,34,You Learn,http://dbpedia.org/resource/You_Learn
v10_189_0,0,35,You Lay a Whole Lot of Love on Me,http://dbpedia.org/resource/You_Lay_a_Whole_Lot_of_Love_on_Me
v10_189_0,0,36,You Lay So Easy on My Mind,http://dbpedia.org/resource/You_Lay_So_Easy_on_My_Mind
v10_189_0,0,37,You Know You Like It,http://dbpedia.org/resource/When_the_Pawn...
v10_189_0,0,38,You Know You're Right,http://dbpedia.org/resource/You_Know_You're_Right
v10_189_0,0,39,You Know What to Do,http://dbpedia.org/resource/You_Know_What_to_Do_(Carly_Simon_song)
v10_189_0,0,40,You Know What It Is,http://dbpedia.org/resource/You_Know_What_It_Is
v10_189_0,0,41,You Know My Name,http://dbpedia.org/resource/You_Know_My_Name
v10_189_0,0,42,You Know My Name,http://dbpedia.org/resource/You_Know_My_Name
v10_189_0,0,43,You Know My Name,http://dbpedia.org/resource/You_Know_My_Name
v10_189_0,0,44,You Know Me Better Than That,http://dbpedia.org/resource/You_Know_Me_Better_Than_That
v10_189_0,0,45,You Know Me Better,http://dbpedia.org/resource/You_Know_Me_Better
v10_189_0,0,46,You Know Me,http://dbpedia.org/resource/You_Know_Me_(2_Pistols_song)
v10_189_0,0,47,You Know Me,http://dbpedia.org/resource/You_Know_Me_(2_Pistols_song)
v10_189_0,0,48,You Know I Love You... Don't You?,http://dbpedia.org/resource/You_Know_I_Love_You..._Don't_You?
v10_189_0,0,49,You Know I'm No Good,http://dbpedia.org/resource/You_Know_I'm_No_Good
v10_189_0,0,50,You Know How to Love Me,http://dbpedia.org/resource/You_Know_How_to_Love_Me
v10_189_0,0,51,You Know How We Do It,http://dbpedia.org/resource/You_Know_How_We_Do_It
v10_189_0,0,52,You Know FaUSt,http://dbpedia.org/resource/You_Know_FaUSt
v10_189_0,0,53,You Keep Me Hangin' On,http://dbpedia.org/resource/You_Keep_Me_Hangin'_On
v10_189_0,0,54,You Just Watch Me,http://dbpedia.org/resource/You_Just_Watch_Me
v10_189_0,0,55,You Just Gotta Love Christmas,http://dbpedia.org/resource/You_Just_Gotta_Love_Christmas
v10_189_0,0,56,You Hold the Key,http://dbpedia.org/resource/You_Hold_the_Key
v10_189_0,0,57,You Hold It All,http://dbpedia.org/resource/You_Hold_It_All
v10_189_0,0,58,You Have Placed a Chill in My Heart,http://dbpedia.org/resource/You_Have_Placed_a_Chill_in_My_Heart
v10_189_0,0,59,You Have Killed Me,http://dbpedia.org/resource/You_Have_Killed_Me
v10_189_0,0,60,You Have Been Loved,http://dbpedia.org/resource/You_Have_Been_Loved
v10_189_0,0,61,You Had Me from Hello,http://dbpedia.org/resource/You_Had_Me_from_Hello
v10_189_0,0,62,You Had Me,http://dbpedia.org/resource/You_Had_Me
v10_189_0,0,63,You Had It Coming,http://dbpedia.org/resource/You_Had_It_Coming
v10_189_0,0,64,You Guys Kill Me,http://dbpedia.org/resource/You_Guys_Kill_Me
v10_189_0,0,65,You Gotta Take a Little Love,http://dbpedia.org/resource/You_Gotta_Take_a_Little_Love
v10_189_0,0,66,You Gotta Say Yes to Another Excess,http://dbpedia.org/resource/You_Gotta_Say_Yes_to_Another_Excess
v10_189_0,0,67,You Gotta Problem with Me,http://dbpedia.org/resource/You_Gotta_Problem_with_Me
v10_189_0,0,68,You Gotta Love That,http://dbpedia.org/resource/You_Gotta_Love_That_(song)
v10_189_0,0,69,You Gotta Love That,http://dbpedia.org/resource/You_Gotta_Love_That_(song)
v10_189_0,0,70,You Gotta Love Someone,http://dbpedia.org/resource/You_Gotta_Love_Someone
v10_189_0,0,71,You Gotta Go There to Come Back,http://dbpedia.org/resource/You_Gotta_Go_There_to_Come_Back
v10_189_0,0,72,You Gotta Believe,http://dbpedia.org/resource/You_Gotta_Believe_(EP)
v10_189_0,0,73,You Gotta Be My Baby,http://dbpedia.org/resource/You_Gotta_Be_My_Baby
v10_189_0,0,74,You Got the Style,http://dbpedia.org/resource/You_Got_the_Style
v10_189_0,0,75,You Got the Love,http://dbpedia.org/resource/You_Got_the_Love_(Rufus_song)
v10_189_0,0,76,You Got That Right,http://dbpedia.org/resource/You_Got_That_Right
v10_189_0,0,77,You Got Me Rocking,http://dbpedia.org/resource/You_Got_Me_Rocking
v10_189_0,0,78,You Got Lucky,http://dbpedia.org/resource/You_Got_Lucky
v10_189_0,0,79,You Got It All – The Album,http://dbpedia.org/resource/You_Got_It_All_–_The_Album
v10_189_0,0,80,You Got It,http://dbpedia.org/resource/You_Got_It
v10_189_0,0,81,You Got It,http://dbpedia.org/resource/You_Got_It
v10_189_0,0,82,You Gonna Fly,http://dbpedia.org/resource/You_Gonna_Fly
v10_189_0,0,83,You Go Your Way,http://dbpedia.org/resource/Most_Likely_You_Go_Your_Way_and_I'll_Go_Mine
v10_189_0,0,84,You Go Now,http://dbpedia.org/resource/You_Go_Now
v10_189_0,0,85,You Go First,http://dbpedia.org/resource/You_Go_First_(Do_You_Wanna_Kiss)
v10_189_0,0,86,You Give Love a Bad Name,http://dbpedia.org/resource/You_Give_Love_a_Bad_Name
v10_189_0,0,87,You Give Love a Bad Name,http://dbpedia.org/resource/You_Give_Love_a_Bad_Name
v10_189_0,0,88,You Give Good Love,http://dbpedia.org/resource/You_Give_Good_Love
v10_189_0,0,89,You Get What You Give,http://dbpedia.org/resource/You_Get_What_You_Give_(album)
v10_189_0,0,90,You Gave Me the Answer,http://dbpedia.org/resource/You_Gave_Me_the_Answer
v10_189_0,0,91,You Gave Me Freedom,http://dbpedia.org/resource/You_Gave_Me_Freedom
v10_189_0,0,92,You Found Me,http://dbpedia.org/resource/You_Found_Me
v10_189_0,0,93,You Follow Me,http://dbpedia.org/resource/You_Follow_Me
v10_189_0,0,94,You Feel Good All Over,http://dbpedia.org/resource/You_Feel_Good_All_Over
v10_189_0,0,95,You Fail Me,http://dbpedia.org/resource/You_Fail_Me
v10_189_0,0,96,You Dropped a Bomb on Me,http://dbpedia.org/resource/You_Dropped_a_Bomb_on_Me
v10_189_0,0,97,You Drive Me Crazy,http://dbpedia.org/resource/(You_Drive_Me)_Crazy
v10_189_0,0,98,You Don't Seem to Miss Me,http://dbpedia.org/resource/You_Don't_Seem_to_Miss_Me
v10_189_0,0,99,You Don't Own Me,http://dbpedia.org/resource/You_Don't_Own_Me
v10_189_0,0,100,You Don't Need Me Now,http://dbpedia.org/resource/You_Don't_Need_Me_Now
v10_189_0,0,101,You Don't Miss Your Water,http://dbpedia.org/resource/You_Don't_Miss_Your_Water
v10_189_0,0,102,You Don't Mess Around with Jim,http://dbpedia.org/resource/You_Don't_Mess_Around_with_Jim_(song)
v10_189_0,0,103,You Don't Love Me Anymore,http://dbpedia.org/resource/You_Don't_Love_Me_Anymore_(Eddie_Rabbitt_song)
v10_189_0,0,104,You Don't Love Me Anymore,http://dbpedia.org/resource/You_Don't_Love_Me_Anymore_(Eddie_Rabbitt_song)
v10_189_0,0,105,You Don't Love Me,http://dbpedia.org/resource/You_Don't_Love_Me_(The_Kooks_song)
v10_189_0,0,106,You Don't Love Me,http://dbpedia.org/resource/You_Don't_Love_Me_(The_Kooks_song)
v10_189_0,0,107,You Don't Know Me: The Songs of Cindy Walker,http://dbpedia.org/resource/You_Don't_Know_Me:_The_Songs_of_Cindy_Walker
v10_189_0,0,108,You Don't Know Love,http://dbpedia.org/resource/You_Don't_Know_Love_(Janie_Fricke_song)
v10_189_0,0,109,You Don't Know Love,http://dbpedia.org/resource/You_Don't_Know_Love_(Janie_Fricke_song)
v10_189_0,0,110,You Don't Know Her Like I Do,http://dbpedia.org/resource/You_Don't_Know_Her_Like_I_Do
v10_189_0,0,111,You Don't Know,http://dbpedia.org/resource/You_Don't_Know_(Cyndi_Lauper_song)
v10_189_0,0,112,You Don't Know,http://dbpedia.org/resource/You_Don't_Know_(Cyndi_Lauper_song)
v10_189_0,0,113,You Don't Have to Worry,http://dbpedia.org/resource/I'm_Still_in_Love_with_You_(New_Edition_song)
v10_189_0,0,114,You Don't Have to Worry,http://dbpedia.org/resource/I'm_Still_in_Love_with_You_(New_Edition_song)
v10_189_0,0,115,You Don't Fool Me,http://dbpedia.org/resource/You_Don't_Fool_Me
v10_189_0,0,116,You Don't Even Know Who I Am,http://dbpedia.org/resource/You_Don't_Even_Know_Who_I_Am
v10_189_0,0,117,You Don't Count the Cost,http://dbpedia.org/resource/You_Don't_Count_the_Cost
v10_189_0,0,118,You Don't Bring Me Flowers,http://dbpedia.org/resource/You_Don't_Bring_Me_Flowers
v10_189_0,0,119,You Do Your Thing,http://dbpedia.org/resource/You_Do_Your_Thing_(song)
v10_189_0,0,120,You Do Your Thing,http://dbpedia.org/resource/You_Do_Your_Thing_(song)
v10_189_0,0,121,You Disgust Me,http://dbpedia.org/resource/You_Disgust_Me
v10_189_0,0,122,You Didn't Have to Be So Nice,http://dbpedia.org/resource/You_Didn't_Have_to_Be_So_Nice
v10_189_0,0,123,You Decorated My Life,http://dbpedia.org/resource/You_Decorated_My_Life
v10_189_0,0,124,You Cross My Path,http://dbpedia.org/resource/You_Cross_My_Path
v10_189_0,0,125,You Could Have It So Much Better,http://dbpedia.org/resource/You_Could_Have_It_So_Much_Better
v10_189_0,0,126,You Could Have Been with Me,http://dbpedia.org/resource/You_Could_Have_Been_with_Me
v10_189_0,0,127,You Could Be Mine,http://dbpedia.org/resource/You_Could_Be_Mine
v10_189_0,0,128,You Complete Me,http://dbpedia.org/resource/You_Complete_Me_(song)
v10_189_0,0,129,You Comb Her Hair,http://dbpedia.org/resource/You_Comb_Her_Hair
v10_189_0,0,130,You Caught Me Out,http://dbpedia.org/resource/You've_Just_Stepped_In_(From_Stepping_Out_on_Me)
v10_189_0,0,131,You Can Win If You Want,http://dbpedia.org/resource/You_Can_Win_If_You_Want
v10_189_0,0,132,"You Can Tune a Piano, but You Can't Tuna Fish","http://dbpedia.org/resource/You_Can_Tune_a_Piano,_but_You_Can't_Tuna_Fish"
v10_189_0,0,133,You Can Sleep While I Drive,http://dbpedia.org/resource/You_Can_Sleep_While_I_Drive
v10_189_0,0,134,You Can Go Home,http://dbpedia.org/resource/You_Can_Go_Home
v10_189_0,0,135,You Can Get It,http://dbpedia.org/resource/You_Can_Get_It
v10_189_0,0,136,You Can Dream of Me,http://dbpedia.org/resource/You_Can_Dream_of_Me
v10_189_0,0,137,You Can Depend on Me,http://dbpedia.org/resource/You_Can_Depend_on_Me_(Restless_Heart_song)
v10_189_0,0,138,You Can't Win,http://dbpedia.org/resource/You_Can't_Win_(song)
v10_189_0,0,139,You Can't Touch Me,"http://dbpedia.org/resource/You_Can't_Touch_Me_(Royce_da_5'9""_song)"
v10_189_0,0,140,You Can't Take the Honky Tonk Out of the Girl,http://dbpedia.org/resource/You_Can't_Take_the_Honky_Tonk_Out_of_the_Girl
v10_189_0,0,141,You Can't Stop the Reign,http://dbpedia.org/resource/You_Can't_Stop_the_Reign_(song)
v10_189_0,0,142,You Can't Stop the Music,http://dbpedia.org/resource/You_Can't_Stop_the_Music
v10_189_0,0,143,You Can't Stop Rock 'n' Roll,http://dbpedia.org/resource/You_Can't_Stop_Rock_'n'_Roll
v10_189_0,0,144,You Can't Stop Me,http://dbpedia.org/resource/Walking_on_a_Thin_Line
