v10_599_2,2,1,Wake Forest Demon Deacons men's basketball,http://dbpedia.org/resource/Wake_Forest_Demon_Deacons_women's_basketball
v10_599_2,2,2,Independence Community College,http://dbpedia.org/resource/Independence_Community_College
v10_599_2,2,3,College of Southern Idaho,http://dbpedia.org/resource/Idaho_State_University
v10_599_2,2,4,Florida Gators women's basketball,http://dbpedia.org/resource/Florida_Gators_men's_basketball
v10_599_2,2,5,NC State Wolfpack women's basketball,http://dbpedia.org/resource/NC_State_Wolfpack_women's_basketball
v10_599_2,2,6,South Carolina Gamecocks women's basketball,http://dbpedia.org/resource/South_Carolina_Gamecocks_women's_basketball
v10_599_2,2,7,Texas Longhorns women's basketball,http://dbpedia.org/resource/Texas_Longhorns_women's_basketball
v10_599_2,2,8,Connecticut Huskies women's basketball,http://dbpedia.org/resource/UConn_Huskies_women's_basketball
v10_599_2,2,9,Oklahoma State Cowgirls basketball,http://dbpedia.org/resource/Oklahoma_State_Cowboys_basketball
v10_599_2,2,10,Emmanuel College,http://dbpedia.org/resource/University_of_Queensland
v10_599_2,2,11,Old Dominion Lady Monarchs basketball,http://dbpedia.org/resource/Old_Dominion_Lady_Monarchs_basketball
v10_599_2,2,12,Maryland Terrapins women's basketball,http://dbpedia.org/resource/Maryland_Terrapins_women's_basketball
v10_599_2,2,13,NC State Wolfpack men's basketball,http://dbpedia.org/resource/NC_State_Wolfpack_women's_basketball
v10_599_2,2,14,Kansas Jayhawks men's basketball,http://dbpedia.org/resource/Kansas_Jayhawks_men's_basketball
v10_599_2,2,15,LSU Lady Tigers basketball,http://dbpedia.org/resource/LSU_Lady_Tigers_basketball
v10_599_2,2,16,Wyoming Cowboys basketball,http://dbpedia.org/resource/Wyoming_Cowboys_basketball
v10_599_2,2,17,Miles College,http://dbpedia.org/resource/Miles_College
v10_599_2,2,18,Georgia Tech Yellow Jackets men's basketball,http://dbpedia.org/resource/Georgia_Tech_Yellow_Jackets_men's_basketball
v10_599_2,2,19,Eastern Kentucky Colonels basketball,http://dbpedia.org/resource/Kentucky_Colonels
v10_599_2,2,20,Detroit Titans men's basketball,http://dbpedia.org/resource/Detroit_Mercy_Titans_men's_basketball
v10_599_2,2,21,Detroit Titans men's basketball,http://dbpedia.org/resource/Detroit_Mercy_Titans_men's_basketball
v10_599_2,2,22,Baylor Bears basketball,http://dbpedia.org/resource/Baylor_Bears_basketball
v10_599_2,2,23,Oklahoma Sooners men's basketball,http://dbpedia.org/resource/Oklahoma_Sooners_men's_basketball
v10_599_2,2,24,Louisville Cardinals men's basketball,http://dbpedia.org/resource/Louisville_Cardinals_men's_basketball
v10_599_2,2,25,Marquette Golden Eagles men's basketball,http://dbpedia.org/resource/Marquette_Golden_Eagles_women's_basketball
v10_599_2,2,26,University of Wisconsin–Stevens Point,http://dbpedia.org/resource/University_of_Wisconsin–Stevens_Point
v10_599_2,2,27,Michigan Wolverines men's basketball,http://dbpedia.org/resource/Michigan_Wolverines_men's_basketball
v10_599_2,2,28,Minnesota Golden Gophers men's basketball,http://dbpedia.org/resource/Minnesota_Golden_Gophers_women's_basketball
v10_599_2,2,29,Michigan State Spartans men's basketball,http://dbpedia.org/resource/Michigan_State_Spartans_men's_basketball
v10_599_2,2,30,Detroit Titans men's basketball,http://dbpedia.org/resource/Detroit_Mercy_Titans_men's_basketball
v10_599_2,2,31,Boston College Eagles men's basketball,http://dbpedia.org/resource/Boston_College_Eagles_women's_basketball
v10_599_2,2,32,Purdue Boilermakers men's basketball,http://dbpedia.org/resource/Purdue_Boilermakers_men's_basketball
v10_599_2,2,33,Seton Hall Pirates men's basketball,http://dbpedia.org/resource/Seton_Hall_Pirates_women's_basketball
v10_599_2,2,34,DePaul Blue Demons men's basketball,http://dbpedia.org/resource/DePaul_Blue_Demons_men's_basketball
v10_599_2,2,35,Tennessee Volunteers basketball,http://dbpedia.org/resource/Tennessee_Volunteers_basketball
v10_599_2,2,36,South Alabama Jaguars men's basketball,http://dbpedia.org/resource/South_Alabama_Jaguars_men's_basketball
v10_599_2,2,37,Ole Miss Rebels men's basketball,http://dbpedia.org/resource/Ole_Miss_Rebels_men's_basketball
v10_599_2,2,38,Louisville Cardinals men's basketball,http://dbpedia.org/resource/Louisville_Cardinals_men's_basketball
v10_599_2,2,39,Washington Huskies men's basketball,http://dbpedia.org/resource/Washington_Huskies_men's_basketball
v10_599_2,2,40,Texas Longhorns men's basketball,http://dbpedia.org/resource/Texas_Longhorns_men's_basketball
v10_599_2,2,41,Kentucky Wildcats men's basketball,http://dbpedia.org/resource/Kentucky_Wildcats_women's_basketball
v10_599_2,2,42,Oregon Ducks men's basketball,http://dbpedia.org/resource/Oregon_Ducks_men's_basketball
v10_599_2,2,43,Georgia Bulldogs men's basketball,http://dbpedia.org/resource/Butler_Bulldogs_men's_basketball
v10_599_2,2,44,Wagner Seahawks men's basketball,http://dbpedia.org/resource/Wagner_Seahawks_men's_basketball
v10_599_2,2,45,Georgia Lady Bulldogs basketball,http://dbpedia.org/resource/Georgia_Lady_Bulldogs_basketball
v10_599_2,2,46,Temple Owls men's basketball,http://dbpedia.org/resource/Rice_Owls_men's_basketball
v10_599_2,2,47,Maryland Terrapins men's basketball,http://dbpedia.org/resource/Maryland_Terrapins_men's_basketball
v10_599_2,2,48,USC Trojans women's basketball,http://dbpedia.org/resource/USC_Trojans_women's_basketball
v10_599_2,2,49,LSU Lady Tigers basketball,http://dbpedia.org/resource/LSU_Lady_Tigers_basketball
v10_599_2,2,50,Western Kentucky Hilltoppers basketball,http://dbpedia.org/resource/Western_Kentucky_Hilltoppers_football
v10_599_2,2,51,Tennessee State Tigers men's basketball,http://dbpedia.org/resource/LSU_Tigers_basketball
v10_599_2,2,52,Princeton Tigers men's basketball,http://dbpedia.org/resource/Princeton_Tigers_women's_basketball
v10_599_2,2,53,Houston Cougars men's basketball,http://dbpedia.org/resource/Houston_Cougars_women's_basketball
v10_599_2,2,54,Indiana Hoosiers men's basketball,http://dbpedia.org/resource/Indiana_Hoosiers_men's_basketball
v10_599_2,2,55,Kentucky Wildcats men's basketball,http://dbpedia.org/resource/Kentucky_Wildcats_women's_basketball
v10_599_2,2,56,Oklahoma Sooners men's basketball,http://dbpedia.org/resource/Oklahoma_Sooners_men's_basketball
v10_599_2,2,57,Ohio State Buckeyes women's basketball,http://dbpedia.org/resource/Ohio_State_Buckeyes_men's_basketball
v10_599_2,2,58,Alabama Crimson Tide women's basketball,http://dbpedia.org/resource/Alabama_Crimson_Tide_women's_basketball
v10_599_2,2,59,Baylor Bears basketball,http://dbpedia.org/resource/Baylor_Bears_basketball
v10_599_2,2,60,Florida Gators men's basketball,http://dbpedia.org/resource/Florida_Gators_men's_basketball
v10_599_2,2,61,Connecticut Huskies men's basketball,http://dbpedia.org/resource/UConn_Huskies_men's_basketball
v10_599_2,2,62,Duke Blue Devils men's basketball,http://dbpedia.org/resource/Duke_Blue_Devils_men's_basketball
v10_599_2,2,63,Georgia Lady Bulldogs basketball,http://dbpedia.org/resource/Georgia_Lady_Bulldogs_basketball
v10_599_2,2,64,Michigan Wolverines men's basketball,http://dbpedia.org/resource/Michigan_Wolverines_men's_basketball
v10_599_2,2,65,Georgia Lady Bulldogs basketball,http://dbpedia.org/resource/Georgia_Lady_Bulldogs_basketball
v10_599_2,2,66,Penn State Lady Lions basketball,http://dbpedia.org/resource/Penn_State_Lady_Lions_basketball
v10_599_2,2,67,Texas A&M Aggies women's basketball,http://dbpedia.org/resource/Texas_A&M_Aggies_women's_basketball
v10_599_2,2,68,Iowa Hawkeyes women's basketball,http://dbpedia.org/resource/Iowa_Hawkeyes_women's_basketball
v10_599_2,2,69,Florida State Seminoles women's basketball,http://dbpedia.org/resource/Florida_State_Seminoles_women's_basketball
v10_599_2,2,70,Mississippi State Lady Bulldogs basketball,http://dbpedia.org/resource/Mississippi_State_Bulldogs_women's_basketball
v10_599_2,2,71,Rutgers Scarlet Knights women's basketball,http://dbpedia.org/resource/Rutgers_Scarlet_Knights_women's_basketball
v10_599_2,2,72,Florida Gators women's basketball,http://dbpedia.org/resource/Florida_Gators_men's_basketball
v10_599_2,2,73,Connecticut Huskies women's basketball,http://dbpedia.org/resource/UConn_Huskies_women's_basketball
v10_599_2,2,74,Memphis Tigers women's basketball,http://dbpedia.org/resource/Memphis_Tigers_women's_basketball
v10_599_2,2,75,Tennessee Lady Volunteers basketball,http://dbpedia.org/resource/Tennessee_Lady_Volunteers_basketball
v10_599_2,2,76,Louisiana Tech Lady Techsters basketball,http://dbpedia.org/resource/Louisiana_Tech_Lady_Techsters_basketball
v10_599_2,2,77,James Madison Dukes,http://dbpedia.org/resource/James_Madison_Dukes_men's_basketball
v10_599_2,2,78,Kansas Jayhawks women's basketball,http://dbpedia.org/resource/Kansas_Jayhawks_men's_basketball
v10_599_2,2,79,Florida Gators women's basketball,http://dbpedia.org/resource/Florida_Gators_men's_basketball
v10_599_2,2,80,Miami Hurricanes women's basketball,http://dbpedia.org/resource/Miami_Hurricanes_women's_basketball
v10_599_2,2,81,Marshall Thundering Herd men's basketball,http://dbpedia.org/resource/Marshall_Thundering_Herd_men's_basketball
v10_599_2,2,82,Maryland Eastern Shore Hawks men's basketball,http://dbpedia.org/resource/Maryland_Eastern_Shore_Hawks_men's_basketball
v10_599_2,2,83,Illinois Fighting Illini men's basketball,http://dbpedia.org/resource/Illinois_Fighting_Illini_women's_basketball
v10_599_2,2,84,St. Edward's University,http://dbpedia.org/resource/St._Edward's_University
v10_599_2,2,85,USC Trojans men's basketball,http://dbpedia.org/resource/USC_Trojans_men's_basketball
v10_599_2,2,86,Xavier Musketeers women's basketball,http://dbpedia.org/resource/Xavier_Musketeers_women's_basketball
v10_599_2,2,87,Alabama Crimson Tide men's basketball,http://dbpedia.org/resource/Alabama_Crimson_Tide_women's_basketball
v10_599_2,2,88,NC State Wolfpack men's basketball,http://dbpedia.org/resource/NC_State_Wolfpack_women's_basketball
v10_599_2,2,89,Texas Longhorns men's basketball,http://dbpedia.org/resource/Texas_Longhorns_men's_basketball
v10_599_2,2,90,LSU Lady Tigers basketball,http://dbpedia.org/resource/LSU_Lady_Tigers_basketball
v10_599_2,2,91,Jackson State Tigers basketball,http://dbpedia.org/resource/LSU_Tigers_basketball
v10_599_2,2,92,Memphis Tigers men's basketball,http://dbpedia.org/resource/Memphis_Tigers_women's_basketball
v10_599_2,2,93,Texas A&M Aggies women's basketball,http://dbpedia.org/resource/Texas_A&M_Aggies_women's_basketball
v10_599_2,2,94,Texas A&M Aggies women's basketball,http://dbpedia.org/resource/Texas_A&M_Aggies_women's_basketball
v10_599_2,2,95,Connecticut Huskies women's basketball,http://dbpedia.org/resource/UConn_Huskies_women's_basketball
v10_599_2,2,96,UCLA Bruins men's basketball,http://dbpedia.org/resource/UCLA_Bruins_men's_basketball
v10_599_2,2,97,Oregon State Beavers men's basketball,http://dbpedia.org/resource/Oregon_State_Beavers_women's_basketball
v10_599_2,2,98,Connecticut Huskies women's basketball,http://dbpedia.org/resource/UConn_Huskies_women's_basketball
v10_599_2,2,99,Georgetown Hoyas women's basketball,http://dbpedia.org/resource/Georgetown_Hoyas_men's_basketball
v10_599_2,2,100,Rutgers Scarlet Knights women's basketball,http://dbpedia.org/resource/Rutgers_Scarlet_Knights_women's_basketball
v10_599_2,2,101,Connecticut Huskies women's basketball,http://dbpedia.org/resource/UConn_Huskies_women's_basketball
v10_599_2,2,102,Emmanuel College,http://dbpedia.org/resource/University_of_Queensland
v10_599_2,2,103,UCLA Bruins men's basketball,http://dbpedia.org/resource/UCLA_Bruins_men's_basketball
v10_599_2,2,104,Nebraska Cornhuskers men's basketball,http://dbpedia.org/resource/Nebraska_Cornhuskers_women's_basketball
v10_599_2,2,105,LSU Tigers men's basketball,http://dbpedia.org/resource/LSU_Tigers_basketball
v10_599_2,2,106,Villanova Wildcats men's basketball,http://dbpedia.org/resource/Villanova_Wildcats_men's_basketball
v10_599_2,2,107,Murray State Racers men's basketball,http://dbpedia.org/resource/Murray_State_Racers_men's_basketball
v10_599_2,2,108,DePaul Blue Demons men's basketball,http://dbpedia.org/resource/DePaul_Blue_Demons_men's_basketball
v10_599_2,2,109,Pittsburgh Panthers men's basketball,http://dbpedia.org/resource/Pittsburgh_Panthers_men's_basketball
v10_599_2,2,110,Duke Blue Devils men's basketball,http://dbpedia.org/resource/Duke_Blue_Devils_men's_basketball
v10_599_2,2,111,Missouri Tigers men's basketball,http://dbpedia.org/resource/Missouri_Tigers_women's_basketball
v10_599_2,2,112,Michigan State Spartans men's basketball,http://dbpedia.org/resource/Michigan_State_Spartans_men's_basketball
v10_599_2,2,113,Maryland Terrapins men's basketball,http://dbpedia.org/resource/Maryland_Terrapins_men's_basketball
v10_599_2,2,114,Purdue Boilermakers men's basketball,http://dbpedia.org/resource/Purdue_Boilermakers_men's_basketball
v10_599_2,2,115,Middle Tennessee Blue Raiders men's basketball,http://dbpedia.org/resource/Middle_Tennessee_Blue_Raiders_women's_basketball
v10_599_2,2,116,Washington State Cougars men's basketball,http://dbpedia.org/resource/Washington_State_Cougars_men's_basketball
v10_599_2,2,117,North Carolina Tar Heels men's basketball,http://dbpedia.org/resource/North_Carolina_Tar_Heels_women's_basketball
v10_599_2,2,118,UCLA Bruins men's basketball,http://dbpedia.org/resource/UCLA_Bruins_men's_basketball
v10_599_2,2,119,Marquette Golden Eagles men's basketball,http://dbpedia.org/resource/Marquette_Golden_Eagles_women's_basketball
v10_599_2,2,120,Santa Clara Broncos men's basketball,http://dbpedia.org/resource/Santa_Clara_Broncos_men's_basketball
v10_599_2,2,121,Toledo Rockets men's basketball,http://dbpedia.org/resource/Toledo_Rockets_women's_basketball
v10_599_2,2,122,UAB Blazers men's basketball,http://dbpedia.org/resource/UAB_Blazers
v10_599_2,2,123,USC Trojans men's basketball,http://dbpedia.org/resource/USC_Trojans_men's_basketball
v10_599_2,2,124,Cincinnati Bearcats men's basketball,http://dbpedia.org/resource/Cincinnati_Bearcats_women's_basketball
v10_599_2,2,125,Minnesota Golden Gophers men's basketball,http://dbpedia.org/resource/Minnesota_Golden_Gophers_women's_basketball
v10_599_2,2,126,Illinois Fighting Illini men's basketball,http://dbpedia.org/resource/Illinois_Fighting_Illini_women's_basketball
v10_599_2,2,127,Arizona Wildcats men's basketball,http://dbpedia.org/resource/Arizona_Wildcats_men's_basketball
v10_599_2,2,128,Oregon State Beavers men's basketball,http://dbpedia.org/resource/Oregon_State_Beavers_women's_basketball
v10_599_2,2,129,Kansas State Wildcats men's basketball,http://dbpedia.org/resource/Kansas_State_Wildcats_men's_basketball
v10_599_2,2,130,Idaho State Bengals men's basketball,http://dbpedia.org/resource/Idaho_State_Bengals_men's_basketball
v10_599_2,2,131,Washington Huskies men's basketball,http://dbpedia.org/resource/Washington_Huskies_men's_basketball
v10_599_2,2,132,Tulsa Golden Hurricane men's basketball,http://dbpedia.org/resource/Tulsa_Golden_Hurricane_women's_basketball
v10_599_2,2,133,Tennessee Volunteers men's basketball,http://dbpedia.org/resource/Tennessee_Volunteers_basketball
v10_599_2,2,134,Indiana Hoosiers men's basketball,http://dbpedia.org/resource/Indiana_Hoosiers_men's_basketball
v10_599_2,2,135,San Jacinto College,http://dbpedia.org/resource/San_Jacinto_College
v10_599_2,2,136,Indiana Hoosiers men's basketball,http://dbpedia.org/resource/Indiana_Hoosiers_men's_basketball
v10_599_2,2,137,Saint Joseph's Hawks men's basketball,http://dbpedia.org/resource/Saint_Joseph's_Hawks_men's_basketball
v10_599_2,2,138,New Mexico State Aggies men's basketball,http://dbpedia.org/resource/New_Mexico_State_Aggies_men's_basketball
v10_599_2,2,139,Iona Gaels men's basketball,http://dbpedia.org/resource/Iona_Gaels_men's_basketball
v10_599_2,2,140,Tulsa Golden Hurricane men's basketball,http://dbpedia.org/resource/Tulsa_Golden_Hurricane_women's_basketball
v10_599_2,2,141,Maryland Terrapins men's basketball,http://dbpedia.org/resource/Maryland_Terrapins_men's_basketball
v10_599_2,2,142,Indiana Hoosiers men's basketball,http://dbpedia.org/resource/Indiana_Hoosiers_men's_basketball
v10_599_2,2,143,Georgia Tech Yellow Jackets men's basketball,http://dbpedia.org/resource/Georgia_Tech_Yellow_Jackets_men's_basketball
v10_599_2,2,144,UNLV Runnin' Rebels basketball,http://dbpedia.org/resource/UNLV_Runnin'_Rebels
v10_599_2,2,145,Butler Community College,http://dbpedia.org/resource/Butler_Community_College
v10_599_2,2,146,Davidson Wildcats men's basketball,http://dbpedia.org/resource/Davidson_Wildcats_men's_basketball
v10_599_2,2,147,Illinois Fighting Illini men's basketball,http://dbpedia.org/resource/Illinois_Fighting_Illini_women's_basketball
v10_599_2,2,148,Purdue Boilermakers women's basketball,http://dbpedia.org/resource/Purdue_Boilermakers_women's_basketball
v10_599_2,2,149,Northern Illinois Huskies women's basketball,http://dbpedia.org/resource/Northern_Illinois_Huskies_men's_basketball
v10_599_2,2,150,LSU Tigers basketball,http://dbpedia.org/resource/LSU_Tigers_basketball
v10_599_2,2,151,Connecticut Huskies women's basketball,http://dbpedia.org/resource/UConn_Huskies_women's_basketball
v10_599_2,2,152,Connecticut Huskies men's basketball,http://dbpedia.org/resource/UConn_Huskies_men's_basketball
v10_599_2,2,153,LSU Tigers basketball,http://dbpedia.org/resource/LSU_Tigers_basketball
v10_599_2,2,154,Arizona Wildcats men's basketball,http://dbpedia.org/resource/Arizona_Wildcats_men's_basketball
v10_599_2,2,155,DePaul Blue Demons men's basketball,http://dbpedia.org/resource/DePaul_Blue_Demons_men's_basketball
v10_599_2,2,156,San Diego Toreros men's basketball,http://dbpedia.org/resource/San_Diego_State_Aztecs_men's_basketball
v10_599_2,2,157,Auburn Tigers men's basketball,http://dbpedia.org/resource/Auburn_Tigers_men's_basketball
v10_599_2,2,158,NYU Violets men's basketball,http://dbpedia.org/resource/NYU_Violets_men's_basketball
