v10_1285_0,0,1,Blue Earth Lake Provincial Park,http://dbpedia.org/resource/Blue_Lake_Provincial_Park
v10_1285_0,0,2,Bligh Island Marine Provincial Park,http://dbpedia.org/resource/Flores_Island_Marine_Provincial_Park
v10_1285_0,0,3,Blanket Creek Provincial Park,http://dbpedia.org/resource/Blanket_Creek_Provincial_Park
v10_1285_0,0,4,Blackcomb Glacier Provincial Park,http://dbpedia.org/resource/Blackcomb_Glacier_Provincial_Park
v10_1285_0,0,5,Bishop River Provincial Park,http://dbpedia.org/resource/Cowichan_River_Provincial_Park
v10_1285_0,0,6,Bishop Bay – Monkey Beach Conservancy,http://dbpedia.org/resource/Bishop_Bay_–_Monkey_Beach_Conservancy
v10_1285_0,0,7,Bijoux Falls Provincial Park,http://dbpedia.org/resource/Bijoux_Falls_Provincial_Park
v10_1285_0,0,8,Big Creek Provincial Park,http://dbpedia.org/resource/Fish_Creek_Provincial_Park
v10_1285_0,0,9,Big Bar Lake Provincial Park,http://dbpedia.org/resource/Big_Bar_Lake_Provincial_Park
v10_1285_0,0,10,Bellhouse Provincial Park,http://dbpedia.org/resource/Bellhouse_Provincial_Park
v10_1285_0,0,11,Bedard Aspen Provincial Park,http://dbpedia.org/resource/Bedard_Aspen_Provincial_Park
v10_1285_0,0,12,Beaver Creek Provincial Park,http://dbpedia.org/resource/Blanket_Creek_Provincial_Park
v10_1285_0,0,13,Beatton River Provincial Park,http://dbpedia.org/resource/Marten_River_Provincial_Park
v10_1285_0,0,14,Beatton Provincial Park,http://dbpedia.org/resource/Bamberton_Provincial_Park
v10_1285_0,0,15,Bearhole Lake Provincial Park and Protected Area,http://dbpedia.org/resource/Bearhole_Lake_Provincial_Park_and_Protected_Area
v10_1285_0,0,16,Bear Glacier Provincial Park,http://dbpedia.org/resource/Bear_Glacier_Provincial_Park
v10_1285_0,0,17,Barkerville Provincial Park,http://dbpedia.org/resource/Barkerville_Provincial_Park
v10_1285_0,0,18,Banana Island Provincial Park,http://dbpedia.org/resource/Memory_Island_Provincial_Park
v10_1285_0,0,19,Bamberton Provincial Park,http://dbpedia.org/resource/Bamberton_Provincial_Park
v10_1285_0,0,20,Babine River Corridor Provincial Park,http://dbpedia.org/resource/Babine_River_Corridor_Provincial_Park
v10_1285_0,0,21,Babine Mountains Provincial Park,http://dbpedia.org/resource/Pink_Mountain_Provincial_Park
v10_1285_0,0,22,Babine Lake Marine Provincial Park,http://dbpedia.org/resource/Babine_Lake_Marine_Provincial_Park
v10_1285_0,0,23,Artlish Caves Provincial Park,http://dbpedia.org/resource/Artlish_Caves_Provincial_Park
v10_1285_0,0,24,Arrowstone Provincial Park,http://dbpedia.org/resource/Arrowstone_Provincial_Park
