v10_1475_4,4,1,Maria Theresa of Austria,http://dbpedia.org/resource/Maria_Theresa_of_Spain
v10_1475_4,4,2,"Wilhelm, German Crown Prince","http://dbpedia.org/resource/Frederick_III,_German_Emperor"
v10_1475_4,4,3,Princess Irene of Hesse and by Rhine,http://dbpedia.org/resource/Princess_Irene_of_Hesse_and_by_Rhine
v10_1475_4,4,4,V. P. Royal,"http://dbpedia.org/resource/Victoria,_Princess_Royal"
v10_1475_4,4,5,Prince Alexander of Hesse and by Rhine,http://dbpedia.org/resource/Prince_Alexander_of_Hesse_and_by_Rhine
v10_1475_4,4,6,G. V,http://dbpedia.org/resource/George_V
v10_1475_4,4,7,Prince Arnulf of Bavaria,http://dbpedia.org/resource/Prince_Arnulf_of_Bavaria
v10_1475_4,4,8,Frederick VIII of Denmark,http://dbpedia.org/resource/Frederick_VIII_of_Denmark
v10_1475_4,4,9,Ferdinand I of the Two Sicilies,http://dbpedia.org/resource/Charles_III_of_Spain
v10_1475_4,4,10,Maria Antonia Ferdinanda of Spain,http://dbpedia.org/resource/Maria_Antonia_Ferdinanda_of_Spain
v10_1475_4,4,11,Prince Frederick of Prussia,"http://dbpedia.org/resource/Frederick_III,_German_Emperor"
v10_1475_4,4,12,George I of Greece,http://dbpedia.org/resource/George_I_of_Greece
v10_1475_4,4,13,Frederick III of Denmark,http://dbpedia.org/resource/Frederick_III_of_Denmark
v10_1475_4,4,14,Alexander II of Russia,http://dbpedia.org/resource/Alexander_I_of_Russia
v10_1475_4,4,15,G. V,http://dbpedia.org/resource/George_V
v10_1475_4,4,16,"Prince Adolphus, Duke of Cambridge","http://dbpedia.org/resource/Prince_Adolphus,_Duke_of_Cambridge"
v10_1475_4,4,17,Archduchess Gisela of Austria,http://dbpedia.org/resource/Archduchess_Gisela_of_Austria
v10_1475_4,4,18,Maria Carolina of Austria,http://dbpedia.org/resource/Maria_Carolina_of_Austria
v10_1475_4,4,19,Ferdinand II of the Two Sicilies,http://dbpedia.org/resource/Charles_III_of_Spain
v10_1475_4,4,20,"Franz Joseph, 9th Prince of Thurn and Taxis","http://dbpedia.org/resource/Franz_Joseph,_9th_Prince_of_Thurn_and_Taxis"
v10_1475_4,4,21,Grand Duke Konstantin Konstantinovich of Russia,http://dbpedia.org/resource/Grand_Duke_Konstantin_Konstantinovich_of_Russia
v10_1475_4,4,22,Beatrix of the Netherlands,http://dbpedia.org/resource/Beatrix_of_the_Netherlands
v10_1475_4,4,23,Prince Albert of Prussia,"http://dbpedia.org/resource/Wilhelm_II,_German_Emperor"
v10_1475_4,4,24,Princess Charlotte of Saxe-Hildburghausen,http://dbpedia.org/resource/Therese_of_Saxe-Hildburghausen
v10_1475_4,4,25,"Charles Anthony, Prince of Hohenzollern","http://dbpedia.org/resource/Karl_Anton,_Prince_of_Hohenzollern"
v10_1475_4,4,26,"Frederick, Prince of Wales",http://dbpedia.org/resource/George_V
v10_1475_4,4,27,"Adolf Frederick, King of Sweden","http://dbpedia.org/resource/Adolf_Frederick,_King_of_Sweden"
v10_1475_4,4,28,George III of the United Kingdom,"http://dbpedia.org/resource/Prince_Adolphus,_Duke_of_Cambridge"
v10_1475_4,4,29,Ludwig III of Bavaria,http://dbpedia.org/resource/Ludwig_III_of_Bavaria
v10_1475_4,4,30,Landgravine Josepha of Fürstenberg-Weitra,http://dbpedia.org/resource/Landgravine_Josepha_of_Fürstenberg-Weitra
v10_1475_4,4,31,Countess Augusta of Reuss-Ebersdorf,http://dbpedia.org/resource/Countess_Augusta_Reuss_of_Ebersdorf
v10_1475_4,4,32,"Prince Alfonso, Count of Caserta","http://dbpedia.org/resource/Prince_Alfonso,_Count_of_Caserta"
v10_1475_4,4,33,"Prince Philippe, Count of Paris","http://dbpedia.org/resource/Prince_Philippe,_Count_of_Paris"
v10_1475_4,4,34,"Prince Louis, Duke of Nemours","http://dbpedia.org/resource/Prince_Louis,_Duke_of_Nemours"
v10_1475_4,4,35,"Robert I, Duke of Parma","http://dbpedia.org/resource/Robert_I,_Duke_of_Parma"
v10_1475_4,4,36,"Thomas, 2nd Duke of Genoa","http://dbpedia.org/resource/Thomas_Howard,_21st_Earl_of_Arundel"
v10_1475_4,4,37,Prince Konrad of Bavaria,http://dbpedia.org/resource/Prince_Konrad_of_Bavaria
v10_1475_4,4,38,"Prince Ferdinand, Duke of Alençon","http://dbpedia.org/resource/Prince_Ferdinand,_Duke_of_Alençon"
v10_1475_4,4,39,Charles Emmanuel III of Sardinia,http://dbpedia.org/resource/Charles_Emmanuel_III_of_Sardinia
v10_1475_4,4,40,Amadeo I of Spain,http://dbpedia.org/resource/Amadeo_I_of_Spain
v10_1475_4,4,41,"Wilhelm II, German Emperor","http://dbpedia.org/resource/Wilhelm_II,_German_Emperor"
v10_1475_4,4,42,"Frederick, Prince of Wales",http://dbpedia.org/resource/George_V
v10_1475_4,4,43,George III of the United Kingdom,"http://dbpedia.org/resource/Prince_Adolphus,_Duke_of_Cambridge"
v10_1475_4,4,44,Baroness Gösta von dem Bussche-Haddenhausen,http://dbpedia.org/resource/Baroness_Gösta_von_dem_Bussche-Haddenhausen
v10_1475_4,4,45,George I of Greece,http://dbpedia.org/resource/George_I_of_Greece
v10_1475_4,4,46,Countess Louise Sophie of Danneskiold-Samsøe,http://dbpedia.org/resource/Countess_Louise_Sophie_of_Danneskiold-Samsøe
v10_1475_4,4,47,Christian V of Denmark,http://dbpedia.org/resource/Christian_V_of_Denmark
v10_1475_4,4,48,Princess Helena of the United Kingdom,http://dbpedia.org/resource/Princess_Helena_of_the_United_Kingdom
v10_1475_4,4,49,L. o. Mecklenburg-Strelitz,http://dbpedia.org/resource/Louise_of_Mecklenburg-Strelitz
v10_1475_4,4,50,"Frederick II, Landgrave of Hesse-Kassel",http://dbpedia.org/resource/Prince_Frederick_William_of_Hesse-Kassel
v10_1475_4,4,51,Christian V of Denmark,http://dbpedia.org/resource/Christian_V_of_Denmark
v10_1475_4,4,52,Princess Maria Antonietta of Bourbon-Two Sicilies,http://dbpedia.org/resource/Maria_Amalia_of_Naples_and_Sicily
v10_1475_4,4,53,Charles Emmanuel III of Sardinia,http://dbpedia.org/resource/Charles_Emmanuel_III_of_Sardinia
v10_1475_4,4,54,Charles Emmanuel III of Sardinia,http://dbpedia.org/resource/Charles_Emmanuel_III_of_Sardinia
v10_1475_4,4,55,George III of the United Kingdom,"http://dbpedia.org/resource/Prince_Adolphus,_Duke_of_Cambridge"
v10_1475_4,4,56,"Wilhelm II, German Emperor","http://dbpedia.org/resource/Wilhelm_II,_German_Emperor"
v10_1475_4,4,57,"Prince Arthur, Duke of Connaught and Strathearn","http://dbpedia.org/resource/Prince_Arthur,_Duke_of_Connaught_and_Strathearn"
v10_1475_4,4,58,A. P. Consort,"http://dbpedia.org/resource/Albert,_Prince_Consort"
v10_1475_4,4,59,Archduchess Augusta of Austria,http://dbpedia.org/resource/Archduchess_Auguste_Ferdinande_of_Austria
v10_1475_4,4,60,"Isabel, Princess Imperial of Brazil","http://dbpedia.org/resource/Isabel,_Princess_Imperial_of_Brazil"
v10_1475_4,4,61,Francis I of the Two Sicilies,http://dbpedia.org/resource/Maria_Theresa_of_Naples_and_Sicily
v10_1475_4,4,62,"Isabel, Princess Imperial of Brazil","http://dbpedia.org/resource/Isabel,_Princess_Imperial_of_Brazil"
v10_1475_4,4,63,Alexander I of Yugoslavia,http://dbpedia.org/resource/Alexander_I_of_Yugoslavia
v10_1475_4,4,64,George I of Greece,http://dbpedia.org/resource/George_I_of_Greece
v10_1475_4,4,65,Prince Alfred of Liechtenstein,http://dbpedia.org/resource/Prince_Alfred_of_Liechtenstein
v10_1475_4,4,66,Ewa Józefina Julia Potocka,http://dbpedia.org/resource/Ewa_Józefina_Julia_Potocka
v10_1475_4,4,67,George III of the United Kingdom,"http://dbpedia.org/resource/Prince_Adolphus,_Duke_of_Cambridge"
v10_1475_4,4,68,Ferdinand II of the Two Sicilies,http://dbpedia.org/resource/Charles_III_of_Spain
v10_1475_4,4,69,Infanta Amelia Philippina of Spain,http://dbpedia.org/resource/Infanta_Amalia_of_Spain
v10_1475_4,4,70,"Georg Donatus, Hereditary Grand Duke of Hesse","http://dbpedia.org/resource/Georg_Donatus,_Hereditary_Grand_Duke_of_Hesse"
v10_1475_4,4,71,"Louis II, Grand Duke of Hesse","http://dbpedia.org/resource/Louis_II,_Grand_Duke_of_Hesse"
v10_1475_4,4,72,Leopold III of Belgium,http://dbpedia.org/resource/Leopold_III_of_Belgium
v10_1475_4,4,73,Maria Carolina of Austria,http://dbpedia.org/resource/Maria_Carolina_of_Austria
v10_1475_4,4,74,Prince Albert of Prussia,"http://dbpedia.org/resource/Wilhelm_II,_German_Emperor"
v10_1475_4,4,75,Frederick William III of Prussia,"http://dbpedia.org/resource/Frederick_III,_German_Emperor"
v10_1475_4,4,76,E. VII,http://dbpedia.org/resource/Edward_VII
v10_1475_4,4,77,George III of the United Kingdom,"http://dbpedia.org/resource/Prince_Adolphus,_Duke_of_Cambridge"
v10_1475_4,4,78,"Thomas, 2nd Duke of Genoa","http://dbpedia.org/resource/Thomas_Howard,_21st_Earl_of_Arundel"
v10_1475_4,4,79,"Wilhelm II, German Emperor","http://dbpedia.org/resource/Wilhelm_II,_German_Emperor"
v10_1475_4,4,80,Infanta María de la Paz of Spain,http://dbpedia.org/resource/Infanta_María_de_la_Paz_of_Spain
v10_1475_4,4,81,"Ludwig I, King of Bavaria",http://dbpedia.org/resource/Ludwig_I_of_Bavaria
v10_1475_4,4,82,T. Ollius,http://dbpedia.org/resource/Titus_Ollius
v10_1475_4,4,83,"Ernest Leopold, Landgrave of Hesse-Rotenburg","http://dbpedia.org/resource/Ernest_Leopold,_Landgrave_of_Hesse-Rotenburg"
v10_1475_4,4,84,L. Bonaparte,http://dbpedia.org/resource/Jérôme_Bonaparte
v10_1475_4,4,85,"Philippe II, Duke of Orléans","http://dbpedia.org/resource/Louis_Philippe_II,_Duke_of_Orléans"
v10_1475_4,4,86,"Philippe I, Duke of Orléans","http://dbpedia.org/resource/Louis_Philippe_II,_Duke_of_Orléans"
v10_1475_4,4,87,Louis XIII of France,http://dbpedia.org/resource/Louis_XIII_of_France
v10_1475_4,4,88,"Philippe I, Duke of Orléans","http://dbpedia.org/resource/Louis_Philippe_II,_Duke_of_Orléans"
v10_1475_4,4,89,Louis XV of France,http://dbpedia.org/resource/Louis_XV_of_France
v10_1475_4,4,90,"William I, Count of Hainaut","http://dbpedia.org/resource/William_I,_Duke_of_Bavaria"
v10_1475_4,4,91,Henry IV of England,http://dbpedia.org/resource/William_IV_of_the_United_Kingdom
v10_1475_4,4,92,"Lionel of Antwerp, 1st Duke of Clarence","http://dbpedia.org/resource/Lionel_of_Antwerp,_1st_Duke_of_Clarence"
v10_1475_4,4,93,M. o. Bavaria,http://dbpedia.org/resource/Maximilian_I_Joseph_of_Bavaria
v10_1475_4,4,94,"Frederick I, Holy Roman Emperor","http://dbpedia.org/resource/Charles_V,_Holy_Roman_Emperor"
v10_1475_4,4,95,"Wolfgang William, Count Palatine of Neuburg","http://dbpedia.org/resource/Wolfgang_Wilhelm,_Count_Palatine_of_Neuburg"
v10_1475_4,4,96,L. G. Dauphin,"http://dbpedia.org/resource/Louis,_Grand_Dauphin"
v10_1475_4,4,97,"Charles, Count of Valois",http://dbpedia.org/resource/Charles_the_Bold
v10_1475_4,4,98,Henry I of France,http://dbpedia.org/resource/Henry_IV_of_France
v10_1475_4,4,99,"Charles V, Holy Roman Emperor","http://dbpedia.org/resource/Charles_VI,_Holy_Roman_Emperor"
v10_1475_4,4,100,A. o. Austria,http://dbpedia.org/resource/Franz_Joseph_I_of_Austria
v10_1475_4,4,101,Louis IX of France,http://dbpedia.org/resource/Louis_IX_of_France
v10_1475_4,4,102,Naungdawgyi,http://dbpedia.org/resource/Naungdawgyi
v10_1475_4,4,103,Georgians,http://dbpedia.org/resource/Georgia_O'Keeffe
v10_1475_4,4,104,J. Kaeo,http://dbpedia.org/resource/Joshua_Kaeo
v10_1475_4,4,105,"Alexander Karađorđević, Prince of Serbia","http://dbpedia.org/resource/Alexander_Karađorđević,_Prince_of_Serbia"
v10_1475_4,4,106,Afonso IV of Portugal,http://dbpedia.org/resource/Afonso_IV_of_Portugal
v10_1475_4,4,107,M. o. Yugoslavia,http://dbpedia.org/resource/Maria_of_Yugoslavia
v10_1475_4,4,108,John IV of Portugal,http://dbpedia.org/resource/John_IV_of_Portugal
v10_1475_4,4,109,Princess Ida of Anhalt-Bernburg-Schaumburg-Hoym,http://dbpedia.org/resource/Princess_Ida_of_Anhalt-Bernburg-Schaumburg-Hoym
v10_1475_4,4,110,Prince Georg Ludwig of Holstein-Gottorp,http://dbpedia.org/resource/Prince_Georg_Ludwig_of_Holstein-Gottorp
v10_1475_4,4,111,D. o. Aragon,http://dbpedia.org/resource/Ferdinand_II_of_Aragon
v10_1475_4,4,112,"Isabel, Princess Imperial of Brazil","http://dbpedia.org/resource/Isabel,_Princess_Imperial_of_Brazil"
v10_1475_4,4,113,Pedro I of Brazil,http://dbpedia.org/resource/Pedro_I_of_Brazil
v10_1475_4,4,114,Maria Anna of Austria,http://dbpedia.org/resource/Maria_Anna_of_Spain
v10_1475_4,4,115,C. Buonaparte,http://dbpedia.org/resource/Napoleon
v10_1475_4,4,116,Constantine I of Greece,http://dbpedia.org/resource/Constantine_I_of_Greece
v10_1475_4,4,117,Á. dynasty,http://dbpedia.org/resource/Ashoka
v10_1475_4,4,118,K. Nyáry,http://dbpedia.org/resource/Krisztina_Nyáry
v10_1475_4,4,119,B. name,http://dbpedia.org/resource/Billy_Name
v10_1475_4,4,120,"Vladislaus II, Duke of Bohemia","http://dbpedia.org/resource/Vladislaus_II,_Duke_of_Bohemia"
v10_1475_4,4,121,"Ludwig I, King of Bavaria",http://dbpedia.org/resource/Ludwig_I_of_Bavaria
v10_1475_4,4,122,"Matilda of England, Duchess of Saxony","http://dbpedia.org/resource/Matilda_of_England,_Duchess_of_Saxony"
v10_1475_4,4,123,"Otto II, Holy Roman Emperor","http://dbpedia.org/resource/Charles_V,_Holy_Roman_Emperor"
v10_1475_4,4,124,O. t. Great,http://dbpedia.org/resource/William_IV_of_the_United_Kingdom
v10_1475_4,4,125,H. t. Fowler,http://dbpedia.org/resource/Henry_the_Fowler
v10_1475_4,4,126,H. v. Bismarck,http://dbpedia.org/resource/Herbert_von_Bismarck
v10_1475_4,4,127,Oscar I of Sweden,http://dbpedia.org/resource/Oscar_I_of_Sweden
v10_1475_4,4,128,Grand Duke Konstantin Nikolayevich of Russia,http://dbpedia.org/resource/Grand_Duke_Konstantin_Nikolayevich_of_Russia
v10_1475_4,4,129,Haakon VII of Norway,http://dbpedia.org/resource/Haakon_VII_of_Norway
v10_1475_4,4,130,Haakon VI of Norway,http://dbpedia.org/resource/Haakon_VI_of_Norway
v10_1475_4,4,131,"Ranuccio II Farnese, Duke of Parma","http://dbpedia.org/resource/Ranuccio_II_Farnese,_Duke_of_Parma"
v10_1475_4,4,132,A. B. Caesonia,http://dbpedia.org/resource/Atia_(mother_of_Augustus)
v10_1475_4,4,133,Bayinnaung,http://dbpedia.org/resource/Bayinnaung
v10_1475_4,4,134,M. G. Beg,http://dbpedia.org/resource/Mirza_Ghiyas_Beg
v10_1475_4,4,135,T. P. Mikasa,"http://dbpedia.org/resource/Takahito,_Prince_Mikasa"
v10_1475_4,4,136,E. Taishō,http://dbpedia.org/resource/Emperor_Taishō
v10_1475_4,4,137,Porphyrogennetos,http://dbpedia.org/resource/Constantine_VII
v10_1475_4,4,138,Henry IV of France,http://dbpedia.org/resource/Henry_IV_of_France
v10_1475_4,4,139,Alexander II of Russia,http://dbpedia.org/resource/Alexander_I_of_Russia
v10_1475_4,4,140,N. Kim,http://dbpedia.org/resource/Nellie_Kim
v10_1475_4,4,141,A. t. Elder,http://dbpedia.org/resource/Agrippina_the_Elder
v10_1475_4,4,142,Livia,http://dbpedia.org/resource/Livia
v10_1475_4,4,143,A. t. Younger,http://dbpedia.org/resource/Agrippina_the_Younger
v10_1475_4,4,144,Alaungpaya,http://dbpedia.org/resource/Alaungpaya
v10_1475_4,4,145,L. Bonaparte,http://dbpedia.org/resource/Jérôme_Bonaparte
v10_1475_4,4,146,N. I,http://dbpedia.org/resource/Pope_Nicholas_I
v10_1475_4,4,147,C. Buonaparte,http://dbpedia.org/resource/Napoleon
v10_1475_4,4,148,L. Bonaparte,http://dbpedia.org/resource/Jérôme_Bonaparte
v10_1475_4,4,149,N. Tadayasu,http://dbpedia.org/resource/Nakayama_Tadayasu
v10_1475_4,4,150,Ş. Hanımefendi,http://dbpedia.org/resource/Şayeste_Hanım
v10_1475_4,4,151,Keaweaheulu,http://dbpedia.org/resource/Keawe-a-Heulu
v10_1475_4,4,152,K. I,http://dbpedia.org/resource/Kamehameha_I
v10_1475_4,4,153,S. o. Merenberg,http://dbpedia.org/resource/Sophie_of_Merenberg
v10_1475_4,4,154,Lope Díaz II de Haro,http://dbpedia.org/resource/Lope_Díaz_III_de_Haro
v10_1475_4,4,155,Daudi Cwa II of Buganda,http://dbpedia.org/resource/Daudi_Cwa_II_of_Buganda
v10_1475_4,4,156,D. Shikoh,http://dbpedia.org/resource/Dara_Shukoh
v10_1475_4,4,157,Abdul Hasan Asaf Khan,http://dbpedia.org/resource/Abu'l-Hasan_Asaf_Khan
v10_1475_4,4,158,Baha al-Din Sam I,http://dbpedia.org/resource/Baha_al-Din_Sam_I
v10_1475_4,4,159,A. b. Yahya,http://dbpedia.org/resource/Ahmad_bin_Yahya
v10_1475_4,4,160,Aurangzeb,http://dbpedia.org/resource/Aurangzeb
v10_1475_4,4,161,J. Shah,http://dbpedia.org/resource/Jahandar_Shah
v10_1475_4,4,162,Jahangir,http://dbpedia.org/resource/Jahangir
v10_1475_4,4,163,Aurangzeb,http://dbpedia.org/resource/Aurangzeb
v10_1475_4,4,164,Hashim Jalilul Alam Aqamaddin,http://dbpedia.org/resource/Hashim_Jalilul_Alam_Aqamaddin
v10_1475_4,4,165,Aurangzeb,http://dbpedia.org/resource/Aurangzeb
v10_1475_4,4,166,Saadat Ali Khan II,http://dbpedia.org/resource/Ali
v10_1475_4,4,167,Firouz Mirza Nosrat-ed-Dowleh Farman Farmaian III,http://dbpedia.org/resource/Firouz_Nosrat-ed-Dowleh_III
v10_1475_4,4,168,R. Shāh,http://dbpedia.org/resource/Bahram_V
v10_1475_4,4,169,Mohammad Ali Shah Qajar,http://dbpedia.org/resource/Mohammad_Ali_Shah_Qajar
